"created_at","url","full_text","user_id_str"
"Fri Nov 30 23:33:33 +0000 2018","https://twitter.com/ProudSocialist/status/1068649265025544192","THE LIE:

White House said Mueller is undermining America’s relationship with Russia.

THE TRUTH:

Russia undermined its relationship with America when it attacked our election.

THE TREASON:

Trump betrayed America when he sided with Putin over US Intelligence in Helsinki.","755057897583804416"
"Fri Nov 30 23:34:14 +0000 2018","https://twitter.com/jsolomonReports/status/1068649436962832384","Trump, Russia and lessons from the mob: Did ‘godfathers’ steer collusion probe? https://t.co/OYYJGMSLw3","523248016"
"Fri Nov 30 23:47:58 +0000 2018","https://twitter.com/VICENews/status/1068652890192007170","I have nothing to do with Russia.
I have nothing to do with Russia.
I have nothing to do with Russia.
I have nothing to do with Russia.
I have nothing to do with Russia.
I have nothing to do with Russia.
I have nothing to do with Russia.
I have nothing to do with Russia. https://t.co/yTTycLfmQl","1630896181"
"Fri Nov 30 23:02:40 +0000 2018","https://twitter.com/TheEconomist/status/1068641489314562048","How the building of a bridge has increased tension between Russia and Ukraine https://t.co/B55GrxGYrI","5988062"
"Fri Nov 30 23:54:48 +0000 2018","https://twitter.com/jobahout/status/1068654608820699136","Amazing pic!
#US #Trump staring at #Saudi #MbS/#Russia #Putin’s high-five, at #G20EnArgentina https://t.co/NMz1CfPEpp","51875963"
"Fri Nov 30 23:37:25 +0000 2018","https://twitter.com/3L3V3NTH/status/1068650234459303936","How did they all know to lie about Russia?

Even Sessions-

Remember Kushner's press conference?","2976183585"
"Fri Nov 30 23:25:26 +0000 2018","https://twitter.com/tomorrawdotcom/status/1068647220315070465","High five between Russia's President Putin and Saudi Crown Prince Mohammed Bin Salman at the G20

https://t.co/bglY8PWeYB https://t.co/1TOWuEAEGA","766411449119932416"
"Fri Nov 30 23:34:15 +0000 2018","https://twitter.com/benigma2017/status/1068649440322437120","The fact that almost every Centrist driven ""Russia"" meme is some sort of ode to gay sex between Donald Trump and Vladimir Putin should give you a hint at how fond the Neoliberals really are of the LGBTQ community.","811514954159443968"
"Fri Nov 30 23:40:46 +0000 2018","https://twitter.com/GFilms7/status/1068651080182112261","Why does Trump keep embarrassing America? He looks tired and weak, especially when he sucks up to Putin! Keep the moron at home......Russia! https://t.co/2rTsVHyXb6","1140341359"
"Fri Nov 30 23:01:27 +0000 2018","https://twitter.com/RVAwonk/status/1068641184808140800","Kremlin spox Dmitry Peskov says the cancellation of the Trump-Putin meeting at the G20 summit will ""lead to more tensions.""

... pretty sure those tensions have more to do with Russia helping to install Trump in the first place, but ok.","2316383071"
"Fri Nov 30 23:18:17 +0000 2018","https://twitter.com/GregWest_HALOJM/status/1068645420589637632","Democrats: We need to be tougher on Russia!
Democrats: Let's cut the defense budget by $30 billion as part of our strategy to be tougher on Russia!","2680192368"
"Fri Nov 30 23:06:13 +0000 2018","https://twitter.com/MacMcKinseyIV/status/1068642382327889921","Donald Trump says he ""lightly"" looked at doing a building somewhere in Russia. Huh. Wonder if he also ""lightly"" grabbed women by the pussy? https://t.co/SuaGXKbxbZ","931567118545330176"
"Fri Nov 30 23:07:13 +0000 2018","https://twitter.com/TheBeatWithAri/status/1068642634024001537","WATCH: President Trump goes from ""I have no deals in Russia, I have no deals that could happen in Russia""

To saying he lightly looked at deals in Russia: https://t.co/4ncRJseoWo","887418059501305858"
"Fri Nov 30 23:29:13 +0000 2018","https://twitter.com/tinfoilhatswarm/status/1068648173680259072","Yeah they’re worried about their sources being revealed and not that they participated in one of the biggest spying scandals ever! 
MI6 Scrambling To Stop Trump From Releasing Classified Docs In Russia Probe | Zero Hedge https://t.co/6N3gRKk3I5","870899004086788096"
"Fri Nov 30 23:14:09 +0000 2018","https://twitter.com/TheBeatWithAri/status/1068644379559108608","""The Russians own him, they have owned him since the early 90s""

@EleanorClift on Trump admitting to ""lightly"" look at a deal in Russia during 2016 campaign: https://t.co/mp36eE1zyn","887418059501305858"
"Fri Nov 30 23:04:21 +0000 2018","https://twitter.com/Laurab4redux/status/1068641916399640576","Michael Cohen’s guilty plea proves the House GOP’s Russia investigation was a sham

https://t.co/4qJPzBSxU7","2271700413"
"Fri Nov 30 23:10:11 +0000 2018","https://twitter.com/HillaryIsComing/status/1068643381029543936","If “US Leaders Who Predicted Russia Would Rig the Election” was a Jeopardy category, Hillary Clinton would be the answer to every question under that topic. https://t.co/wN2VlP3AYj","3349433536"
"Fri Nov 30 23:15:17 +0000 2018","https://twitter.com/OfficialNolay/status/1068644667686830080","🚨🚨🚨🚨🚨🚨🚨🚨🚨🚨 
Next Friday I’ll be back live in #Russia 🇷🇺 again at #ModClub for #GunFinger and it’s going to be a BIG SHELL DOWN 🎤💥 💥 💥 💥 🤷🏽‍♀️🤷🏽‍♀️🤷🏽‍♀️🔥🔥🔥🔥🔥🔥🔥 https://t.co/CjsIV7Mvlz","50623552"
"Fri Nov 30 23:44:48 +0000 2018","https://twitter.com/LarrySchweikart/status/1068652094930874370","Mueller Takes Aim, But Is Trump in Trouble? via @thenation https://t.co/EDqDr2KYWk

1) ""With the Russia investigation’s catalysts coming up all but empty, there is little reason to expect that the remaining campaign members who face prison time will reverse that trend.""","562255311"
"Fri Nov 30 23:20:58 +0000 2018","https://twitter.com/psychdr100/status/1068646096203726849","POTUS is completely compromised due to all that Putin can reveal about Trump's  close business ties with Russia.  Trump is more scared of Vladimir Putin than Robert Mueller: national security expert https://t.co/o9sxJTRO07","845392971381927936"
"Fri Nov 30 23:35:35 +0000 2018","https://twitter.com/oscar__said/status/1068649775610908672","@realDonaldTrump But you said you never looked or did any business with Russia sooooooooo https://t.co/iFIp3nEMad","797530043236892672"
"Fri Nov 30 23:45:56 +0000 2018","https://twitter.com/wvjoe911/status/1068652378994470912","CNN’s Phill Mudd slams Trump for weakening the US-Europe relations over Russia: ‘How can they trust us?’ https://t.co/2tZYpaNwBV","291774022"
"Fri Nov 30 23:36:04 +0000 2018","https://twitter.com/MorrighanPSL/status/1068649896465465344","The US literally has it in their national security policy that the central focus is no longer the ""war on terror"" but ""great power conflicts"" between the US and Russia, China, or both,and y'all are out here thinking that the US ISN""T going to be pumping out propoganda????? FOH.","1520839758"
"Fri Nov 30 23:24:34 +0000 2018","https://twitter.com/RobinHessChubb/status/1068647000730669056","@realDonaldTrump You said you had no ties to Russia... within the last 24 hours, you've back tracked and restated that you were in fact having a business relationship with Russia...you have lied time and time again..","922831819820748800"
"Fri Nov 30 23:25:50 +0000 2018","https://twitter.com/AgingEnds/status/1068647319229349888","@funder SO YOU are saying a construction magnet that builds structures-buildings around the earth in all nations. Would consider working and building in Russia? OH MY GOD, WHAT A FIND YOU HAVE MADE. CNN-NBC-ABC-PBS-CBS are needing great liars like you. Did you hear? you can like accosta! https://t.co/Mzp5CCz8xh","936341764465676288"
"Fri Nov 30 23:44:16 +0000 2018","https://twitter.com/TheStudyofWar/status/1068651958377041921","Russia's brazen act of war against Ukraine is part of a concerted Kremlin campaign -- unfolding on a global scale -- to test the West. Will the U.S. and its allies rise to the challenge? https://t.co/7lyPGh4JYy #Russia #Ukraine #NATO #SeaOfAzov https://t.co/dezmRNJPDA","71298686"
"Fri Nov 30 23:35:02 +0000 2018","https://twitter.com/TxsleuthUSA/status/1068649634518786049","I'm getting a wee bit (okay a lot) worried by the ""legal experts"" I've seen on cable news the last 2 days who seem uncertain that Trump signing letter of intent for tower in Russia w/penthouse for Putin during the campaign, while Russia is hacking DNC, is a crime. WTH? Treason?","18083420"
"Fri Nov 30 23:57:53 +0000 2018","https://twitter.com/marcushjohnson/status/1068655387661004800","The alt-left was and is absolutely a thing, they were the people saying Dems needed to drop race and start working the with alt right to stop the ""global elites,"" who gave Russia and Wikileaks cover at every turn in 2016, who pushed conspiracy theories about the DNC","23031094"
"Fri Nov 30 23:14:17 +0000 2018","https://twitter.com/RobertCashmanSr/status/1068644414493474817","The GOP GOVERNORS should go after ALL GOP MEMBERS WHO HAVE ACCEPTED, UP TO THE PRESENT, FUNDS FROM NRA, FOREIGN GOVERNMENTS, AND ORGANIZATIONS THAT GIVE THEM MONEY THAT MAY HAVE COME FROM RUSSIA!!!","305877472"
"Fri Nov 30 23:07:40 +0000 2018","https://twitter.com/SAdemocrat/status/1068642749111566342","If one goes, they all go!  Pence is up to his eyeballs in the Russia Shit too! He was head if transition remember!","849643892714622976"
"Fri Nov 30 23:09:08 +0000 2018","https://twitter.com/TimHannan/status/1068643118080245760","How long until Trump says ""Everyone knows I was colluding with Russia.  Nothing illegal. Just a little collusion.""","557334459"
"Fri Nov 30 23:52:37 +0000 2018","https://twitter.com/abdbozkurt/status/1068654063200407552","My latest article: The murder of the #Russia ambassador exposes #Erdogan’s jihadist friends https://t.co/xgd3HgB08U via @TurkishMinuteTM","823516964"
"Fri Nov 30 23:25:49 +0000 2018","https://twitter.com/CateM5550/status/1068647317715116032","@VickerySec @tedcruz HEY TEXANS!! This is who you chose, Over @BetoORourke !! WTH is wrong with you??

Russia lives in Texas?? O..M..G..😡😡😡 https://t.co/1k7Rps743X","705342716847128577"
"Fri Nov 30 23:25:33 +0000 2018","https://twitter.com/mayorNHL/status/1068647249549258753","If you're interested in the World Junior Championship, today's notebook has info on which LA Kings prospects are expected to make Team Canada, USA, Finland, Russia, etc.   https://t.co/d4UCKZBCas 

#WJC is only a few weeks away, brush up now. https://t.co/HUT059WApg","75107337"
"Fri Nov 30 23:28:04 +0000 2018","https://twitter.com/MillyMolly300/status/1068647881513480192","The UN Migration Pact is just another name for dumping Africans &amp; Muslims on the West because we're so tolerant/weak! Will Saudi be taking these folk in? Will Japan/China/Russia?? NO!! @smh @SkyNewsAust @AlanJones @ScottMorrisonMP @billshortenmp @canberratimes @age","1497105828"
"Fri Nov 30 23:50:58 +0000 2018","https://twitter.com/MarkGBblog/status/1068653646198554627","Here's the part where Mr Blank gives his suggestion to ""disrupt the bridge"" &amp; send in NATO ships...he adds that ""many will object that such an action constitutes a provocation of Russia"".
Anyone who doesn't argue that should ask their doctor to review their medication.
Idiot. https://t.co/PshKq1VCVk","835542998926622721"
"Fri Nov 30 23:42:02 +0000 2018","https://twitter.com/MillyMolly300/status/1068651396382175233","Yes of course. Saudi will never accept 'refugees' neither will China or Japan/Russia/India etc only the weak, submissive so called 'tolerant' West.","1497105828"
"Fri Nov 30 23:33:06 +0000 2018","https://twitter.com/gianthusker/status/1068649151519498242","@stephenfhayes The nothing to do with Russia statement is about the so called collusion, which he has none. There’s nothing illegal about him still being a business man while running for President. This isn’t that hard people.","282394490"
"Fri Nov 30 23:30:03 +0000 2018","https://twitter.com/whowhatwhy/status/1068648381092892673","Deutsche Bank is back in the news. German authorities raided its offices Thursday as part of a money laundering investigation. We’ve been looking closely at this bank and its strange relations to Trump, Russia, oligarchs, etc — here’s what we’ve found. https://t.co/SXt3pcNDzd https://t.co/1tDqYQfZkK","40094447"
"Fri Nov 30 23:34:02 +0000 2018","https://twitter.com/thebluenations/status/1068649386505326593","We know Trump is a coward and a whore, so he will assume his usual submissive posture towards Putin and MBS, but what of the other leaders at the G20?  Will anyone criticize Russia's actions in Ukraine or MBS' murder of Khashoggi?  Will anyone stand up for the rule of law?","2758837401"
"Fri Nov 30 23:10:01 +0000 2018","https://twitter.com/AriyaDas/status/1068643340311281664","@NPR This is a major story to get completely wrong. It is remarkable how so many media organizations publish fake news about the Trump family and Russia. These “corrections” poorly reflect on journalistic standards and low approval rating of the media as a whole.","36974996"
"Fri Nov 30 23:26:41 +0000 2018","https://twitter.com/cooperchip1/status/1068647536666251265","Rubin: The theories suggest there could be treasure trove of information Russia holds over Trump’s head. If nothing Trump did was illegal, he’d still be at the mercy of Putin because he has insisted so strenuously he has had no dealings with Russia. #Liar https://t.co/ccSJgBobVl","3197770658"
"Fri Nov 30 23:25:46 +0000 2018","https://twitter.com/CNNSitRoom/status/1068647305090224128","""I think it's clear to anyone who understands these issues that Russia is the primary villain for undermining the relationship with the United States,"" says former Defense Secretary Leon Panetta, reacting to WH claims the Mueller investigation undermines US/Russia relationship https://t.co/PvrFiSpAmb","34310801"
"Fri Nov 30 23:39:01 +0000 2018","https://twitter.com/MillyMolly300/status/1068650639406723072","This new UN Migrant Pact is corrupt, refugees become 'stakeholders'? Although not 'legally binding' it is politically binding &amp; can be used by judges as something to follow in future. Saudi will not be accepting 'refugees' on spurious grounds, neither will China/Japan/Russia.@smh","1497105828"
"Fri Nov 30 23:18:53 +0000 2018","https://twitter.com/Cernovich/status/1068645571555078144","NPR had to retract a story about Don Jr and Russia today.

CNN and MSNBC had to retract a story “confirmed” by two sources re: @DonaldJTrumpJr and Wikileaks.

Are there any stories favorable to Trump that had to be retracted? 

In an honest system, errors would go both ways.","358545917"
"Fri Nov 30 23:21:36 +0000 2018","https://twitter.com/cooperchip1/status/1068646254752731138","Ex-CIA:  “If we had never learned of it, Russia would have had in its kit bag an email from [Trump, Jr.] saying ‘I’d love some dirt on Hillary from Russia.’ And could have threatened to reveal it at any time.” #Compromised #PutinsPuppet #Collusion  https://t.co/ccSJgBobVl","3197770658"
"Fri Nov 30 23:13:50 +0000 2018","https://twitter.com/ELINTNews/status/1068644300609777665","#UPDATE: It is now December 1st in Russia, meaning the large-scale readiness check of all of the Southern Military District’s combined arms armies, Black Sea Fleet, Caspian Flotilla, 4th Air &amp; Air Defence Forces Army and training facilities starts today https://t.co/IVimrOb7bS","841694471293173760"
"Fri Nov 30 23:32:49 +0000 2018","https://twitter.com/john003/status/1068649076416237568","@afneil Russia has done some very bad things in Georgia and Crimea.....However so has the western powers....17 year $7 trillion war on terror has killed over 1 million people and made 12 million refugees....Russia saved Syria from a Sunni Jahadi Whabbi take over.....","33682290"
"Fri Nov 30 23:24:24 +0000 2018","https://twitter.com/cooperchip1/status/1068646961417457665","Rubin: What emerges is the story of a man indebted to Russia through the oligarchs that President Vladimir Putin helped create and now controls. #Compromised #TreasonSummit #PutinsPenthouse #Collusion  https://t.co/ccSJgBobVl","3197770658"
"Fri Nov 30 23:17:11 +0000 2018","https://twitter.com/morganarae/status/1068645145698951168","@Ange_Amene He’s not a Democrat. He’s a terrible candidate. NRA. Russia.","14111373"
"Fri Nov 30 23:58:43 +0000 2018","https://twitter.com/ChattenMirna/status/1068655594461118464","@realDonaldTrump At the 10-10-16 debate you said ""I know about Russia, but I know nothing about the inner workings of Russia. I don’t deal there. I have no businesses there. I have no loans from Russia."" You lie every time you talk about Russia. Your attorney lied to Congress. Not cool or legal.","1047281929215758336"
"Fri Nov 30 23:27:04 +0000 2018","https://twitter.com/SethAbramson/status/1068647632019644418","I was just asked on a podcast to discuss Trump's legal defenses to conspiracy charges in the Trump-Russia case. I enumerated them as follows:","3223426134"
"Fri Nov 30 23:46:50 +0000 2018","https://twitter.com/RawStory/status/1068652605910515717","CNN’s Phill Mudd slams Trump for weakening the US-Europe relations over Russia: ‘How can they trust us?’

https://t.co/aUSULtovoL","16041234"
"Fri Nov 30 23:25:00 +0000 2018","https://twitter.com/JumboElliott76/status/1068647112504733696","So now we have to question why Trump had fired FBI officials who were connected to chasing down Russia for many many loyal years of service to America. All to cover up his corruption? Is that why he and FOX with talk radio demonized our FBI and Justice department ??","3442699455"
"Fri Nov 30 23:43:49 +0000 2018","https://twitter.com/Budapestian1/status/1068651848511496193","@ilcapitanCristo @MehmtKosucuoglu @DimitarBechev Maybe you know things I don’t...
I thought that they don’t like Prespa’s “agreements” and the term Macedonia given to people non Hellenic.
Not sure what Russia has to do with it.
I guess Erdogan might be more interested in causing conflict...","1057205367921348609"
"Fri Nov 30 23:13:11 +0000 2018","https://twitter.com/business/status/1068644135949742081","Russia's Peskov shares 2016 emails from ex-Trump lawyer Michael Cohen https://t.co/2a7EckPboi","34713362"
"Fri Nov 30 23:40:17 +0000 2018","https://twitter.com/TrickFreee/status/1068650958102491141","Putin &amp; Trump: Tensions mounting between Russia &amp; U.S. over Mueller investigation

Ukraine: Bullshit","46240599"
"Fri Nov 30 23:23:00 +0000 2018","https://twitter.com/VonnieCalland/status/1068646608894652417","Please don’t forget this. 👇 

“After all, he is one of the most hawkish, anti-Russia figures in Republican Party foreign policy circles. And yet the video recorded by Bolton was used by this obscure Russian gun rights group with ties to the Kremlin.”
https://t.co/mqLYhkOFEB","45834623"
"Fri Nov 30 23:39:18 +0000 2018","https://twitter.com/AdamsFlaFan/status/1068650711964155906","Donald Trump's ex-lawyer fixer just undermined one of his key arguments about Russia https://t.co/L5HEquGwTu","87957969"
"Fri Nov 30 23:13:01 +0000 2018","https://twitter.com/nedryun/status/1068644094593900544","Ummm, he didn’t have anything to do with Russia re elections. But if you want to conflate a potential business deal that never happened with some weird triple bounce shot of collusion, well by all means, Omidyar it. Omidyar it real good.","15455253"
"Fri Nov 30 23:28:37 +0000 2018","https://twitter.com/LutonEye/status/1068648022085652480","@afneil Democracy may have stagnated, but there is no democracy in SA and only the illusion of it in Russia. They are dictatorships in all but name. And dictators are always dangerous.","509912962"
"Fri Nov 30 23:35:04 +0000 2018","https://twitter.com/RCdeWinter/status/1068649645100974082","As it should...and those questions should be thoroughly investigated and answered,
#MichaelCohen 
#DrumpfJr
#Russia
https://t.co/eaGK8QzShh","41207820"
"Fri Nov 30 23:30:13 +0000 2018","https://twitter.com/VICENews/status/1068648423476334592","Democrats are finding it harder not to talk about impeachment after latest Trump-Russia revelations https://t.co/ge1XJWeSD2","1630896181"
"Fri Nov 30 22:45:11 +0000 2018","https://twitter.com/jedshug/status/1068637092023025664","Another smart @slate piece by ⁦@davidrlurie⁩ on some potential unintended consequences of the House Intelligence Committee's Russia ""investigation."" Hubris breeds lies, and here those lies may be crimes.
Follow ⁦@davidrlurie⁩! https://t.co/wVSRbJsTZB","231328483"
"Fri Nov 30 23:29:02 +0000 2018","https://twitter.com/JudyWoodruff/status/1068648127056551941","""the 2016 effort was a capstone on a 30 year effort to build a Trump hotel in Russia"" @MateaGold tells @LisaDNews of this week's revelations by former Trump attorney #MichaelCohen about work for Trump while a candidate @NewsHour tonight","48144950"
"Fri Nov 30 23:46:50 +0000 2018","https://twitter.com/atrupar/status/1068652604878671872","1. Trump did not talk about doing business in Russia during the campaign. In fact he said he had no interest in it at all. 

2. Trump’s new narrative doesn’t explain why he has spent 2.5 years lying about Russia.

3. This is desperate gaslighting.","288277167"
"Fri Nov 30 23:55:26 +0000 2018","https://twitter.com/flipped54/status/1068654770620116992","@DonaldJTrumpJr 72 hours! That’s how long Cohen talked to special counsel about individual1 and Individual1’s family especially individual1 jr. all about #Russia 🍿🍷🥳","33963439"
"Fri Nov 30 23:50:09 +0000 2018","https://twitter.com/TheLastWord/status/1068653439553548289","Trump, Russia spar over why he ditched Putin meeting
https://t.co/24ENeaUYOQ https://t.co/A1OSL5HONA","182503471"
"Fri Nov 30 23:11:36 +0000 2018","https://twitter.com/chris121710/status/1068643737025290240","@realDonaldTrump Now you say you ""lightly"" had dealings in Russian, but yet when you were running for president you said MULTIPLE times that you had ""ZERO DEALINGS"" (your own quote) in Russia. Which is it? You lying then or now???
#TrumpLiesEverytimeHeSpeaks","256850304"
"Fri Nov 30 23:29:19 +0000 2018","https://twitter.com/world_reporter/status/1068648199416659969","Russia's Peskov Shares 2016 Emails From Ex-Trump Lawyer Cohen - Bloomberg https://t.co/gNHx5uH67V","185335529"
"Fri Nov 30 23:47:13 +0000 2018","https://twitter.com/JMGlachant/status/1068652701649707010","May 2018
Sberbank, Russia’s largest bank, published a highly critical report on Gazprom’s various pipeline projects
Its main conclusion: none of them makes commercial sense

After political backlash, the author of the report has been sacked from the bank https://t.co/R1f14TLOA5","1498342616"
"Fri Nov 30 23:41:40 +0000 2018","https://twitter.com/CheriJacobus/status/1068651306225725440","""informal Trump adviser Stone meeting in May 2016 with a Russian who — you guessed it — was offering dirt on Hillary Clinton. The meeting was arranged by Caputo, an official member of Trump's campaign who had previously worked in Russia.""   Caputo &amp; Stone lied to Congress.","467726691"
"Fri Nov 30 23:30:00 +0000 2018","https://twitter.com/MoscowTimes/status/1068648368849600512","Prison guards can no longer use wardens’ orders as an excuse to torture inmates, Russia’s Supreme Court rules
https://t.co/N6aCNkcnlU https://t.co/nODzrSN746","19527964"
"Fri Nov 30 23:56:00 +0000 2018","https://twitter.com/CSIS/status/1068654911808622593","For a continent bitterly—and, often, needlessly— divided by pipelines, TurkStream offers an opportunity to depoliticize gas and show that new infrastructure can be a win-win for Russia and Europe. https://t.co/ekIz527UtT","272019676"
"Fri Nov 30 23:10:49 +0000 2018","https://twitter.com/dipper4tp/status/1068643540681596928","@realDonaldTrump You're right. That would be ridiculous. Except:

* ""Russia, find the 33,000 emails.""
* Meeting in Trump Tower
* Manafort in Ecuador
* Literally almost two years to mention this and didn't","23483753"
"Fri Nov 30 23:56:07 +0000 2018","https://twitter.com/twodogsmama/status/1068654940527054849","@bryanbehar The country is divided and weakened. Remember what Khrushchev said about not firing a shot. Russia plays the long game.","3311168042"
"Fri Nov 30 23:22:41 +0000 2018","https://twitter.com/ELINTNews/status/1068646526736568322","#UPDATE: Additionally, on December 1st (today in Russia) TASS reports Russian armed forces of the Central Military District will begin preparations for the military manoeuvres ""Centre-2019” https://t.co/uezeMZmcxE","841694471293173760"
"Fri Nov 30 23:37:13 +0000 2018","https://twitter.com/jbadomics/status/1068650187596488705","@gametheorytoday OMG does Trump really have business dealings with Russia?!?!

UNPOSSIBLE!!!

🤣🤣🤣","87615156"
"Fri Nov 30 23:12:17 +0000 2018","https://twitter.com/bpolitics/status/1068643911093182465","Russia's Peskov shares 2016 emails from ex-Trump lawyer Michael Cohen https://t.co/ZaX1cpHgl0","564111558"
"Fri Nov 30 23:58:42 +0000 2018","https://twitter.com/JulietJeske/status/1068655591919357953","Prediction: Trump will say we should give back Alaska to Russia now that's it's broken after the earthquake.  He'll also blame the earthquake on poor Moose management.","19576400"
"Fri Nov 30 23:14:25 +0000 2018","https://twitter.com/DailyFXTeam/status/1068644447360040965","Putin's press secretary states Russia's lack of meeting with  Trump will ""lead to increasing global tensions"" following the US president's cancellation of the two country's meeting","28366310"
"Fri Nov 30 23:09:30 +0000 2018","https://twitter.com/morgfair/status/1068643209662758912","Wall Street Journal Corrects Story That ID’ed ‘Vladimir Trump’ as President of Russia https://t.co/Keh5Z7VD6y","156306739"
