created_at,url,full_text,user_id_str,user/location
Sun Jul 31 13:43:06 +0000 2022,https://twitter.com/caitoz/status/1553738022935355397,"If someone criticizing the most dangerous agendas of the most powerful and destructive government on earth looks like Russian propaganda or Chinese propaganda to you, it's because you yourself have been brainwashed by propaganda.",19899980,"Las Vegas, Nevada"
Sun Jul 31 22:21:20 +0000 2022,https://twitter.com/mueller_bot/status/1553868440166965249,"The Russian government interfered in the 2016 presidential election in sweeping and systematic fashion. Evidence of Russian government began to surface in mid-2016. v1, p1 #readthereport",1135982100581158912,"Connecticut, CT"
Sat Jul 30 15:20:44 +0000 2022,https://twitter.com/KareemRifai/status/1553400204682051585,"I would say an official Russian government account inciting and openly expressing a desire to commit war crimes goes slightly beyond ""hateful conduct"" but at least the tweet is hidden now. https://t.co/ehmoc8ZME0",2612045668,"Chicago metro area, Illinois"
Sat Jul 30 11:12:27 +0000 2022,https://twitter.com/_JakubJanda/status/1553337723594973186,Russian government have no right to stay online on Twitter as they openly advocate and support terrorism.,539010491,"Detroit, Michigan"
Sun Jul 31 16:20:29 +0000 2022,https://twitter.com/6079_WSmith/status/1553777629433667590,"The Russian government's mass murder of Ukrainian prisoners + attempt to blame enemies is a continuity in Russian history: during WWII the Soviet government murdered up to 40,000 prisoners in Ukraine and 22,000 Polish prisoners at Katyn, in both cases falsely blaming the Germans.",17556933,us
Sun Jul 31 16:52:19 +0000 2022,https://twitter.com/CommonSenseOnEU/status/1553785641212731394,"""An investigation carried out by the United States would later expose Russian interference in the referendum. This is still be be acknowledged by the UK government.""

What will it take to get full investigation to be carried out? We are at war now!
 https://t.co/TUrqLSXXTl",4895565605,"Miami, Florida"
Sun Jul 31 21:17:20 +0000 2022,https://twitter.com/henrietta_22/status/1553852334970736648,"No matter how hard I try I can't for the life of me understand voters who continue defending this government. They stand with Ukraine, despise what Russia is doing yet have no problem with Russian links with this government.",1062795891701153792,Alabama
Sun Jul 31 14:34:51 +0000 2022,https://twitter.com/JStrummered/status/1553751046203351040,"@Barc_Maker23 @EdwardTHardy @RMTunion No, it's a Brexity Tory thing. Meanwhile Brexit is a national disgrace and this government is bankrolled by Russian money. There has never been a more corrupt and treasonous government.",973945667889614848,"Indiana, IN"
Sun Jul 31 21:24:32 +0000 2022,https://twitter.com/_1Cloudy_1/status/1553854145567891457,"If it wasn’t for Lenin, Russian proto-fascist military officers would have taken over the Russian government like they had tried in July. There wasn’t really an option for bourgeoise democracy in Russia, it was the Bolsheviks or the fascists.",1018982700802367488,IN US
Sun Jul 31 07:24:29 +0000 2022,https://twitter.com/hamdansaad20/status/1553642739794952192,"The Russian government confirmed, in a statement published on its website, #Russia and #SaudiArabia's commitment to the OPEC Plus agreement for oil-exporting countries, and to ensure the stability of the global oil market.",1440622868245540868,us
Sat Jul 30 06:59:47 +0000 2022,https://twitter.com/JimmySecUK/status/1553274139494039553,"Twitter has apparently decided that the Russian government's calls for Ukrainian prisoners of war to be given a ""humiliating death"" is ""in the public's interest"". https://t.co/P7JXfNxWzD",4645237240,us
Sun Jul 31 02:58:03 +0000 2022,https://twitter.com/moinaksg/status/1553575689424556033,"This is BIG. 

Ukraine has started blacklisting  Indian officials! 

Ukraine has named the Chairperson of India’s National Security Advisory Board (NSAB), P.S. Raghavan, on a list of people allegedly promoting “Russian propaganda. 

Our government must give a befitting reply. 😡",1231484029,United States
Sun Jul 31 17:42:39 +0000 2022,https://twitter.com/jsolom100/status/1553798307356581888,How can the US government trade a Russian war criminal for Brittany Griner while thousands sit in U.S. prison for committing her same “crime?”,1291054164953509889,"Portland, Oregon"
Sat Jul 30 17:49:51 +0000 2022,https://twitter.com/RedBison/status/1553437733384867841,"DOJ: Ionov recruited political groups in FL, GA, and CA, 2014—2021, ""orchestrated a brazen influence campaign turning US political groups and US citizens into instruments of the Russian government.”
Russian Charged With Using US Groups to Spread Propaganda https://t.co/TSLvX62Zql",25781702,"Memphis, Tennessee"
Sat Jul 30 21:05:11 +0000 2022,https://twitter.com/simonbchen/status/1553486888002011136,"Russian government accounts' posts about NKVD and Azov prisoners (not reposting here) are horrible Internet spectacles. They reflect what Russian state supporters have believed in all along, for decades. Only now they're coming out of woodworks to speak openly what they believe.",919588789827203072,"Indiana, IN"
Sat Jul 30 21:26:39 +0000 2022,https://twitter.com/MarcVegan/status/1553492291104423936,Russian government leaders are evil barbaric war criminals moving the Russia nation back 200 years in time.,2516013102,us
Sun Jul 31 23:20:45 +0000 2022,https://twitter.com/DuerksenKen/status/1553883392550309889,"@McFaul Because the USA regime-changed Ukraine and installed a hand-picked anti-Russian government in 2015 and immediately empowered bona fide Nazi einsatzgruppen to begin a brutal ethnic cleansing operation against Russo-Ukrainians living right on the Russian border, fueled by US..(1/2)",4835772777,"Arlington, Virginia"
Sun Jul 31 20:00:31 +0000 2022,https://twitter.com/LorenTrager/status/1553833004069376000,@TimRunsHisMouth We don’t know if Griner did break the law. The Russian government is notorious for planting items on people they wish to detain. They also have a 99% conviction rate and use the prison system as a way of silencing opposition or to kidnap individuals to use as political leverage.,1347250964672118784,us
Sat Jul 30 15:51:11 +0000 2022,https://twitter.com/m1db/status/1553407868048646144,"@OlgaNYC1211 @natsechobbyist @RussianEmbassy @TwitterSupport Twitter should ban Accounts of War Criminals and Mass Murders (aka All Official Russian Government Accounts)

@TwitterSafety @Twitter",38108253,"Alabama, AL"
Sat Jul 30 11:36:00 +0000 2022,https://twitter.com/cms36/status/1553343648565284864,"They orchestrated a brazen influence campaign, turning U.S. political groups and U.S. citizens into instruments of the Russian government

Two guesses as to which groups, first one does not count. https://t.co/kD47TJrV1W",18046548,"Austin, Texas"
Sat Jul 30 20:31:41 +0000 2022,https://twitter.com/MickgCunningham/status/1553478457488805888,"Tories record in government. The 2 candidates for PM so focused on slagging each other off they unwittingly highlight the truth about their abject failure in government (except for billionaires, Russian oligarchs and huge companies who pay teeny tax whilst employees on zero hours",285159717,Montana
Sat Jul 30 20:25:28 +0000 2022,https://twitter.com/MonicaM444/status/1553476892891676672,Azov Regiment to Putin: ''You’ll be executed together with your jackals'' | Ukrainska Pravda—&gt; Russian government and military are terrorists. Designate them as such and treat them as such. Throw them out of every organization!!!!!  https://t.co/FyrXXd52an,1227445048574431234,"Louisiana, LA"
Sat Jul 30 21:09:49 +0000 2022,https://twitter.com/Sidcup_Labour/status/1553488053917913089,"Liz Truss calls her own government’s policies ‘Soviet’.

Might explain why the Conservative party aren’t returning their Russian funding? https://t.co/v5EGByx7d2",1087001988,DE
Sun Jul 31 11:58:46 +0000 2022,https://twitter.com/jlfletcher/status/1553711767703920643,"😱😱😱
Russian National Charged with Conspiring to Have U.S. Citizens Act as Illegal Agents of the Russian Government | OPA | Department of Justice https://t.co/3dAfgC6DG1",28826802,IN US
Sat Jul 30 19:15:49 +0000 2022,https://twitter.com/AdvocateMaurice/status/1553459366593953795,"@SerenaJB3 @dpatrikarakos There's no way the Russian government produced this. 

If it's not satire, as you claim, you'll have to provide good evidence that the Russian government produced this.",1378687400738762753,"Los Angeles, California"
Sat Jul 30 14:34:12 +0000 2022,https://twitter.com/Angela_Inca/status/1553388493300195328,Russian National Charged With Conspiring To Have U.S. Citizens Act As Illegal Agents Of The Russian Government. https://t.co/h6EiEZZtCk,27925412,MI
Sun Jul 31 08:08:07 +0000 2022,https://twitter.com/itscarterhughes/status/1553653723083051008,"US government is negotiating the release of a top Russian arms dealer in exchange for Brittney Griner. 

Fails to negotiate release of an American Embassy teacher, Marc Fogel serving 14yrs for same thing. 

An American Embassy teacher or a black, lesbian sports player?",248113252,"South Dakota, SD"
Sun Jul 31 16:57:00 +0000 2022,https://twitter.com/DemopJ/status/1553786820390969344,"""The Russian government has appointed Sergei Chirkov as acting head of the Pension Fund of the Russia Federation to replace Andrei Kigim, a decree showed on Sunday.""

https://t.co/SHsgDS4YpU",897673317838016512,"New Mexico, NM"
Sat Jul 30 16:05:08 +0000 2022,https://twitter.com/Ercoman/status/1553411381071863809,"@Karl_Was_Right We can hate both Bank of America and the Russian government, it’s not hard",45225662,Ohio
Sat Jul 30 17:09:39 +0000 2022,https://twitter.com/Kasparov63/status/1553427617625378816,"Was this not in your July 25 newsletter? ""ukraine is almost certain to lose significant territory to russia, beyond what it lost in the 2014 occupation""? And ""the russian government will annex the territory they’ve occupied""? This is what I refer to as the defeatist Kremlin line.",449588356,"Kentucky, KY"
Sat Jul 30 21:57:11 +0000 2022,https://twitter.com/lesiavasylenko/status/1553499976734593027,80% of #Russia believes tsar #putin acts in good faith and protects russian interests. The Germans believed that too about Hitler and nazi government /3,1219232377605644289,AL US
Sun Jul 31 12:19:19 +0000 2022,https://twitter.com/robert_bor/status/1553716939217928198,"The Russian government has stooped so low as to mass-murder prisoners of war entrusted to its care.

This case will enter our collective memory as a second Katyn Massacre and haunt Russia for a very long time.

This act of pure evil must be condemned without reservation. 10/10",324231462,U.S.A
Sun Jul 31 03:24:55 +0000 2022,https://twitter.com/hannahkauthor/status/1553582451493969920,Russian government is pressing Japanese government to tell what Russia thinks to the United States? They are trying to spread all the lies to all the surrounding areas. Russia is hopelessly stupid. They want democracy to collapse. Putin believes he will be able to.,931708220,"Milwaukee, Wisconsin"
Sat Jul 30 10:52:31 +0000 2022,https://twitter.com/insertuid/status/1553332706121064448,"@krides @Twitter @TwitterSupport To be fair, this shows the Russian government as an active supporter of war crimes, which is something that needs to be seen.",1525447454065405955,"Michigan, MI"
Sun Jul 31 17:04:32 +0000 2022,https://twitter.com/staunovo/status/1553788717755768835,"European governments have eased back on efforts to curb trade in Russian oil, delaying a plan to shut Moscow out of the vital Lloyd’s of London maritime insurance market and allowing some international shipments amid fears of rising crude prices #oott https://t.co/GLs3aFJoyY",597517815,MT
Sat Jul 30 15:06:59 +0000 2022,https://twitter.com/bluedanedawg/status/1553396747187040256,"@EnseySherwood Exactly! And Russia's lending a helping hand.

“Ionov allegedly orchestrated a brazen influence campaign, turning U.S. political groups and U.S. citizens into instruments of the Russian government,”

https://t.co/xyyi6foRjj",138112941,MO US
Sat Jul 30 20:07:57 +0000 2022,https://twitter.com/michaeldweiss/status/1553472485479301120,"Artillery specialists will no doubt weigh in, but if this had been a HIMARS strike, as the Russian government and its agents of influence insist, the damage would look a lot different. E.g. a mass of debris around the target site. Cc: @noclador",18025377,"Fresno, California"
Sat Jul 30 18:20:42 +0000 2022,https://twitter.com/markyboy720/status/1553445497402232832,"@BrugesGroup Need I remind you the UK government failed to investigate alleged Russian interference in Brexit. Now why could that be?

Who funds you, by the way?",1287775681296969728,"New York, NY"
Sun Jul 31 12:24:19 +0000 2022,https://twitter.com/Rimey_tig/status/1553718195659448322,"This is what we are seeing when @EUSR_Weber or @RolandKobia turn their eyes away from the concentration camps Tigrayans. EU rightfully condemns Russian government but looks away from its replica, Ethiopian government.",1481248391006932996,"San Jose, California"
Sun Jul 31 05:54:55 +0000 2022,https://twitter.com/JBelcourt73/status/1553620203292041221,"Look at the Russian government. About 22% of Russia's population is an ethnic minority, how many non-white faces do you see in the Kremlin? Non white faces among the oligarchs?  Oh, and Russia has more hate crime deaths per year than any ""western"" country.",283741098,us
Sun Jul 31 18:04:42 +0000 2022,https://twitter.com/JayinKyiv/status/1553803859306455040,"Serbia's invasion of Kosovo isn't a new war. It's just another front in Putin's war on Europe.

Western governments should immediately destroy every Russian pipeline to prevent large academic war.",1537130875296563200,U.S.A
Sat Jul 30 18:18:19 +0000 2022,https://twitter.com/rybanova171195/status/1553444894903046147,"From at least 2014 until 2022, Moscow resident Aleksandr Victorovich Ionov worked on behalf of the Russian government, under the supervision of the Russian Federal Security Service (FSB), the successor of the KGB. 

Continue reading at https://t.co/gjglvW2wLE | 10z viral",1056179778, 
Sun Jul 31 01:22:42 +0000 2022,https://twitter.com/fghrnuti/status/1553551695124131840,"“No genocide takes place without bystanders, who may not approve of the Russian government’s actions but do little to stop them.” https://t.co/tYhTt8icEN",1498881247560544256,SC
Sun Jul 31 21:21:57 +0000 2022,https://twitter.com/RaheemKassam/status/1553853495916351488,"Your friendly reminder that this week the DOJ quietly charged a Russian government agent who was aiding black supremacist, socialist groups in America: https://t.co/G0y8DwWMdl",125128723,"Fort Worth, Texas"
Sun Jul 31 15:36:08 +0000 2022,https://twitter.com/Whisky_Yak/status/1553766470584254471,"@Amb_Ulyanov @DeathsquadOslo Why, then, is the ICRC still being denied access to Ukrainian POWs? If the Russian government is open to having independent third parties investigate the claims, why continue to deny access?",1449991153,LA
Sun Jul 31 07:17:36 +0000 2022,https://twitter.com/Prettypoppett/status/1553641008310657024,@dw_russian @mustlovesnark Agreed. UK Government close the Russian Embassy NOW and throw those vile sub humans out of our country. Why should they be here? How dare they be here. We don’t want them here. UK supports Ukraine in every way.  Do the right thing and send them packing. Slava Ukraini.,921341253337403392,us
Sun Jul 31 21:06:01 +0000 2022,https://twitter.com/jerusalemprayer/status/1553849485209526278,"It's Not Just Ukraine

It's not just the freedom of the Jewish people in Ukraine that Russia is threatening. The Russian government has ordered the Jewish Agency to stop operations...to stop helping Jewish people who want to immigrate to...Read More: https://t.co/4OyGweTjPx https://t.co/PuuwjbvjBk",19433865,KS US
Sat Jul 30 15:59:32 +0000 2022,https://twitter.com/ulrichspeck/status/1553409970481373186,"""Berlusconi spoke to the Russian ambassador on the day that he withdrew his backing for Draghi’s government, according to reports in La Repubblica on Friday.""

Letta: ""We want to know whether it was Putin who brought down the Draghi government."" https://t.co/PZjePErXYb",50295156,"San Jose, California"
Sun Jul 31 04:58:08 +0000 2022,https://twitter.com/tonttu_torvinen/status/1553605912992092161,"@voiceofchina12 He does great work undermining Russian government's arguments ""by accident"".",1409453144950587395, 
Sat Jul 30 21:38:12 +0000 2022,https://twitter.com/mafevema/status/1553495199518801921,@JMPSimor This woman &amp; her husband are very likely still working for the Russian government,744593854419046400,NM US
Sat Jul 30 13:13:04 +0000 2022,https://twitter.com/sofrepofficial/status/1553368078150410241,Russian National Charged with Conspiring With Left Wing Groups to Act as Illegal Agents of the Russian Government https://t.co/kSUT3EkyZ5,445353382,us
Sun Jul 31 17:35:29 +0000 2022,https://twitter.com/eastflocsound/status/1553796503440949251,"'Comparing the Russian invasion of Chechnya &amp; Ukraine, he also highlights heightened resentment of Russian supremacy, mass killings of civilians, outdated warfare, lack of relevant skills, installment of a puppet government, &amp; peace talks to distract attention.' @engelhardt_x https://t.co/1ybkn4PVrj",1384957574181789700,NH
Sun Jul 31 08:23:48 +0000 2022,https://twitter.com/admcollingwood/status/1553657668513980417,"@ClarkeMicah @yetiskimo This poster is extremely suspicious. He is calling for the summary execution of all those the faceless bureaucrats decides have offered aid to the Russian government, and for the state to investigate *any public figure* who might have justified Russia's invasion. Joined May 2022.",825634536893591553,"Minneapolis, Minnesota"
Sat Jul 30 20:30:10 +0000 2022,https://twitter.com/TheChristianLft/status/1553478076616646656,"California secession movement was funded and directed by Russian intelligence agents, US government alleges (https://t.co/G9vxioqtXF)

TCL: What else is funded by Russian agents? Probably a lot more than most people think, including a former president. https://t.co/5TVFfKfvy9",128763392,us
Sat Jul 30 11:44:58 +0000 2022,https://twitter.com/DnipraHero/status/1553345907386728449,@TsurkanKate @Twitter You could argue that it is in the public's best interest to see how disgusting the Russian government is.,618349581,U.S.A
Sun Jul 31 09:23:41 +0000 2022,https://twitter.com/ConormaraZ/status/1553672740321824769,"@Paul_H_James @EwanMacKenna At some point the Russian government had to say 'enough'. Agreements were ignored by Poroshenko/Zelensky. 
Zelensky was elected on a platform of peace with Russia - he didn't even attempt it.
War is brutal, but more talk was pointless.",892450844628725764,DE US
Sun Jul 31 23:23:45 +0000 2022,https://twitter.com/igorsushko/status/1553884148686696448,"🚨🧵Interpol is listed in the leaked database of NTechLabs customers. The Russian company's face-recognition technology, FindFace, is used by the FSB, the Russian prison system (FSIN), and various governments and companies around the world.
https://t.co/WHLpPMqCn6",19536434,"Tennessee, TN"
Sun Jul 31 12:11:01 +0000 2022,https://twitter.com/ECIU_UK/status/1553714847954739202,"Jan poll showed British voters thought key drivers of #GasCrisis were: 

📍 energy company profiteering (34%)

📍 Russian government reducing gas supplies to Europe (29%)

📍 growing demand around the world (28%)

Only 13% blamed so-called green levies
💡 https://t.co/aR5wM1yVsH https://t.co/ekG1ADV4X0",2479789014,South Carolina
Sun Jul 31 11:31:58 +0000 2022,https://twitter.com/KenRoth/status/1553705024433291265,Why does the Russian government want notorious arms dealer Viktor Bout back so badly? Possibly to reward him for being silent (so far) about his ties to Russian military intelligence — and to encourage similar silence from others who might be caught. https://t.co/xCzdGICMbO,17839398,"Illinois, IL"
Sat Jul 30 14:56:17 +0000 2022,https://twitter.com/cevrial/status/1553394053365977089,"@ChuckPfarrer @ViktoriiaUAH All Russian government tweets should be audited and any posts that are easily proved false, redirecting blame for russia's actions onto Ukraine, or solely introducing misinformation should be flagged with this label or removed.",1372022126,U.S.A
Sun Jul 31 08:54:35 +0000 2022,https://twitter.com/A_Melikishvili/status/1553665415687143424,"This atrocity expands the already long list of despicable acts committed by Russian government and further strengthens justification for declaring Russia a state sponsor of terrorism. It is long overdue and it is incumbent upon you, @StateDept, @SecBlinken to do so without delay.",4871934887,"Miami, Florida"
Sun Jul 31 12:57:42 +0000 2022,https://twitter.com/MoniqueReneeArt/status/1553726596816818177,Remember that charity I used to support that was spouting pro Russia propaganda? Yeah the FBI raided them because they have legit ties to the Russian government. Don’t support the Uhuru Movement. Support other non Russia propaganda black owned movements.,2975602557,"North Carolina, NC"
Sat Jul 30 11:49:54 +0000 2022,https://twitter.com/prfrankowski/status/1553347149236142081,"@EliotHiggins In recent months @Twitter has consistently refused to ban troll accounts spouting Russian government propaganda, calling Ukrainians Nazis and calling for their executions. Has @Twitter replaced Zuckerberg as the main conduit of Russian funds on the internet?",745136939980881920,"Chicago metro area, Illinois"
Sun Jul 31 08:45:49 +0000 2022,https://twitter.com/anzhela_berlin/status/1553663208023625729,@best_Polina @IlvesToomas Time for Your “regular” russians with EU visas to go home and blame Putin and all russian supporters of war for inability to travel now. Direct your blame towards your russian government on the territory of your beloved country. Do something useful,82640945,Connecticut
Sun Jul 31 12:26:20 +0000 2022,https://twitter.com/EHunterChristie/status/1553718702855553028,"A reminder that NATO nations, indeed all nations, are legally entitled under International Law, if invited by the government of Ukraine, to intervene in the war on Ukraine's side to help defeat and repel the illegal Russian invasion",935445678490374144,"Detroit, Michigan"
Sat Jul 30 19:39:35 +0000 2022,https://twitter.com/RonanJLOC/status/1553465345779834887,"@eoinmauricedaly Eoin,

Last year Mick Wallace requested 20 different amendments in the EU Association Agreement with Ukraine, including the ""The illegal unilateral sanctions
regime against the Russian Government""

I can't stress how brutal the Irish Left is on this topic, we are both part of it",43174902,"Hawaii, HI"
Sun Jul 31 19:04:02 +0000 2022,https://twitter.com/AndrewLearned/status/1553818789279571968,"Right here in Tampa Bay...

""A brazen influence campaign, turning U.S. political groups and U.S. citizens into instruments of the Russian government,”
 https://t.co/Pr8nPhW348",2248924302,MA US
Sat Jul 30 22:56:05 +0000 2022,https://twitter.com/ambermac/status/1553514797056000000,"“Anonymous has made Russia’s governmental and civilian cyber defenses appear weak. The group has demystified Russia’s cyber capabilities and successfully embarrassed Russian companies, government agencies, energy companies, and others.” https://t.co/PNiNS2QOdE",767396,us
Sat Jul 30 15:33:13 +0000 2022,https://twitter.com/rr_edmonds/status/1553403349210263552,"federal authorities say he was working for the Russian government, orchestrating a yearslong influence campaign to use American political groups to spread Russian propaganda and interfere with U.S. elections. 
via @NYTimes
https://t.co/sE7RFNCJBG",18725633,District of Columbia
Sun Jul 31 11:47:26 +0000 2022,https://twitter.com/devarbol/status/1553708916848066560,"And even the arguments are lazy about the possible ideologically bad commitment, you always can make people sign the relevant paper that will state their preferences about the Russian government, and then you can kick them for breaking it or lying on the form at any moment.",1184553171445846016,KY
Sat Jul 30 19:41:00 +0000 2022,https://twitter.com/ZvikaKlein/status/1553465704992722945,"According to a Russian government site, KAF, a Jewish “Charitable Foundation for the Development of Philanthropy,” has been considered a foreign agent since 2022.
In addition an organization affiliated with the JDC was considered as such.

@Jerusalem_Post
https://t.co/EvhgJVa7MY",740509130,MD
Sat Jul 30 18:50:51 +0000 2022,https://twitter.com/robert_zubrin/status/1553453085036404738,"@McFaul A better idea: the US navy should capture Russian merchant ships and tankers, confiscate the ships and cargo as contraband, and exchange the crews for Griner and the other US citizens kidnapped by the Russian government.
Sale of the contraband can help pay for US aid to Ukraine.",731463062230700032,"Milwaukee, Wisconsin"
Sat Jul 30 21:53:21 +0000 2022,https://twitter.com/danielcburke/status/1553499009653915648,"Scott Ritter on @DianeSare

""There's a senatorial cand. fr. NY who's opposing Schumer who's on the list. Imagine that! @SenSchumer has funded Ukrainian government operation so that they can label his political opponent a Russian propagandist in the midst of a political campaign!"" https://t.co/zVWXusOa7q",323454292,WY US
Sun Jul 31 12:00:18 +0000 2022,https://twitter.com/ExtremeTech/status/1553712151243677696,Should the Russian government have seen this coming when it implemented its parallel imports strategy in response to various tech sanctions? Probably.  https://t.co/jAIYzPbPlM,23455553,"Fort Worth, Texas"
Sun Jul 31 23:46:30 +0000 2022,https://twitter.com/BobOliv04497051/status/1553889874385715207,I say send the other 2 to Russia https://t.co/l5dhFII5Nw,711538339770449921,KS
