"created_at","url","full_text","user_id_str"
"Thu Dec 30 23:08:38 +0000 2021","https://twitter.com/RealPepeEscobar/status/1476691730334461960","A 50-minute phone call as prep for the Jan 10 meeting in Geneva.

Nothing has substantially changed.

Russia will allow the Empire to retreat - sparing it a major, global humiliation several orders of magnitude bigger than Afghanistan.","1435906191373180933"
"Thu Dec 30 23:37:01 +0000 2021","https://twitter.com/visegrad24/status/1476698872000954368","Putin has announced Russia will introduce a procedure for simplified acquisition of citizenship for residents of the former USSR and their children.

Millions of them live in the Baltic states, Ukraine, Georgia &amp; other flashpoints

Pictured: Map of Russian-speakers in the Baltics https://t.co/bxJI37d46n","1222773302441148416"
"Thu Dec 30 23:41:27 +0000 2021","https://twitter.com/Poiana46/status/1476699988235280388","De Donno in Russia
https://t.co/uXLU2XdX28","4299665086"
"Thu Dec 30 23:03:05 +0000 2021","https://twitter.com/kobebaffour/status/1476690332331003910","the other night, my girl listened to me talk about napoleon’s invasion of russia in the 19th century for ten minutes, was genuinely interested and even asked questions 🥺 i say this to say that the streets are trash, the sidewalk ain't better and everyone should get inside.","1571167386"
"Thu Dec 30 23:21:28 +0000 2021","https://twitter.com/NSC_Spox/status/1476694958010740737","Readout of President Biden’s phone call with President Vladimir Putin of Russia → https://t.co/SrzGkhI6AV","1354494993218613251"
"Thu Dec 30 23:21:32 +0000 2021","https://twitter.com/bjornberger/status/1476694974678847502","Russia insists it has zero intent of attacking anybody, maintaining that any troop movements within its own territory are strictly its domestic business. Good. Then accept that other countries have the same right.","3030883860"
"Thu Dec 30 23:12:41 +0000 2021","https://twitter.com/Danny4USA/status/1476692748572971008","I truly wish they could be prosecuted for lying. 
RUSSIA RUSSIA RUSSIA 
Booster shots you won't get sick.
AND THIS 🤣🤣🤣🤣🤣
Just to name a few 🤣🤣","1226744019075682307"
"Mon Dec 27 20:59:13 +0000 2021","https://twitter.com/kennardmatt/status/1475571995135946755","Imagine reaction of British government and judiciary if Putin tried to extradite Eliot Higgins from UK to Russia for the “crime” of publishing the identities of Russian intelligence officers and details of their covert ops.

Then tell me Julian Assange is not a political prisoner","591982810"
"Thu Dec 30 22:53:49 +0000 2021","https://twitter.com/Schuldensuehner/status/1476688001342316547","Energy crunch fuels the most volatile year ever for European Gas. Prices hit records at €180 per MWh earlier this month as Russia curbed flows. They then fell 50% in seven days to €87 per MWh amid arrival of LNG cargoes. https://t.co/yxaR48bTjf","40129171"
"Thu Dec 30 23:37:54 +0000 2021","https://twitter.com/kennethkline13/status/1476699093112168448","Joe Biden getting tough with Putin! Told Russia if they invade the Ukraine he was taking them off the Christmas card list! Remember when a country asked for weapons Hussain Obama sent blankets! Democrats are so strong in foreign policy!","2364481226"
"Mon Dec 27 01:44:30 +0000 2021","https://twitter.com/fairyofbloom/status/1475281400920109061","RT stands for Russian TV.  RT is funded by the Russian Government in the same way that the British BBC, the Australian ABC are funded by their governments. 

The difference is that this important story is not getting much coverage in either BBC or ABC. 

https://t.co/UX3KnpD1qG","316364374"
"Thu Dec 30 23:31:21 +0000 2021","https://twitter.com/vtchakarova/status/1476697447493689345","Bloomberg Global Survey poll names biggest tail-risks for markets in 2022. Many of them are directly related to #geopolitics - the #Dragonbear 🇨🇳🇷🇺 and their mutual backing on China’s view on Taiwan respectively Russia’s view on Ukraine, war &amp; supply chains. #GlobalSystem #macro https://t.co/tldMQMrdTx","424083365"
"Thu Dec 30 22:52:21 +0000 2021","https://twitter.com/patafseditor/status/1476687631492726790","Timely insights into Russia's military culture --- Civil–Military Relations and Russia’s Post-Soviet Military Culture: A Belief System Analysis - Kirill Shamiev, 2021 https://t.co/qGe9rZZGdV","2216023873"
"Tue Dec 28 13:45:56 +0000 2021","https://twitter.com/sammythedog1989/status/1475825343290396680","Absolutely unbelievable, UK government condemn Russian closure of Human Rights Group Memorial International, whilst pulling the UK out of the ECHR. You could not fucking make this up.","131219243"
"Thu Dec 30 23:52:30 +0000 2021","https://twitter.com/NewDayForNJ/status/1476702769495134208","Putin is going to invade Ukraine on some level.  He already established a Crimean stronghold under Obama.  Only thing in his way was Trump.

What he’s doing now is milking Biden for concessions &amp; appeasement.

The Biden Doctrine of Weakness has served up another win to Russia.","958408514807967751"
"Thu Dec 30 23:52:20 +0000 2021","https://twitter.com/AurieleFayme/status/1476702726281220096","ALL of my favorite tattoo artists I find live outside the US. Korea, Italy, Russia… 😭🪦","1849112719"
"Thu Dec 30 14:16:36 +0000 2021","https://twitter.com/QuintenFrancois/status/1476557837023260672","""Sber, the Russian government-backed company and the largest bank in the country, is launching a blockchain exchange-traded fund (ETF) to track the performance of major crypto companies, such as Coinbase and Galaxy Digital.""

Russia is joining for real now. 👀","899748062507278336"
"Thu Dec 30 23:11:17 +0000 2021","https://twitter.com/Kormla4/status/1476692396364771330","@mrwtffacts How far is Russia away from Africa? https://t.co/Sz7MhkygX7","1208444158911959040"
"Thu Dec 30 22:10:28 +0000 2021","https://twitter.com/iape_/status/1476677092494483463","Our phellow Phunk holder @pussyrrriot labeled as ""foreign agents"" by Russian government, are true Phunks ✊ and fighter for phreedom, phree speech, expression, censorship resistance. 
Phunk Pham supports you. ❤️
@ryder_ripps @Pauly0x @NotLarvaLabs 
https://t.co/cPM922j7ZP","795525007195643904"
"Thu Dec 30 23:00:00 +0000 2021","https://twitter.com/weathernetwork/status/1476689557978378251","A rare Steller's sea eagle was recently spotted in a Massachusetts state park, thousands of miles from its native habitat of eastern Russia and Asia. https://t.co/YYRVfhoxXg","18638090"
"Wed Dec 29 11:19:12 +0000 2021","https://twitter.com/FHAeromedia/status/1476150805686333448","Serbian Air Force recommends @Dassault_OnAir Rafale jets, but Government undecided between Russian, French warplanes
https://t.co/1Buhn979rn https://t.co/MEwz8Owykm","2469601104"
"Thu Dec 30 22:55:35 +0000 2021","https://twitter.com/Chris_SactoCA/status/1476688443635691531","They frame the Russia-Ukraine issue like 1950s propaganda.

Calling Russia moving troops within its own borders an invasion with the ""further invasion"" nonsense while ignoring that its NATO, not Russia, moving forward.

Russia has a right to fear NATO

https://t.co/8pwG9qF0G0","155792815"
"Thu Dec 30 23:00:59 +0000 2021","https://twitter.com/FlightGlobal/status/1476689802409955335","Will Russia’s MC-21 break Airbus/Boeing narrowbody duopoly? https://t.co/SrOKmiHd6v https://t.co/oeNb6CMtD9","7230492"
"Thu Dec 30 01:30:42 +0000 2021","https://twitter.com/afsftw/status/1476365093659099138","Deserved that 2014 toro rosso seat much more than kyvat imo
That Russian government money just had to ruin him https://t.co/2JWF3q3ulY","1262490184320462853"
"Thu Dec 30 23:20:25 +0000 2021","https://twitter.com/AlertChannel/status/1476694694985879560","KREMLIN: RUSSIA IS PLEASED WITH THE OUTCOME OF THE PUTIN-BIDEN TALKS.","940876562"
"Thu Dec 30 23:32:33 +0000 2021","https://twitter.com/realDailyWire/status/1476697748753686528","‘Happy New Year’: Activist Mocks U.N. ‘Human Rights’ Council That Includes China, Cuba, Russia, And More https://t.co/X123svMzit https://t.co/vMckOkVNVt","4081106480"
"Sat Dec 25 09:11:19 +0000 2021","https://twitter.com/runews/status/1474669071555866626","Russian Government Allows Regions to Raise Electricity Rates for Crypto Miners

https://t.co/3Asw1H71Ib https://t.co/LyrxaaJn7I","243318995"
"Tue Dec 28 06:58:32 +0000 2021","https://twitter.com/ASEANRussia/status/1475722818318909441","Russian Government allocated 12 mln USD to improve the Lao PDR's healthcare system, strengthen the capacity to respond to coronavirus infection, and allow to to achieve the Sustainable Development Goals @ASEAN #sdg https://t.co/Oyb24XlJDF","1123156883349524482"
"Thu Dec 30 23:45:49 +0000 2021","https://twitter.com/MeriHaliay7/status/1476701086706802694","The world must raise our voice &amp; condemn the govt's of Eritrea, China, Russia, Iran, UAE, &amp; Turkey for making profits and political gain at the cost of thousands of civilian lives in Tigray. #KnowMore @saribashi @MaxBayen @swillfully @JoshuaPotash @Ana3rabeya @lamamfakih","1450228795412295680"
"Mon Dec 27 17:41:24 +0000 2021","https://twitter.com/EndGameWW3/status/1475522215290585099","Update: The Russian network RBC reports that the Russian government has announced that it will hold high-level talks with NATO on January 12 and 13, 2022. The first high-level talks in two and a half years.","32792712"
"Thu Dec 30 22:50:41 +0000 2021","https://twitter.com/busettodavide/status/1476687210439233550","Exclusive: #China, #Russia to sign new 5-year space cooperation program, build intl lunar station by 2035: Roscosmos - Global Times https://t.co/eaBpRtsL3B","278907226"
"Tue Dec 28 15:52:00 +0000 2021","https://twitter.com/RepAndyLevin/status/1475857069991501827","Today marks three years that Michigander Paul Whelan has been detained illegally in Russia. Three holiday seasons spent in a prison cell, separated from those he loves. The Russian government must put an end to this abuse of power and #FreePaulWhelan immediately. https://t.co/MZ71q8Q7fr","1080277407867772930"
"Thu Dec 30 23:43:03 +0000 2021","https://twitter.com/Marisol_Maddox/status/1476700391228252164","The cubs make the funniest sound! Not the little mew you would expect 😂 #biodiversity #Russia","164160602"
"Mon Dec 27 22:49:33 +0000 2021","https://twitter.com/Sprinterfactory/status/1475599764297289735","The Russian government has announced that it will hold high-level talks with NATO on 12 and 13 January 2022

Russia and the United States will hold talks on January 7","1128337957289697281"
"Thu Dec 30 23:13:39 +0000 2021","https://twitter.com/Biz_Ukraine_Mag/status/1476692991385509896","In today’s call with Vladimir Putin, President Biden made clear that “the United States and its allies and partners will respond decisively if Russia further invades Ukraine.” Biden also reiterated that diplomatic progress can only occur in an environment of deescalation https://t.co/m8y5NFJTKK","3301937067"
"Thu Dec 30 22:57:34 +0000 2021","https://twitter.com/Liveuamap/status/1476688943076851714","Ushakov: Putin asked Biden what could be the response if Russia deploys offensive systems near U.S. 
“No one could win nuclear war” https://t.co/eMgOFb5kht","2388075212"
"Thu Dec 30 07:42:03 +0000 2021","https://twitter.com/Mickey_Mayhew/status/1476458545050787842","Grigori #Rasputin was murdered by a crossdressing socialite &amp; several members of the #Russian government - &amp; possibly the #British MI6 - #OTD in 1916 (N.S); his death &amp; life are now the stuff of legend, everything from Boney M to #TomBaker... #History #ThursdayThoughts #Russia https://t.co/zt2KqKrTjY","1457145552"
"Thu Dec 30 23:21:08 +0000 2021","https://twitter.com/ThisThornyRose/status/1476694876075003909","Hallelujah 💖

Let Russia create its own iron curtain. Even better, its own cell.","911731310292545539"
"Thu Dec 30 13:15:31 +0000 2021","https://twitter.com/HoodedMan/status/1476542465846960128","Let's be clear. Russia's demand to US/nato/EU is very reasonable. The western nations are the rogue nations. Twitter, btw is censoring the plan published on the website of the Russian government, but you can find it there.","20001303"
"Thu Dec 30 23:14:40 +0000 2021","https://twitter.com/ByzantiumLive/status/1476693248093601794","Hey, @Vladimir_of_Kiev. I agree to your terms on one condition: you convert Russia to Orthodox Christianity.","56143410"
"Thu Dec 30 22:58:17 +0000 2021","https://twitter.com/MarQs__/status/1476689122433679364","#Putin told #Biden #Russia needs 'results' and that major sanctions would be 'colossal mistake' - Kremlin","172323296"
"Mon Dec 27 22:23:33 +0000 2021","https://twitter.com/JoeMomma833/status/1475593220947988485","@atrupar Yep! Now do John Matzes. On December 2, 2017 in Kazan, Tatarstan, Russia they wed in a government facility, they spent 7-month in Russia honeymooning, and returned to the U.S. July 2018 &amp; launched Parler in August 2018. All these people are Russian assets. https://t.co/bTve0jQE3L","3472832174"
"Wed Dec 29 16:02:35 +0000 2021","https://twitter.com/EverFlossing/status/1476222123844767750","@AuthorKimberley Yeah, well, the Russian government is certainly convinced of the effectiveness of their vaccine(s).   I submit: https://t.co/F9R8P0PYLY","1179893281544687616"
"Thu Dec 30 23:41:14 +0000 2021","https://twitter.com/castlvillageman/status/1476699934581735424","Russia planted people in countries and used those planted people to control/own/tax those countries.
Used the planted people to create violence 
A faint smell of english empire ?","1053271640"
"Thu Dec 30 22:58:34 +0000 2021","https://twitter.com/CGTNOfficial/status/1476689197385883656","Read the statement by White House Press Secretary Jen Psaki on President Biden’s Phone Call with President Vladimir Putin of Russia here.

#CGTNAmerica https://t.co/ub6lJd2sNi","1115874631"
"Thu Dec 30 02:02:33 +0000 2021","https://twitter.com/BlueSeatBlogs/status/1476373108202291200","Get bullied by the Russian government.","106179198"
"Thu Dec 30 23:30:06 +0000 2021","https://twitter.com/AngelRe96386095/status/1476697129708052486","According to the Kremlin:
Putin told Biden that new sanctions on Russia would be ""a colossal mistake.""

Folks, that sounds like a threat. 👠","1386011909770596358"
"Tue Dec 28 03:31:44 +0000 2021","https://twitter.com/_JakubJanda/status/1475670777806528517","It is good to see U.S. and NATO officials planning to have official talks with Russia in early January.

Now they can officially tell the Russian government to go screw itself with their Hitler 1938-style demands.","539010491"
"Tue Dec 28 15:53:42 +0000 2021","https://twitter.com/YablokoParty/status/1475857500545204227","The Russian government recognised its succession to the Stalinist state by liquidating the Memorial human rights society. Statement by the Yabloko Bureau, 28.12.2021. https://t.co/d1mplJluZw https://t.co/D67b5WJNbC","1684226107"
"Thu Dec 30 23:09:43 +0000 2021","https://twitter.com/gpovanman/status/1476692001324208145","@VeraVanHorne Yet one has to ask why Russia should retreat. The US isn’t even on the same continent…","223817821"
"Sat Dec 25 13:06:33 +0000 2021","https://twitter.com/KenRoth/status/1474728270042218507","The Russian government blocks the website of the OVD-Info protest-monitoring group, ""which has for years documented anti-Kremlin protests."" Hmmm, what could the Kremlin be afraid of? https://t.co/rxiuUuDwo8 https://t.co/ZV2Bq4oKzG","17839398"
"Thu Dec 30 23:44:06 +0000 2021","https://twitter.com/terri_mclain/status/1476700654391513093","Why do we allow Russian propaganda on all US military installations worldwide?

Thinking this is benign is dangerous.

“Carlson’s claims that the U.S. is pushing the world to the brink of a nuclear war with Russia fit squarely within the Kremlin’s current propaganda offensive. “","777182218145771520"
"Sun Dec 26 11:07:05 +0000 2021","https://twitter.com/elizableu/status/1475060594030129157","The Russian government is targeting the Russian people and using twitter’s vulnerabilities as an excuse to inevitably remove twitter so that the Russian people can’t mobilize against the government.","1210398164878024704"
"Thu Dec 30 23:43:39 +0000 2021","https://twitter.com/dkap1955/status/1476700540008546307","@adjordan @B52Malmet Wonder what happened to Russia's translator after that meeting? Siberian Vacay, or perhaps defenestration?","2573729377"
"Tue Dec 28 03:10:17 +0000 2021","https://twitter.com/abominabledavid/status/1475665380823769090","Madison Cawthorn is not an agent of the Russian government. Madison Cawthorn gets into fistfights with trees. 

The Russians might not have the standards they did at the height of the Cold War, but they’re not fucking morons.","523186204"
"Mon Dec 27 21:45:42 +0000 2021","https://twitter.com/Gus_802/status/1475583693532110856","I'm trying to figure out why some Republicans think siding with the Russian government is a good strategy.","237572596"
"Thu Dec 30 23:16:56 +0000 2021","https://twitter.com/SCynic1/status/1476693818598699008","If it was China Russia or Iran:
1. They’d not be allowed near.
2. It would be evidence of authoritarianism.
Here it’s a bad misjudgment which is being investigated.
Because we aren’t China Russia or Iran.
If you truly think there’s a comparison it’s your problem - not ours.","979367557"
"Wed Dec 29 18:37:51 +0000 2021","https://twitter.com/DrWinarick/status/1476261195321683970","My take is that Cawthorne was engaged in the marketing of gambling tourism in St Petersburg on behalf of the Russian government and mafia in Russia. 

Evidently he went into one of the dens, &amp; it’s a fair guess to surmise that he ended up indebted as a result.","799813565716824069"
"Thu Dec 30 23:59:51 +0000 2021","https://twitter.com/aarondmiller2/status/1476704616905678848","Not a single US life shld be sacrificed in defense of Ukraine. There is much we can/should do to assist. But the idea that we'd risk a shooting war with Russia on an issue that isn't by any definition vital to US interests  would be a testament to our arrogance and stupidity.","257529281"
"Mon Dec 27 15:27:04 +0000 2021","https://twitter.com/MarkHiggie1/status/1475488407585542147","Germany’s energy policies are a catastrophe: its evangelically anti-nuclear government will soon have closed the remaining six reactors. The country will depend increasingly on Russian gas, the cost of which is six times what it was on average 2010-2020. https://t.co/Ftrt3SarvX","915865389418065920"
"Thu Dec 30 23:44:07 +0000 2021","https://twitter.com/MenTourPilot/status/1476700658250178560","Russia's MC-21 flew with wings made from locally-sourced composites, for the first time. But the method used to make this wing is also interesting: 👇
https://t.co/xmoKwCN3tJ","3360617799"
"Wed Dec 29 14:30:58 +0000 2021","https://twitter.com/JohnDalton6011/status/1476199065918582785","@trussliz The Russian government, just like yours, is trying to promote its own version of history. https://t.co/bCNzYJWBee","595510017"
"Thu Dec 30 23:36:05 +0000 2021","https://twitter.com/SaarioBrandon/status/1476698639229612033","Political violence is never justified. But to blame Tucker, is like saying you and @tedlieu are responsible for the man who went to the softball field to assassinate the GOP congressmen because he believed the Russia and Healthcare lies you were pushing.","913613331507724288"
"Mon Dec 27 00:10:48 +0000 2021","https://twitter.com/mizinformatsiya/status/1475257821797126145","now that I have your attention... i would like to once again share that carne asada fries are californian poutine and i am NOT an agent of the russian government. no i will not be taking any questions. -- xoxo ivanka","1399368843785490444"
"Thu Dec 30 23:42:31 +0000 2021","https://twitter.com/Apex_WW/status/1476700255756468228","Kremlin: Putin told Biden #Russia needs 'results' and that new major sanctions would be a 'colossal mistake'","1169793310241755137"
"Thu Dec 30 23:20:15 +0000 2021","https://twitter.com/nomnomcookieez/status/1476694653093257228","""an influential media outlet we built in Russia @mediazzzona - which is marked as a foreign agent too, have to follow this law or be closed.""
- @tolokno https://t.co/a9980fCIOx","1249256019206823936"
"Wed Dec 29 20:18:33 +0000 2021","https://twitter.com/CreateCapital/status/1476286537411317766","BOYCOTT MSNBC/COMCAST
Race baiters, insurrectionists. 

The network spent four years telling people Trump was installed by the Russian government in a silent coup and now says it is ‘insurrection’ to criticise a sitting president.","63512129"
"Tue Dec 28 22:00:01 +0000 2021","https://twitter.com/Pop3Pam/status/1475949685139390464","Brit Hume is lying!
Mueller said there was collusion (not a crime) between Trump campaign &amp; Russians.
He said he couldn’t establish a conspiracy between the campaign &amp; Russian government (a crime) he clearly indicated obstruction of justice by Trump hindering the investigation!","886234054542184448"
"Sun Dec 26 14:00:19 +0000 2021","https://twitter.com/hrw/status/1475104187549691909","In 2021, the Russian government:
• Expanded oppressive internet legislation
• Blocked censorship circumvention tools
• Experimented with novel censorship technologies 
• Pressured tech companies to comply with increasingly stifling regulations
https://t.co/O1pPY2EXGV https://t.co/yNRbotOFqU","14700316"
"Thu Dec 30 22:59:36 +0000 2021","https://twitter.com/Chris_SactoCA/status/1476689455385702420","I'm not saying Russia are the good guys. But Ukraine is not either. And the US is definitely not.","155792815"
"Mon Dec 27 21:58:52 +0000 2021","https://twitter.com/tonykevin/status/1475587009527697409","Important Russian government  message to Western alliance nations . Australian government and media, are you listening? @MarisePayne  @SenatorWong @abcnews @Consortiumnews @TheScrum1 #auspol By @tonykevin .","83694622"
"Sun Dec 26 17:19:07 +0000 2021","https://twitter.com/andreas_krieg/status/1475154218097033217","UAE-financed Ros-Lehtinen led an Akin Gump effort to lobby for the Justice Department to designate Al Jazeera’s US arm as an agent of the Qatari government, treatment that Russian and Chinese propaganda outlets received in recent years
https://t.co/YVVEGOsO4D","1940561376"
"Thu Dec 30 22:45:36 +0000 2021","https://twitter.com/JDiamond1/status/1476685932875161605","WH press secretary says ""Biden urged Russia to de-escalate tensions with Ukraine. He made clear that the United States and its allies and partners will respond decisively if Russia further invades Ukraine""
""Substantive progress...can occur only in an environment of de-escalation"" https://t.co/iln3DD9Njf","407396556"
"Wed Dec 29 01:28:43 +0000 2021","https://twitter.com/raymcgovern/status/1476002207870984192","OMG! NYT finally mentions Christmas-morning news that 10,000 Russian troops leaving areas near Ukraine.https://t.co/1pkapAca3V But it's awkward: Significance “unclear”, absent the de rigueur government Memo to Media re desired spin. Sign of hope? ""Unclear"" https://t.co/7p4DdeP3PY","2216210047"
"Thu Dec 30 23:17:08 +0000 2021","https://twitter.com/ani_digital/status/1476693869324505092","US, its allies will respond decisively if Russia further invades Ukraine: Biden to Putin during phone call

Read @ANI Story | https://t.co/yQKpV4Mr5L

#USA #Russia #JoeBiden #VladimirPutin https://t.co/OP6vJ3bGxj","817976607398731776"
"Mon Dec 27 11:30:02 +0000 2021","https://twitter.com/WSWS_Updates/status/1475428756932202504","In an extraordinary speech on Tuesday before Russia’s officer corps, the entire Defense Ministry as well as cadets of military schools, President Vladimir Putin made clear that the Russian government is preparing for a potential war with NATO. https://t.co/iRdyNQf3wV","117810351"
"Thu Dec 30 22:42:39 +0000 2021","https://twitter.com/Francesco0996/status/1476685189078212611","In plain English, get your Otan troops out of Russia perimeter or we won’t hold back. And honestly I give Putin this… imagine russian having an army in our border either Mexico or Canada… obviously it would be considered an attack to sovereignty","762535574"
"Tue Dec 28 13:23:26 +0000 2021","https://twitter.com/antelava/status/1475819685140746251","These are voices that the Russian government does not want you to hear. Our team at @CodaStory would not have been able to put Generation Gulag together without the incredible work of Memorial. A chilling move by the Russian government.  https://t.co/Xr5USXzcN7","278894750"
"Thu Dec 30 22:45:15 +0000 2021","https://twitter.com/edokeefe/status/1476685845390311426","JUST IN: Official White House statement on today's Biden-Putin call. @PressSec says @POTUS Biden ""urged Russia to de-escalate tensions with Ukraine. He made clear that the United States and its allies and partners will respond decisively if Russia further invades Ukraine."" https://t.co/zDL2Ygca6Z","16930125"
"Thu Dec 30 23:32:51 +0000 2021","https://twitter.com/MrConnieS/status/1476697825379561473","@bjornberger @RutheniaRus Thats fine but can Russia remove their soldiers allready in East Ukraine and Crimea","144365572"
"Tue Dec 28 04:25:20 +0000 2021","https://twitter.com/JamesFLoveIV/status/1475684265593606145","“attempted to provide classified national defense information to the Russian government.”

Former Defense Contractor Arrested for Attempted Espionage | OPA | Department of Justice https://t.co/3EgjNV9Bpi","706301516878094340"
