"created_at","url","full_text","user_id_str"
"Mon Apr 29 16:59:34 +0000 2019","https://twitter.com/Heritage/status/1122908295549870081","To kick of North Korean Freedom Week, watch #humanrights expert @OliviaEnos at @CSIS today at 2:00 p.m. EST and hear testimonies from North Korean escapees - stream live here: https://t.co/2tI4PS8bNb","10168082"
"Mon Apr 29 20:35:21 +0000 2019","https://twitter.com/tomiahonen/status/1122962596695552001","@SpecialEdV @realDonaldTrump @nytimes Actually, I think he knows one North Korean. And probably in a biblical sense a Slovenian hooker. It is conceivable also, that at least he is aware of some Saudi bone saw merchants via his son-in-law Jared....","17477864"
"Tue Apr 30 18:00:00 +0000 2019","https://twitter.com/CSISKoreaChair/status/1123285891135430656","North Korean First Vice Foreign Minister Choe Son-hui on Tuesday warned of ""unwanted consequences"" if Washington does not shift its policy on the North's denuclearization within this year, deepening the nuclear standoff with the U.S. @YonhapNews https://t.co/157RqEkiL4","125767959"
"Tue Apr 30 22:30:00 +0000 2019","https://twitter.com/starsandstripes/status/1123353838184992768","A senior North Korean official on Tuesday warned of an “undesired consequence” for the U.S. if Washington does not adjust its policy on North Korea’s denuclearization by an end-of-the-year deadline leader Kim Jong Un has set. https://t.co/APKrxYiV4o","9130702"
"Tue Apr 30 01:24:12 +0000 2019","https://twitter.com/nknewsorg/status/1123035290665353216","U.S. authorities step up manhunt for North Korean embassy break-in ringleader #NorthKorea https://t.co/PHa6orZ2dx","147017457"
"Mon Apr 29 15:42:43 +0000 2019","https://twitter.com/BBCMonitoring/status/1122888955580514306","Softer tone and hand gestures mark North Korean TV efforts to modernise weather report
https://t.co/x4o5IYY41n","569238628"
"Tue Apr 30 11:06:34 +0000 2019","https://twitter.com/koreasociety/status/1123181844831318017","""North Korean first vice foreign minister Choe Son Hui [criticized] US Secretary of State Mike Pompeo for what she described as his 'stupid and dangerous' suggestion last week that the U.S. would 'change paths' should diplomacy with the DPRK not succeed.""

https://t.co/9rxk9R3EFY","20260430"
"Tue Apr 30 22:03:49 +0000 2019","https://twitter.com/CFR_org/status/1123347248857976832","At their summit last week, Russian President Putin reiterated the importance of denuclearization, but did not provide sanctions relief for North Korean leader Kim, says @snydersas https://t.co/PIBdGIUzUX","17469492"
"Tue Apr 30 16:00:25 +0000 2019","https://twitter.com/StimsonCenter/status/1123255797490884609","An arrest warrant is out for the alleged ringleader of a raid of the North Korean embassy to Spain. Check out this @Telegraph article, featuring comments by @DavidKimDC -- https://t.co/mnE9pX5sYH","22697810"
"Sat Apr 27 21:59:48 +0000 2019","https://twitter.com/midnightdorifto/status/1122259073158852609","@uhalevi @2Fast2Finkel @AWJayRamey @Guerrero_FJ @TamerlaneBlog coworker: “what’d you do this weekend”
me: analyzed 90s North Korean propaganda/pop music videos to see if they had any clues as to the domestic modifications performed on imported Tatra 613s, you?
https://t.co/GFDshB0Mwm","331304178"
"Mon Apr 29 07:39:07 +0000 2019","https://twitter.com/niccijsmith/status/1122767253450051584","The bizarre tale of the raid on the North Korean embassy in Spain took another dramatic twist at the weekend when it emerged that a US arrest warrant has been issued for Adrian Hong the alleged leader of the group who stormed the building in February https://t.co/QedQQkAVwG","24107523"
"Sat Apr 13 14:50:13 +0000 2019","https://twitter.com/45Polemic/status/1117077536041766912","@realDonaldTrump “US Department of Homeland Security and FBI officials are warning industry about what they say are new Trojan malware variants that North Korean-government-backed hackers have deployed as part of their global operations..” https://t.co/d1TtfehaZY","797535894806859776"
"Mon Apr 08 12:27:07 +0000 2019","https://twitter.com/aal02115/status/1115229582548926464","A comprehensive list of the good things I can say about North Korean government and Donald Trump:

Donald: 

NK: gave us the nickname Dotard

NK-1, Don-0","3260730987"
"Thu Apr 25 18:48:34 +0000 2019","https://twitter.com/acnewsitics/status/1121486171471790087","President Donald Trump authorized the payment of $2,000,000 dollars to the North Korean Government for the killing of Otto Wormbier.

So the Kim/Trump ""summits"" were really bill collections?","1080188052365029376"
"Tue Apr 09 03:41:39 +0000 2019","https://twitter.com/s_dailey17/status/1115459732456837120","the ncaa is more corrupt than the north korean government","3377497462"
"Wed Apr 10 21:56:09 +0000 2019","https://twitter.com/TWSENews/status/1116097562325540864","Cybersecurity and Infrastructure Security Agency (CISA) - The Department of Homeland Security (DHS) and the Federal Bureau of Investigation (FBI) have identified a Trojan malware variant - referred to as HOPLIGHT - used by the North Korean government. https://t.co/3fFuVTqpda","173512955"
"Mon Apr 01 11:17:07 +0000 2019","https://twitter.com/jamescarstensen/status/1112675251392000001","@JordanBo_3 @NCAA @uiowa Even the North Korean government is impressed with swift clamp down by the @NCAA on this one. https://t.co/W83hLxHmSV","26797614"
"Thu Apr 25 22:08:03 +0000 2019","https://twitter.com/NewspaperLists/status/1121536373528203264","North Korea presented US with $2 million bill for care of Otto Warmbier  CNN The North Korean government presented the United States with a… https://t.co/hkLzudUzgW","2364174661"
"Fri Apr 26 11:37:32 +0000 2019","https://twitter.com/trustfundbimby/status/1121740087987818497","@Koreaboo Now the North Korean government knows about this, and the North Koreans will be further deprived of good music. Thanks a lot. https://t.co/RR5ahIHaS1","1105780131937771520"
"Sat Apr 13 04:18:04 +0000 2019","https://twitter.com/HouseCracka/status/1116918448800419840","Kim Jong-un Reshuffles North Korean Government, Tightens Control https://t.co/5lQipklDzi https://t.co/T4UcbJRxcj","16190478"
"Wed Apr 24 00:56:59 +0000 2019","https://twitter.com/KarlaPa23670577/status/1120854112474677248","North Korean government task force ramps up efforts to root out South Korean media content - DailyNK https://t.co/B2VuFgoQVV","719345300435968000"
"Tue Apr 16 08:27:41 +0000 2019","https://twitter.com/CoachChic/status/1118068432057044992","As part of an unsettling crackdown on 'superstitious activities,' the North Korean government publicly executed a pair of fortune tellers...
https://t.co/a8RWaxral4 https://t.co/liY7iXLd1U","15999489"
"Thu Apr 25 16:26:07 +0000 2019","https://twitter.com/notComey/status/1121450325565534208","Trump agreed to pay North Korea $2 million for its ‘care’ of dead American Otto Warmbier: report: The United States government paid the North Korean government $2 million in exchange for the “care” that it gave to Otto Warmbier, the late American college… https://t.co/awhRxF4M5Q https://t.co/m9tps96F0n","826283663658737666"
"Thu Apr 11 14:04:03 +0000 2019","https://twitter.com/N4chelus/status/1116341142772076544","New Hoplight malware marks re-emergence of Lazarus Group.: The Lazarus Group hacking operation, thought to be controlled by the North Korean government, has a new malware toy to pitch at potential targets and the US is getting worried about it. This… https://t.co/QzaKD0blmn https://t.co/mN3IAJVd2a","340042123"
"Sat Apr 13 06:14:53 +0000 2019","https://twitter.com/BlissTabitha/status/1116947849680318465","Kim Jong-un Reshuffles North Korean Government, Tightens Control https://t.co/FjyWyRkIRF","999453985"
"Thu Apr 25 17:20:12 +0000 2019","https://twitter.com/abynorml/status/1121463932688924673","And why did the majority Party, at the time, DO NOTHING? Why no response to the North Korean government? (crickets) @SenateGOP @HouseGOP @senatemajldr","25368960"
"Wed Apr 03 08:46:27 +0000 2019","https://twitter.com/ThinTweaks/status/1113362113152659457","""the North Korean government has actually put out a cookbook on what types of grasses and leaves taste the best""

""Although to be honest, if you’re eating grass, things have probably gotten pretty bad""

https://t.co/q82vS7nsGK . https://t.co/mPOxXaDnM3","2170406887"
"Thu Apr 11 07:00:28 +0000 2019","https://twitter.com/ProDefenceTeam/status/1116234544871460866","Cyber Security - DHS and FBI Uncovered North Korean Government Owned Hoplight Malware in Government Network - https://t.co/rBhrOunqQI https://t.co/XK38WQ5ZcW","341778212"
"Thu Apr 25 21:04:34 +0000 2019","https://twitter.com/JeremyLevine92/status/1121520398963806208","So people criticized Obama for unfreezing Iranian money and giving it to the Iranian Government and spun it as taxpayer dollars was being given to the ayatollah 

Trump literally handed $2 million to the North Korean Government after it brutally murdered an American and","935107884089860096"
"Mon Apr 15 20:21:25 +0000 2019","https://twitter.com/CenCalPowerTalk/status/1117885660621205509","As part of an unsettling crackdown on 'superstitious activities,' the North Korean government publicly executed a pair of fortune tellers. https://t.co/rLQqUh9cPk","3011707368"
"Fri Apr 26 04:02:26 +0000 2019","https://twitter.com/SleepyRichmond/status/1121625560013107201","The North Korean government presented the United States with a bill for $2 million for the hospital care of Otto Warmbier, the American college student who was held as a... https://t.co/0o6bQm9oQs","264926447"
"Wed Apr 10 19:25:20 +0000 2019","https://twitter.com/PortUnreachable/status/1116059609243029505","An excellent MAR by @USCERT_gov on Trojan #malware variant #hoplight used by the North Korean government #HiddenCobra 

https://t.co/hlHX4ZUUxs","782872419920932864"
"Thu Apr 25 16:41:48 +0000 2019","https://twitter.com/Jenna_OrangeCo/status/1121454272904744961","The U.S. gov't paid the North Korean government $2 million in exchange for the “care” that it gave to Otto Warmbier.

North Korean officials served American officials a bill for $2 M that they demanded U.S. pay in exchange for flying Warmbier back home.

https://t.co/CeCbqe4CeQ","215002582"
"Sat Apr 27 01:52:25 +0000 2019","https://twitter.com/GoodToKnowCMTY/status/1121955224787267584","North Korean government officials insisted the U.S. sign a pledge to pay the bill before releasing him from their custody in 2017, according to two sources familiar with the matter. https://t.co/OemVOVAW9s","1265387018"
"Thu Apr 25 18:46:19 +0000 2019","https://twitter.com/Marine_Skyhawk/status/1121485608633892864","The U.S. received a $2 million hospital bill from the Communist North Korean government for the toture and fake care of American Otto Warmbier, who fell into a coma from constant beatings while he was imprisoned in that country.

https://t.co/YNk2upU0Lc","1001477004703780864"
"Thu Apr 11 05:02:19 +0000 2019","https://twitter.com/The_Daily_NK/status/1116204809768456192","Sources report that 3 North Korean state security agents in China defected following the Hanoi Summit. In response the North Korean government has moved to harshly reassert control over officials dispatched across the border.

https://t.co/E6CBvVxhAv

#NorthKorea #DPRK https://t.co/mXfkHe4wI6","1342068500"
"Fri Apr 26 11:26:29 +0000 2019","https://twitter.com/mkraju/status/1121737304941498368","No denial that the North Korean government presented US with a $2M bill. Trump says US didn’t pay anything. In February, Trump said Kim “felt very badly” about Warmbier. ""He tells me that he didn't know about it and I will take him at his word.""","39155029"
"Thu Apr 25 22:37:26 +0000 2019","https://twitter.com/jerrykong80/status/1121543767423471616","Factor by which the North Korean government's hackers work more quickly than the Chinese government's: 2.

Factor by which the Russian government's work more quickly than the North Korean government's: 8.
#HarpersIndex","89042711"
"Thu Apr 25 17:51:29 +0000 2019","https://twitter.com/Chris_nDC/status/1121471806551023617","@smc429 “The US  government paid the North Korean government $2 million in exchange for the ‘care.’” That’ss Trump using your tax $ to pay ransom to a ruthless dictator.

You cite a lawsuit by the family at their cost.

If Obama had given $2M, you’d all would’ve died of an aneurism.","924369661"
"Fri Apr 26 12:13:42 +0000 2019","https://twitter.com/RobRvr001/status/1121749190873374720","2 million to Kim jong-un for return of an American left brain dead by North Korean Government with King Jong-in’s approval. What did we pay him for again? If Trump says he reneged we have to check Treasury for a paper trail. Odds are a check was cut &amp; Vlad &amp; Kim laughing about it","65918053"
"Sat Apr 13 13:26:41 +0000 2019","https://twitter.com/CollgvilleNick/status/1117056515532369922","@EaglesWinItAll Is North Korean government run radio station an option?","916391716902469633"
"Fri Apr 05 07:05:09 +0000 2019","https://twitter.com/ShanghaiSO/status/1114061396357058560","In April 1993 and April 2009, we performed at the Sun Festival - an annual Festival created by the North Korean government which involved their annual 'April Spring Friendship Art Festival'. #FromTheSSOArchive #SSO140 https://t.co/L0RbGJhwHf","984102459642695684"
"Thu Apr 25 18:25:51 +0000 2019","https://twitter.com/USRealityCheck/status/1121480457848225792","North Korea insisted the US pledge to pay the bill before releasing the college student, who was in a coma The North Korean government presented the United States with a bill for $2 million for the hospital care of Otto Warmbier, the Amer... https://t.co/2ajKbfnTlH #USNews #USRC https://t.co/nMMNCHyGrD","72552866"
"Thu Apr 25 19:38:36 +0000 2019","https://twitter.com/RobinStanfill2/status/1121498763498086401","The North Korean government presented the US with a bill for $2 million for the hospital care of Otto Warmbier &amp; insisted the US sign a pledge to pay the bill before releasing him from their custody in 2017. Otherwise they had to Ransom him 💔 He died 
https://t.co/IrfTz16Gr2","855441846193053696"
"Mon Apr 15 20:05:31 +0000 2019","https://twitter.com/1190KEX/status/1117881657619431425","As part of an unsettling crackdown on 'superstitious activities,' the North Korean government publicly executed a pair of fortune tellers. https://t.co/MKfhxHQ96B","52201725"
"Thu Apr 18 12:17:23 +0000 2019","https://twitter.com/RNicholasBurns/status/1118851011853062144","Secretary Pompeo must be doing something right if the North Korean government is demanding he leave the talks.","970563998"
"Fri Apr 26 00:04:31 +0000 2019","https://twitter.com/metroadlib/status/1121565684373364737","i also SERIOUSLY doubt warmbier saw the inside of a hospital.

and if you believe the north korean government issued $2M in palliative care to a college kid it tortured to the point of incapacitation, you shouldn't be allowed to procreate.","128603479"
"Thu Apr 25 21:06:46 +0000 2019","https://twitter.com/LarryLuvLife/status/1121520950590066688","The North Korean government presented the United States with a bill for $2 million for the hospital care of Otto Warmbier, the American college student who was held as a prisoner by… https://t.co/0gZJxEiRFo","25891824"
"Thu Apr 25 23:47:59 +0000 2019","https://twitter.com/francesberzerk/status/1121561521912524802","@senrobportman What can you tell your constituents about the $2 million payment to the North Korean government for the release of Ohio resident Otto Warmbier?","740322967691788288"
"Thu Apr 25 22:36:14 +0000 2019","https://twitter.com/Madeitacross/status/1121543466415210497","The U.S. received a $2 million hospital bill in 2017 from the North Korean government for the care of American Otto Warmbier, who fell into a coma for unknown reasons while he was detained in the country, according to a report. https://t.co/rAnWODowAq","3023251704"
"Thu Apr 25 20:30:27 +0000 2019","https://twitter.com/WordsOfVision/status/1121511811717578752","""The North Korean government presented the United States with a bill for $2 million for the hospital care of Otto Warmbier, the American college student who was held as a prisoner by... https://t.co/WgYgsOV466","65560409"
"Wed Apr 17 23:06:47 +0000 2019","https://twitter.com/MM_PoliticsNow/status/1118652054048845824","@nytimes I don't know what's dumber: Believing Trump or believing the North Korean government.","1037695521023053824"
"Thu Apr 11 05:42:03 +0000 2019","https://twitter.com/shah_sheikh/status/1116214808087449600","DHS and FBI Uncovered North Korean Government Owned Hoplight Malware in Government Network: DHS and FBI discovered a new sophisticated malware called “Hoplight” which is operated by the North Korean Government as Hidden Cobra spotted on U.S government… https://t.co/J2a62WYIQk https://t.co/Iy6QRYaJPh","340491651"
"Wed Apr 03 07:16:12 +0000 2019","https://twitter.com/legendre007/status/1113339398701981696","In retrospect, I think it’s less likely that the 2014 hacking of Sony was done by the North Korean government than by a disgruntled Sony employee (pardon me; “disgruntled Sony employee” might be a redundancy).","104790170"
"Wed Apr 10 18:58:15 +0000 2019","https://twitter.com/SierraExperts/status/1116052789787074560","The Department of Homeland Security (DHS) and the FBI have identified a Trojan malware variant—referred to as HOPLIGHT—used by the North Korean government. Learn more: https://t.co/poEbe2UDEd","65706816"
"Thu Apr 25 17:21:40 +0000 2019","https://twitter.com/ciphrelle/status/1121464305457692672","Trump folds like wet towelettes in the faces of dictators. This fool really shelled out millions to the North Korean government and tried to make it seem like he's some smooth talking negotiator. 

#DerangedDonald gets played like a violin every day of the week.","2283036890"
"Thu Apr 11 12:31:07 +0000 2019","https://twitter.com/cipherstorm/status/1116317753797795840","New Hoplight malware marks re-emergence of Lazarus Group.: The Lazarus Group hacking operation, thought to be controlled by the North Korean government, has a new malware toy to pitch at potential targets and the US is getting worried about it. This… https://t.co/OHQErbmftQ https://t.co/PmCXskSpvJ","115563016"
"Wed Apr 03 21:08:14 +0000 2019","https://twitter.com/MaskedNarwhal/status/1113548788356997120","Okay Google, overthrow the North Korean government.","1297624734"
"Fri Apr 26 00:38:00 +0000 2019","https://twitter.com/OGrady_Texas/status/1121574109912002560","The North Korean government sent a $2 million bill for its lethal maltreatment of Otto Warmbier. I don't believe anyone besides the tyrannical Kim family and its closest henchmen have ever gotten $2000 worth of medical care in North Korea, much less $2 million.","1138727461"
"Sun Apr 21 00:37:39 +0000 2019","https://twitter.com/BridgeBilingual/status/1119762082226769920","@parolz_otunba Do you mean the Chinese government?  Their past origins were bandits, and they are doing the same thing as the underworld. In the near future, they will become another North Korean government, and they will be more destructive to the civilized world.","1045903932633997314"
"Fri Apr 26 11:20:02 +0000 2019","https://twitter.com/Rocketnews1/status/1121735685705228288","North Korea Handed U.S. $2 Million Bill Before Returning Otto Warmbier: Reports 

The North Korean government demanded that American officials agree to pay $2 million for the medical treatment of Otto Warmbier before... | https://t.co/VMFjInGrAO https://t.co/G8qiA9R0ue","1286106229"
"Wed Apr 10 16:59:03 +0000 2019","https://twitter.com/shah_sheikh/status/1116022795614339072","U.S. government issues new warning about North Korea-linked malware: Department of Homeland Security and FBI officials are warning industry about what they say are new Trojan malware variants that North Korean-government-backed hackers have deployed as… https://t.co/BnGTgPp2Qz https://t.co/Nbcu8wuOzi","340491651"
"Mon Apr 29 17:34:09 +0000 2019","https://twitter.com/MeltzerSaidWhat/status/1122916995345862656","""And while you're here, you're not to look at our women or rape them."" - North Korean government escort

This is a must listen episode. @HeyHeyItsConrad @EBischoff @83Weeks","1035663197909348353"
"Tue Apr 23 13:53:51 +0000 2019","https://twitter.com/Schmoop0521/status/1120687229649580038","@TheWestonMike @TertiusIII @Lizzy_Lang7 @StandBackUp2 @Atheism_Has_Nil @__Helicon__ @hauxton @Kopernikus1966 @eldrave20 @RobertEarnsha15 @jamespking1963 @Brimshack @TakeThatEpi @HaircutSpock @hi_hat_truth @pray2pesci @RealAnonDouche @fromgoo2ulies @mickeytidewater @RTheatheist @zalphaprime @umfpt @DougzInBoston @CrispyCurry @orna_verum @bruce_calman @God2Evolution @Mwforhr @jools6691 @daniel52464547 @Velvetpage @CollinOctantis @CriticalCripple @TedPerkins10 @geraldpayne25 @Atheist_Dragon @sonnyboyorange @Teacherofwords @Jandrewgotsguns @JHerbatov @questions_faith @AndyBuzz72 @MaryVMos1 @4b85e900d1ed489 @atheistic_1 @GardenerN21 @BadBunnyBrigade @Jonywalker56 @travisdon1981 @EveKeneinan Isn't it striking that the only other modern equivalent is the North Korean government's policy of punishing generations of a single family for the 'crimes' committed by a single individual?","749287932507222017"
"Thu Apr 11 00:12:45 +0000 2019","https://twitter.com/cix_eria/status/1116131938123702282","every now and again i remember the time my friend &amp; i had a hungover dinner at a restaurant run by the north korean government, with 1/2 my extended family, on christmas day","996262115903029249"
"Mon Apr 15 19:57:22 +0000 2019","https://twitter.com/WONW1280/status/1117879608714469377","As part of an unsettling crackdown on 'superstitious activities,' the North Korean government publicly executed a pair of fortune tellers. https://t.co/tebSRmgabf","2974834067"
"Thu Apr 25 16:41:40 +0000 2019","https://twitter.com/loft305/status/1121454236288475141","Um, I say why pay for something caused at the hand of North Korean government? Maybe Don can pay for it out of his own pocket if he's feeling so generous. A lot of people could be fed for a week for $2 million. What happened to - ugh, I don't even like these words - America 1st?","32501985"
"Thu Apr 25 19:38:46 +0000 2019","https://twitter.com/joshtpm/status/1121498806921695232","pretty hard to see how this isn't a ransom. Warmbier wasn't a guest who got sick. He was a prisoner. Whatever else we can say about how he ended up dead his medical care was definitely the responsibility of the North Korean government.","21268897"
"Thu Apr 25 20:45:16 +0000 2019","https://twitter.com/WhosoeverWill1/status/1121515543263977473","North Korea presented US with $2 million bill for care of Otto Warmbier - CNN - North Korea presented US with $2 million bill for care of Otto Warmbier  CNN
The North Korean government presented the United... #NewsAndInformation https://t.co/SBIloPGbvd","1144417399"
"Fri Apr 26 12:10:00 +0000 2019","https://twitter.com/55KRC/status/1121748257758167042","The North Korean government billed the United States $2 million to cover the cost of medical care for American Otto Warmbier.

https://t.co/7Rrq80LNkW","19293193"
