"created_at","url","full_text","user_id_str"
"Sat Aug 29 06:51:01 +0000 2020","https://twitter.com/VOM_USA/status/1299600426908745733","NORTH KOREA: Pray for elderly North Korean missionaries who regularly risk their lives to share the gospel. https://t.co/wsEHh9m6P6","43343869"
"Sun Aug 30 12:11:05 +0000 2020","https://twitter.com/RonMilnerBoodle/status/1300043361441767425","When a liberal leaves the democrat party and becomes a republican, it is like a North Korean escaping to South Korea for freedom.","2463627350"
"Sat Aug 29 18:21:02 +0000 2020","https://twitter.com/HotTankie/status/1299774073866780673","I do not understand North Korean stans https://t.co/Ilqui7pDn2","1137564060239765504"
"Sun Aug 30 18:33:18 +0000 2020","https://twitter.com/flawsome_guy/status/1300139548333150209","What is the difference between Modi govt and North korean govt?

One is ruthless, that doesn't care about it's citizens &amp; force it's decisions on people and the other one is the North korean govt.

#Mann_Ki_Nahi_Student_Ki_Baat","905510016370622464"
"Mon Aug 31 22:24:14 +0000 2020","https://twitter.com/LRH_Superfan/status/1300560052546408449","They (CIA and NGOs) allegedly smuggle Flash drives with American media on them to the DPRK to show them the benefits of America and I can't stop thinking about how there maybe is a North Korean guy who has seen the entirety of Seinfeld. Idk why it's just funny to me","954283519580221440"
"Mon Aug 31 23:39:27 +0000 2020","https://twitter.com/ArmorCollection/status/1300578983239725056","OTDIH: During fighting on the Pusan Perimeter in the Korean War, Tank Commander Ernest Kouma defends his M26 Pershing for 9 hrs against a massive North Korean night assault. Kouma single-highhandedly kills 250 enemy before withdrawing at daylight. https://t.co/8VkdPKUoc6","1151486357866450944"
"Sat Aug 29 21:15:43 +0000 2020","https://twitter.com/politvidchannel/status/1299818034610098176","BREAKING: Donald Trump wanted his inauguration to look like a North Korean military parade in 2017, According to a new Melania tell-all book.","4878610324"
"Mon Aug 31 07:31:11 +0000 2020","https://twitter.com/whale_alert/status/1300335310203695106","⚠  12 #BTC (139,465 USD) of forfeited funds transferred from Forfeited North Korean Funds to unknown wallet

Tx: https://t.co/PSjU08iTbj","1039833297751302144"
"Sun Aug 30 00:02:22 +0000 2020","https://twitter.com/DHStokyo/status/1299859974785441792","Trump wanted his inauguration to look like a North Korean military parade, per the new book ""Melania and Me."" 

Trump is quoted as saying: ""I want tanks and choppers. Make it look like North Korea.”

Do you want America to ""look like North Korea?"" I sure as hell don't. https://t.co/We1a5zL2vE","26443215"
"Sun Aug 30 20:31:29 +0000 2020","https://twitter.com/realTuckFrumper/status/1300169290935660545","Trump Reportedly Wanted a North Korean Style Military Parade for His Inauguration: ‘Wanted Goose-Stepping’ https://t.co/27nR9r6hb5","55060090"
"Sat Aug 29 20:21:46 +0000 2020","https://twitter.com/Reddy/status/1299804457014788096","&gt;&gt; Donald Trump wanted his inauguration to look like a North Korean military parade. When discussing the parade with Winston Wolkoff and Ivanka during the transition, Trump said: “I want tanks and choppers. Make it look like North Korea,” he told them. &lt;&lt;

https://t.co/eGVEGEd5ID","21312469"
"Mon Aug 31 12:22:59 +0000 2020","https://twitter.com/atthawhipped/status/1300408744942034945","An OFFGUN au where
The absolute top secret love story of a chaebol heir (Gun) who made an unexpected landing in North Korea because of a paragliding accident and a North Korean (Off)  special officer who falls in love with him and who help him by hiding him and protecting him. https://t.co/hfydPgF8O9","1256237531152084992"
"Mon Aug 31 12:33:10 +0000 2020","https://twitter.com/thomascusack/status/1300411305766064130","$140,000 of North Korean Bitcoin Targeted by DoJ Starts Moving https://t.co/eljYhZhQDu","196906945"
"Sat Aug 29 09:23:13 +0000 2020","https://twitter.com/luke_b3tts/status/1299638728378515457","Always thought I had north korean blood in me like, glad to get the confirmation","552937462"
"Sun Aug 30 02:45:12 +0000 2020","https://twitter.com/TheTriarii/status/1299900951038394368","One step closer to North Korean liberation https://t.co/sFmYqmiwce https://t.co/et5U9Kfyse","3002684195"
"Mon Aug 31 01:55:41 +0000 2020","https://twitter.com/HollinsMrhump/status/1300250876095787008","Why do people hate criticism? I give hopeless journos heaps and I’m nit anonymous. A lot of journos obviously prefer the North Korean and Chinese systems.","1916796271"
"Mon Aug 31 20:34:19 +0000 2020","https://twitter.com/TheJusticeDept/status/1300532393384828928","Company Pleads Guilty to Money Laundering Violation as Part of Scheme to Circumvent North Korean Sanctions and Deceive Banks, Agrees to Pay Forfeiture and Fine https://t.co/n4QKSD3GF0","73181712"
"Sat Aug 29 16:55:47 +0000 2020","https://twitter.com/JustinTarquin/status/1299752620962258944","July, 1950. After North Korean troops crossed the 38th Parallel late June, President Truman sent US military aid to assist South Korean forces being routed. An anxious nation turned for guidance to the recently-formed National Basketball Association, which approved the measures.","1266714520304717826"
"Mon Aug 31 11:14:33 +0000 2020","https://twitter.com/teacherdude/status/1300391522618220550","These guys make North Korean state-run media look like Indymedia https://t.co/U35j1E62Fg","10257602"
"Sat Aug 29 21:30:06 +0000 2020","https://twitter.com/PolicyRob/status/1299821654223327238","I just made myself laugh by saying to someone that North Korean loony Kim Jong-Un being in a coma means he's probably the only vegetable in that country. 😂","2675910384"
"Mon Aug 31 16:28:45 +0000 2020","https://twitter.com/BudGothmog44/status/1300470590709661700","More from Melania pal's book: Trump wanted inauguration to be like North Korean military parade https://t.co/O7qSagHnGG","414221776"
"Sat Aug 29 22:10:58 +0000 2020","https://twitter.com/robjeffecology/status/1299831938467926017","Starmer has his North Korean cult paper to PR for him...","231497466"
"Sun Aug 30 22:20:47 +0000 2020","https://twitter.com/michaelmalice/status/1300196798280200192","please tell me more about north Korean TV","44067298"
"Sat Aug 29 22:05:52 +0000 2020","https://twitter.com/BeachPretzel2/status/1299830655484911617","INSANE: Trump wanted inauguration to look like North Korean military parade. When discussing parade with Wolkoff &amp; Ivanka, Trump said: “I want tanks and choppers. Make it look like North Korea."" Trump really wanted goose-stepping troops and armored tanks.
 https://t.co/LVEVMFzLez","712352983908950016"
"Sat Aug 29 05:09:32 +0000 2020","https://twitter.com/boell_secpol/status/1299574884633374721","Today is International Day Against #Nucleartests. @boell_stiftung just published a study on nuclear tests in Algeria. Next year we want to to take a fresh look at the environmental and health impact of past Soviet tests in Kazakhstan - and on recent North Korean tests. Stay tuned","986503977083768832"
"Mon Aug 31 20:00:27 +0000 2020","https://twitter.com/RyanMaue/status/1300523870521356292","Next door to Typhoon Maysak is another developing storm (Haishen) that is forecast to become quite intense over the next few days -- and then zoom north across Japan into Korean Peninsula.  

Now, this is a legitimate ""double barrel"" Typhoon situation (25°N latitude) https://t.co/HRlBUbMIFH","16117029"
"Mon Aug 31 20:38:27 +0000 2020","https://twitter.com/LJT_is_me/status/1300533433593147392","— Yang Ban Corporation, a company established in the British Virgin Islands in 2014 

Company Pleads Guilty to Money Laundering Violation as Part of Scheme to Circumvent North Korean Sanctions and Deceive Banks, Agrees to Pay Forfeiture and Fine https://t.co/WFTTHAAIYK","787736606195277824"
"Mon Aug 31 01:00:01 +0000 2020","https://twitter.com/PumaPodcastPH/status/1300236867200331778","#ArawNgMgaBayani: Did you know that Filipino soldiers had their own ""300"" moment in the Korean War? In the Battle of Yultong, 900 soldiers fought against 40,000 Chinese and North Korean troops—and won.

Listen to the full podcast episode: https://t.co/8vOlyAtzIO https://t.co/MtkIevm6mP","1087611796830048256"
"Sat Aug 29 21:32:58 +0000 2020","https://twitter.com/Liberty2Bfree/status/1299822376184475648","Trump acts like a NORTH KOREAN DICTATOR!","825457288257245184"
"Sat Aug 29 10:17:01 +0000 2020","https://twitter.com/jedisct1/status/1299652265268121600","RT @campuscodi: The Lazarus Constellation - A study on North Korean malware

PDF: https://t.co/68LPpN8MwO https://t.co/vHB15nqq9D","17396038"
"Sat Aug 29 21:07:32 +0000 2020","https://twitter.com/dlippman/status/1299815976960229376","SCOOP: According to a new Melania tell-all, Donald Trump wanted his inauguration to look like a North Korean military parade. When discussing the parade during the transition, Trump said: “I want tanks and choppers. Make it look like North Korea."" https://t.co/2RVweiFlsX","20813112"
"Mon Aug 31 09:17:49 +0000 2020","https://twitter.com/ColinZwirko/status/1300362145389924352","North Korean TV on Sunday Aug. 30 repeatedly aired warnings over expected heavy rains from Typhoon 9 (Typhoon Maysak) on the east coast this week. Comes after Typhoon Bavi did some officially non-devastating damage, and after severe flood damage earlier in August. https://t.co/WE63tp0hxD","886337222"
"Sun Aug 30 01:32:44 +0000 2020","https://twitter.com/carol_33410/status/1299882713755914240","Donald Trump wanted his inauguration to look like a North Korean military parade. When discussing the parade with Winston Wolkoff and Ivanka during the transition, Trump said: “I want tanks and choppers. Make it look like North Korea,” he told them.","845824702954246144"
"Sat Aug 29 12:00:00 +0000 2020","https://twitter.com/theflynews/status/1299678183722115072","ConsenSys acquires #blockchain platform Quorum as U.S. looks to seize 280 #crypto accounts tied to North Korean hacks. Find out more in ""The Intersection"" weekly from @theflynews $BTC $BITCOIN $JPM $MARA $RIOT $AMD $NVDA $OSTK $IDEX $TEUM $SRAX https://t.co/uILji1FUJr https://t.co/1dYpfe4pzZ","166597717"
"Mon Aug 31 20:26:16 +0000 2020","https://twitter.com/USAO_DC/status/1300530365967282181","Company Pleads Guilty to Money Laundering Violation as Part of Scheme to Circumvent North Korean Sanctions and Deceive Banks, Agrees to Pay Forfeiture and Fine https://t.co/WMQAsHG7Tn","718112006"
"Sun Aug 30 07:17:35 +0000 2020","https://twitter.com/karen_killjoy/status/1299969499634917376","""The North Korean army could not keep my mother under control when it comes to event planning.""","137260298"
"Sat Aug 29 14:53:45 +0000 2020","https://twitter.com/LondonShortwave/status/1299721909777698820",".@ree_rne's Amigos de la Onda Corta currently discussing North Korean radio and various SIGINT transmissions. Weird and wonderful to be hearing a recording of one shortwave transmission inside another. https://t.co/zexZHbaNJi","1566672206"
"Sat Aug 29 16:11:40 +0000 2020","https://twitter.com/okxinsights/status/1299741516089483269","Another #Bitcoin-focused fund, a new #crypto #mining giant and North Korean hackers — these stories and more in this week's edition of Crypto #News of the Week👇
https://t.co/1U5BCZOk5K","1255406674703245314"
"Mon Aug 31 17:36:22 +0000 2020","https://twitter.com/SharonDomier/status/1300487609580490753","Don’t know who needs to see this but the Internet Archive has a huge collection of North Korean karaoke videos. https://t.co/wINESBCCH0","1416856332"
"Sun Aug 30 07:26:47 +0000 2020","https://twitter.com/who_is_sumi/status/1299971814890917892","showing a north korean a marvel movie to break le commie mind control","1155666964997689345"
"Sat Aug 29 22:09:26 +0000 2020","https://twitter.com/robjeffecology/status/1299831551551852544","@GdnPolitics Jesus the Guardian is cult like North Korean propaganda for Starmer....","231497466"
"Sat Aug 29 12:30:04 +0000 2020","https://twitter.com/Macheath1/status/1299685748921298945","World Animal Protection: We must stop Kim Jong-Un from killing North Korean Pet Dogs for Meat, Right Now. - Sign the Petition! https://t.co/DqFTNGiFbN via @UKChange","1372426416"
"Mon Aug 31 04:53:57 +0000 2020","https://twitter.com/JinibaBD/status/1300295738535092224","North Korean hacking group using LinkedIn to attack crypto firms #CyberSecurity #osint #infosec #cyberthreats #hackers #darkweb #privacy #databreaches #cyberattacks #cybercrime #cybersec #ThreatIntel #dataprivacy https://t.co/31wFJ4WBz2","2685451873"
"Mon Aug 31 11:27:51 +0000 2020","https://twitter.com/teacherdude/status/1300394866963369984","For those trying to follow events in Greece via English language outlets in the mainstream media, you have basically Fox News style private outlets or North Korean style state-run media, both reporting verbatim the right-wing government's official party line https://t.co/QOzt473hit","10257602"
"Sat Aug 29 15:11:43 +0000 2020","https://twitter.com/chaoticshifter/status/1299726432763953152","@pachdagreat Does it matter? North Korean media is not our problem, #GodiMedia is...","16256934"
"Mon Aug 31 15:27:26 +0000 2020","https://twitter.com/Ceorhemz/status/1300455161463287809","5. Foreign policies. Relative peace in Korean Border. A North Korean president stepped on South Korean soil for the first time in decades. Peace in Syria, latest peace deal between Israel and UAE, Nuclear weapon deal with North Korea, Jerusalem dispute resolution etc","579802621"
"Sat Aug 29 10:52:00 +0000 2020","https://twitter.com/NLAILtd/status/1299661072635441152","A.I. Helped Uncover Chinese Boats Hiding in North Korean Waters | WIRED  https://t.co/p2ABoAec9k","4096884855"
"Sun Aug 30 13:11:32 +0000 2020","https://twitter.com/YesPISTLiberty/status/1300058574010363905","I can't wait for this book, too! By the way, our memories are not that poor: The part about Trump wanting a North Korean style parade at his inauguration is ABSOLUTELY TRUE. https://t.co/SUpdw3jtDT","1135281351677161472"
"Mon Aug 31 06:59:06 +0000 2020","https://twitter.com/KenRoth/status/1300327236185317376","As Japan's PM Abe steps down, one of his most important foreign-policy achievements was to spotlight the plight of Japanese citizens who were kidnapped in Japan by North Korean agents to teach Japanese to North Korean spies. Until Abe, few remembered. https://t.co/XmwKewELGZ https://t.co/cEifKFDXPn","17839398"
"Mon Aug 31 17:08:02 +0000 2020","https://twitter.com/benedictrogers/status/1300480479058169856","UN official sounds the alarm on North Korean human rights amid COVID-19 https://t.co/gmzk8KtYs6","49035671"
"Sun Aug 30 04:43:51 +0000 2020","https://twitter.com/hoaxeye/status/1299930812138377216","@sedangkan No. It’s from a comedy movie ‘Blades of Glory’ showing the The North Korean ‘Iron Lotus’ skate move. https://t.co/g6ZFiwNsWn","3131585530"
"Mon Aug 31 10:22:15 +0000 2020","https://twitter.com/twitmericks/status/1300378361131397123","Old Trump was so sorely afraid
The start of his term might look staid,
He craved serried ranks
Of choppers and tanks - 
A full North Korean parade.

#trump
#MelaniaTrump
#NorthKorea

https://t.co/UVpxvluAEE","297333518"
"Sat Aug 29 11:42:29 +0000 2020","https://twitter.com/FinCrime_Watch/status/1299673776175673344","U.S. DoJ files lawsuit targetting cryptocurrency accounts linked to North Korean hackers and their Chinese agents used to launder around $300 million stolen from more than a dozen virtual currency exchanges. 
https://t.co/YW2epJiNAQ","928725083425734657"
"Mon Aug 31 05:20:00 +0000 2020","https://twitter.com/The_Daily_NK/status/1300302296149118976","North Korean soldiers deployed to Unpa County for recovery efforts, including the rebuilding of houses damaged by flooding, are stealing from locals. https://t.co/wvKdoINCUM #DPRK #NorthKorea https://t.co/znG9x0x0Wy","1342068500"
"Mon Aug 31 13:45:04 +0000 2020","https://twitter.com/ACAfricaCenter/status/1300429401830690816","Join the Africa Center this week for a virtual panel with @TheSentry_Org on North Korean sanctions-busting in the #DRC, featuring @DDolzikova, @j_dellosso, @EnglebertPierre, and @FloribertAnzu.

🗓️ Thursday, September 3
⏰ 2:00 p.m. (EDT)
✍️ Register → https://t.co/yCCHG7UuZF https://t.co/219vNvkRmX","246941599"
"Mon Aug 31 17:58:17 +0000 2020","https://twitter.com/evilvillain1231/status/1300493124654034945","leaked next generation North Korean People's Army uniform designs for 2021. this is real. @USArmy @realDonaldTrump you seen this? https://t.co/Mj3vaZDJK4","1148984025253498880"
"Sat Aug 29 02:03:53 +0000 2020","https://twitter.com/AmazingSMP/status/1299528167657357313","@RohanCT @paul_dowsley @VictoriaPolice You must not know much about about North Korean cities, lot of Middle Eastern and a lot of African cities and a whole much of cities around the world to make such a ridiculous comment like that. Most unliveable city in the world, okayyy.","1119088453"
"Sun Aug 30 21:41:16 +0000 2020","https://twitter.com/6NewsAU/status/1300186851525849089","North Korean State TV have released photos of their leader Kim Jong-un, amid growing rumours surrounding his health.

WATCH @jackhahnj02's full report HERE: https://t.co/Jg4ebJasBl

#6NewsAU #KimJongUn #NorthKorea https://t.co/WfYe0D0DhJ","1255629140562046976"
"Mon Aug 31 18:28:03 +0000 2020","https://twitter.com/TeriRadichel/status/1300500615555031040","The attacks followed the same pattern, with North Korean hackers posing as recruiters at big corporations in order to approach employees at the desired companies. Followed by Office or PDF documents. https://t.co/KvRtKMZTQY","25560338"
"Mon Aug 31 11:27:01 +0000 2020","https://twitter.com/DefenseOne/status/1300394659525599232","North Korean Hackers Upgraded Their Financial-Theft Tools, Feds Warn https://t.co/OqOSgPVhLZ | @MariamBaksh https://t.co/WtM7iwtKOg","1433356862"
"Sun Aug 30 22:44:01 +0000 2020","https://twitter.com/jkbloodtreasure/status/1300202643508342785","in North Korean theology, the sinking of the Titanic heralded the birth of Kim Il-sung, three days later","166682786"
"Mon Aug 31 13:00:00 +0000 2020","https://twitter.com/LibertyinNK/status/1300418057760800769","How did North Korean become what it is today? Watch our crash course on North Korea's history!

If you want to go even further back, read about how #NorthKorea came to be: https://t.co/U91qP1Qjyt https://t.co/yopCsao2FW","21453771"
"Mon Aug 31 21:44:01 +0000 2020","https://twitter.com/mulcs85/status/1300549933838348288","@ThatTimWalker He has a point tho doesn't he? We clearly need more North Korean TV style comedy - maybe some public floggings of non true believers too","2254263485"
"Sun Aug 30 19:04:25 +0000 2020","https://twitter.com/AmnestyIreland/status/1300147381359587333","Hwang In-Cheol has been searching for his father for decades.

Hwang Won arrived involuntarily to North Korea on a hijacked plane on 11 December 1969. North Korean authorities have refused to disclose information regarding his vital status or whereabouts for the last 50 years. https://t.co/incOloNIfP","16309025"
"Mon Aug 31 18:52:02 +0000 2020","https://twitter.com/TsurkanKate/status/1300506651624169473","all I can manage to read lately is non-fiction—memoir of a North Korean defector, Habsburg love tragedy, lives of the Curzon sisters... feels like my brain is filled with static","1235226931244797952"
"Fri Aug 28 18:40:03 +0000 2020","https://twitter.com/FBIPittsburgh/status/1299416470351491072","North Korean cyber actors are using #malware variants to conduct an ATM cash-out scheme to steal money from banking systems. Read more about the threat in a joint press release the #FBI, @CISAgov, @USTreasury, and @US_CYBERCOM published at https://t.co/ikCSqtQYvf. https://t.co/kZ8hrHJNqu","346088812"
"Sun Aug 30 07:57:44 +0000 2020","https://twitter.com/jlantunez/status/1299979602681503746","“Donald Trump wanted his inauguration to look like a North Korean military parade. When discussing the parade with Winston Wolkoff and Ivanka during the transition, Trump said: “I want tanks and choppers. Make it look like North Korea,” he told them”.","6157632"
"Sat Aug 29 16:22:06 +0000 2020","https://twitter.com/TimothyS/status/1299744144009592834","Bolton in his book has nothing but contempt for South Korean President Moon and his attempt to make peace with North Korea. But, just like Trump and Biden, he slobbers all over the neofascist militarist Abe.","15818978"
"Sun Aug 30 15:29:00 +0000 2020","https://twitter.com/RANDCorporation/status/1300093169971986437","This new report by @ScottWHarold, @DerekJGrossman, @MMazarr, @RobinsonL100, and colleagues provides critical insights into the North Korean leadership decisionmaking process: https://t.co/6c5IWTA7Wy","22545453"
"Sat Aug 29 23:34:49 +0000 2020","https://twitter.com/hunterschwarz/status/1299853039088533504","Trump wanted his inauguration to look like a North Korean military parade, according to Melania’s former senior adviser https://t.co/ZR4yR23G6Q https://t.co/lTRvzUSkre","18939358"
"Sat Aug 29 16:46:01 +0000 2020","https://twitter.com/RANDCorporation/status/1299750160252235776","How might #NorthKorea approach economic reforms? What military choices would it face if conventional deterrence fails? And what factors inform Pyongyang's thinking about nuclear doctrine?

This report offers new lessons about North Korean decisionmaking: https://t.co/quUCcEGerC","22545453"
"Mon Aug 31 14:35:34 +0000 2020","https://twitter.com/ShadowingDC/status/1300442109649063940","Fascism 2.0. 

The new book on Melania says that Trump wanted his inauguration to look like a North Korean military parade. “I want tanks and choppers. Make it look like North Korea.” https://t.co/AQVpwWTJaD

Pass this along. Kick him out.","816438390862282752"
"Mon Aug 31 15:59:38 +0000 2020","https://twitter.com/SentinelOne/status/1300463265873502208","🇰🇵 North Korean-backed threat groups continue to adapt and evolve; their latest campaign aims to gather intel from key defense and government contractors. By Jim Walter

https://t.co/JwNs3rPUyY

#cybersecurity #ai #security #infosec #dprk #informationsecurity #cyberattack #ciso","1078221296"
"Sun Aug 30 08:05:36 +0000 2020","https://twitter.com/AFAD_Updates/status/1299981581201760256","#IDD2020StandwithTheDisappeared #SouthKorea 
@NKHumanRights  In South Korea, enforced disappearances occurred since 1950 as the North Korean government has systematically abducted foreign citizens. North Korea abducted 100,000 civilians during the Korean War alone, and 3,835...","52614717"
"Sat Aug 29 10:56:00 +0000 2020","https://twitter.com/threatintel/status/1299662076437094400","#FASTCash: US government exposes North Korean government ATM cashout hacking campaign - Symantec's @vthakur talked to @CyberScoopNews https://t.co/ds0e61m2UT","61870871"
"Mon Aug 31 12:30:00 +0000 2020","https://twitter.com/newscomauHQ/status/1300410510152577026","North Korean state television is usually very strict in how it broadcasts. But in an unprecedented move ordered by Kim Jong-un, that changed.

https://t.co/2VSeoDbNPQ","15250661"
"Mon Aug 31 14:06:01 +0000 2020","https://twitter.com/RANDCorporation/status/1300434673299005440","RAND experts examined two ""what if"" scenarios designed to explore factors that could affect North Korean behavior during a crisis—and what might lead the regime to attack South Korean and U.S. forces.

Here's what they learned: https://t.co/CFNEUtabew","22545453"
"Fri Aug 28 19:44:26 +0000 2020","https://twitter.com/IranNewsUpdate1/status/1299432674847850496","#Iranian government hackers have impersonated journalists to reach out to targets via @LinkedIn, set up WhatsApp calls to win their trust, before sharing links to phishing pages and malware-infected files.
They follow North Korean tactics.
By @campuscodi 
https://t.co/PGnxFIAsg6","1383920448"
"Mon Aug 31 09:11:11 +0000 2020","https://twitter.com/williamnee/status/1300360474765094912","“Here are some of its most revelatory nuggets:

— Donald Trump wanted his inauguration to look like a North Korean military parade.”

🧐 🇺🇸 🇰🇵

https://t.co/JKAY69sSHD","73062993"
"Sun Aug 30 22:26:54 +0000 2020","https://twitter.com/NimaTavRood/status/1300198334343380992","@ovbokhanid @Inter_en I prefer to be honest. Only way to not repeat ones mistakes is to own &amp; learn them. Inter blew it with Zaniolo, Tonali &amp; Kulusevski. 
I don’t do the whole all hail great leader a la North Korean tv thing","707993807"
"Mon Aug 31 12:16:49 +0000 2020","https://twitter.com/koreasociety/status/1300407193318100992","""North Korean authorities publicly rejected U.S. government claims that the country is connected to a financial cybercrime campaign targeting international ATMs, the DPRK’s foreign ministry stated on Aug. 29."" 

@chadocl @nknewsorg 
https://t.co/h2prkudCMf","20260430"
"Mon Aug 31 13:24:21 +0000 2020","https://twitter.com/akuhnNPRnews/status/1300424185764741120","Twitter fully shuts down North Korean propaganda account, @coldnoodlefan. Just as host Un A was rocking a new hairstyle. 
https://t.co/aItzu0CDbE","3036544664"
"Mon Aug 31 17:00:24 +0000 2020","https://twitter.com/nknewsorg/status/1300478556867358722","U.N. special rapporteur on North Korean human rights Tomás Ojea Quintana raised concerns over the ""drastic reduction"" of North Korean defectors entering the South this year. https://t.co/4xKsNOblEw","147017457"
"Mon Aug 24 06:13:55 +0000 2020","https://twitter.com/Jarl_Southpaw/status/1297779147666788353","North Korean government officials: https://t.co/po8T93nAdV","492155817"
