"created_at","url","full_text","user_id_str"
"Wed Aug 30 01:25:07 +0000 2023","https://twitter.com/senatorbabet/status/1696695510638469344","North Korean style censorship laws are coming to Australia thanks to Labor and Liberal. 

This bill will allow the Government to decide what is true and what is not true and then censor what they deem to be untrue. 

The idea for the dis/misinformation bill originated with the https://t.co/s9aixQ36CT","1529982588575977473"
"Wed Aug 30 18:23:38 +0000 2023","https://twitter.com/dewszt/status/1696951829488193922","US Army soldiers securing a mock North Korean Underground Facility (UGF) during a Counter-WMD training exercise in South Korea, 2023 https://t.co/ELIMkK4VV2","1922386764"
"Wed Aug 30 11:24:48 +0000 2023","https://twitter.com/NaksBilal/status/1696846427182280778","Mass protests continue across the capital of Gabon in support of the military who overthrew Ali Bongo early this morning.

NOTE: No Russian, Chinese or North Korean flags in sight; a markedly ideologically different coup - for the people alone.

 https://t.co/6acjsRf1r7","1593035229199048705"
"Wed Aug 30 21:39:56 +0000 2023","https://twitter.com/Sprinterfactory/status/1697001228792672638","The North Korean authorities announced that on Wednesday they conducted a tactical nuclear strike exercise, simulating the destruction of key centers of South Korea's military-political control. https://t.co/P8Mc8ihBE1","1128337957289697281"
"Tue Aug 29 13:49:08 +0000 2023","https://twitter.com/Uniqueclipsfrom/status/1696520362417344542","North Korean cheerleaders at the Winter Olympics https://t.co/szXsKzglmw","1508242082263097349"
"Thu Aug 31 20:03:25 +0000 2023","https://twitter.com/trip_to_valkiri/status/1697339328978977243","MiG-19 still flying within North Korean Air Force, 2020. https://t.co/ts0vWQ9gR9","885081261894664192"
"Thu Aug 31 04:09:28 +0000 2023","https://twitter.com/___sloane/status/1697099257613103388","jisoo went from being hostaged by north korean spy to fighting zombies for her damn life... give her a break 😭 https://t.co/fDHJO4T8vK","1403592121685213185"
"Tue Aug 29 19:09:01 +0000 2023","https://twitter.com/Sprinterfactory/status/1696600860757786869","North Korean leader: Our ships will be equipped with nuclear weapons.

Kim Jong-un said during a visit to the country's naval headquarters that some North Korean warships will be equipped with nuclear weapons. https://t.co/KMcQgGY6jt","1128337957289697281"
"Tue Aug 29 21:14:00 +0000 2023","https://twitter.com/Sprinterfactory/status/1696632313679896701","North Korean leader: The United States has turned the waters near the Korean Peninsula into the most unstable region with the threat of nuclear war. https://t.co/KuRZTds31C","1128337957289697281"
"Thu Aug 31 11:17:24 +0000 2023","https://twitter.com/DarthPutinKGB/status/1697206951808049518","79 weeks of my 3 day war. Russia cannot continue to fight without North Korean ammo which means I have reduced Russia to merely Pyongyang’s proxy so they can fight USA to the last Russian.

I remain a master strategist.","957306920"
"Tue Aug 29 10:39:03 +0000 2023","https://twitter.com/advsanjoy/status/1696472525730185679","Chun-hee was the longest serving North Korean news presenter for Korean Central Television. She became a national legend &amp; retired in 2012. As recognition of her services, Kim Jong Un presented her with a luxury apartment!

https://t.co/cIccgJJqTG","591455001"
"Thu Aug 31 18:43:55 +0000 2023","https://twitter.com/SneppyHusband/status/1697319321578447080","Proof the North Korean furry fandom exists 👀 https://t.co/zAt4DPNFyi","1448128107232342017"
"Tue Aug 29 14:03:24 +0000 2023","https://twitter.com/Josi_Elewa/status/1696523953039438331","I've never read an FBI investigation that references Nigerian hackers. It's only Chinese hackers, Israeli hackers, North Korean hackers, even fucking Iranian hackers I hear about. Is it that Nigerian Hacker-yahoo boys are just too good? What gives?","853297492368257026"
"Thu Aug 31 23:24:34 +0000 2023","https://twitter.com/matttttt187/status/1697389950868590786","🚨DETERRING NK AGGRESSION🚨

‼️ ⚠️ WW3 ALERT – U.S. committed to deterring North Korean aggression: 
Pentagon — Yonhap 📰

⚡The United States is committed to deterring aggression by North Korea, Brig. Gen. Pat Ryder called on North Korea to refrain from making provocative… https://t.co/tNh6WXR0Ol","47435143"
"Wed Aug 30 06:41:15 +0000 2023","https://twitter.com/uttarandhrabo/status/1696775066808181085","This entire North Korean plot is Evergreen Entertaining 💥💥💥💥💥💥💥💥💥💥💥💥💥💥💥💥

#CrashLandingOnYou https://t.co/eJSPwiVOoA","4751443800"
"Tue Aug 29 23:57:37 +0000 2023","https://twitter.com/jenkforum/status/1696673490819232077","milady owns 30 North Korean nuclear missiles https://t.co/vylwKkf3D7","1392350309037395970"
"Wed Aug 30 17:40:19 +0000 2023","https://twitter.com/DeItaone/status/1696940929448321244","US SAYS PUTIN AND KIM TRADED LETTERS AS RUSSIA SEEKS NORTH KOREAN MUNITIONS - SOURCES","2704294333"
"Wed Aug 30 11:05:25 +0000 2023","https://twitter.com/TerryAnn1219/status/1696841547499679865","If you voted for the man who
autographed Bibles for his supporters, saluted a North Korean general, used a Sharpie to change the course of a hurricane, stared into the sun twice, and tweeted a quote from Mussolini, your opinion of Joe Biden's sanity is laughably irrelevant. https://t.co/7D8kvGoZiP","32630870"
"Wed Aug 30 21:27:41 +0000 2023","https://twitter.com/12_31_84/status/1696998146264449104","The North Korean authorities announced that on Wednesday they conducted a tactical nuclear strike exercise, simulating the destruction of key centers of South Korea's military-political control. https://t.co/TXo0rvzrQa","1296326132472709120"
"Wed Aug 30 09:07:36 +0000 2023","https://twitter.com/Kunal_Biswas707/status/1696811899843928338","South Korean Tactical Surface To Surface Missile Non Nuclear Bunker Busting Capability With Thermobaric Warhead Against North Korean 🇰🇷⚡️🇰🇵 Underground Installations While India Has Pralay &amp; LORA With Similar Roles Against Chinese Underground Installations. 🇮🇳⚡️🇨🇳 https://t.co/zx2pLWp7ji","1176452278582071296"
"Wed Aug 30 21:25:16 +0000 2023","https://twitter.com/MyLordBebo/status/1696997537989722115","🇰🇵The North Korean authorities announced that on Wednesday they conducted a tactical nuclear strike exercise, simulating the destruction of key centers of South Korea's military-political control. https://t.co/SkK03mzBT3","1121807798826930177"
"Tue Aug 29 10:32:17 +0000 2023","https://twitter.com/OsintTV/status/1696470822465007727","First time a very rare unseen day to day activities of North Korean people captured on the camera

Presumably these visuals captured by the Chinese residents who live across yalu river https://t.co/xnvrRmg0R3","1428403959362846728"
"Tue Aug 29 08:43:52 +0000 2023","https://twitter.com/BulawayoConnect/status/1696443538639131130","#UmdalaWethu The bronze statue was sculpted by North Korean company Mansudae Art Studio and is erected at the intersection of Joshua Nkomo Street and 8th Avenue in Bulawayo, Zimbabwe's second largest city #VisitBulawayo https://t.co/CQNZEfHNTz","866759903259570180"
"Wed Aug 30 22:46:14 +0000 2023","https://twitter.com/RC_Greenway/status/1697017915139035448","“Broad array of perspectives”…Will DOD be inviting Russian officials to Ukraine conferences?  North Korean officials to disarmament forums? 

This is why we have an intelligence community…we pay them to inform warfighters and policy makers without resorting to foreign agents…","1366417193005690881"
"Thu Aug 31 07:09:33 +0000 2023","https://twitter.com/LSGAirenNA/status/1697144576652317016","Pre-concert gathering of North American Airens. Korean Concert staff bearing concert posters joined us  during picture- taking 😊

#2023_LeeSeungGi_US_Concert_Tour #The_Dreamers_Dream #소년길을걷다  #Chapter2 #USA #LA

#LeeSeungGi #이승기  #HumanMade #휴먼메이드
@byhumanmade_ https://t.co/h0mTu1ArHJ","1373749913637511179"
"Thu Aug 31 18:35:49 +0000 2023","https://twitter.com/AnneChovy2/status/1697317282211332291","there are highly skilled north korean artists making massive paintings and sculptures for african war lords which will be beautiful backdrops to regime change wars and coups","1323099276222832640"
"Wed Aug 30 04:19:25 +0000 2023","https://twitter.com/CBrokr/status/1696739372874281415","Yeah..North Korean soldiers, Russian soldiers, Chinese soldiers.....","1084954715727843328"
"Tue Aug 29 04:39:42 +0000 2023","https://twitter.com/KR3Wmatic/status/1696382090667823549","This is a rare photo of North Korean Founder Kim-ll Sung. He had a baseball size tumour on the back of his head. It’s the only a rare handful of photos in the world where this is shown. Due to the growth being near his brain and spinal cord doctors couldn’t have it removed.

He… https://t.co/wJWMcPsSIM","225548413"
"Wed Aug 30 20:49:38 +0000 2023","https://twitter.com/VinceDaoTV/status/1696988568986550410","I’m not joking

He literally glazes Biden the way North Korean media does for Kim Jong Un

It’s borderline parody","1619852272988557312"
"Wed Aug 30 19:06:17 +0000 2023","https://twitter.com/ValleyAllBlack/status/1696962560317095957","Bloody hell! I could have been like a North Korean General with the amount of this type of badge I could have won 😂😂😂 https://t.co/Z7xSoW8FmR","131534916"
"Thu Aug 31 20:12:46 +0000 2023","https://twitter.com/ianellisjones/status/1697341681228530038","The North Korean military staged a tactical nuclear strike drill simulating “scorched earth strikes” at major command centers &amp; operational airfields in South Korea: @DzirhanDefence https://t.co/o6GF4wjQhs","775261909780197376"
"Thu Aug 31 01:26:17 +0000 2023","https://twitter.com/CyrusShares/status/1697058191333335464","They've Chinese strategic and economic assets for nearly a decade, over 5 million Chinese lived in the Russian east (as well as unknown number of North Korean slaves loaned from Kim regime) as of 2018. Most of forest logging, farming and coal &amp; ore mining is Chinese. https://t.co/cu6DYpdzHP","47107118"
"Thu Aug 31 18:22:00 +0000 2023","https://twitter.com/Ikechukwu_lcc3/status/1697313803787010558","All those lecturing us about why a coup in a 56 year old family autocracy is bad will definitely hold a positive view of it if similar news breaks out today about the North Korean family autocracy. They will all welcome it while calling for a ""democratic transition"".","185321101"
"Wed Aug 30 09:15:47 +0000 2023","https://twitter.com/RomanianMenace/status/1696813955870609725","The ""American Occupation Zone"" is a million times better when it comes to living standards than the ""Glorious North Korean Communist Paradise"" https://t.co/UYtakZ3xlf","1086730112597409793"
"Wed Aug 30 15:21:56 +0000 2023","https://twitter.com/FirstSquawk/status/1696906103974756608","NORTH KOREAN FIRED 2 MISSILES, BOTH LANDED OUTSIDE JAPAN'S EEZ - FUJI TV","3295423333"
"Thu Aug 31 02:00:03 +0000 2023","https://twitter.com/MonashUniKorean/status/1697066689442337074","Registrations are now open for Dr. Lauren Richardson's seminar:

""North Korean Atomic Bomb victims and the politics of victimhood in Japan-DPRK relations.""

Date &amp; time: 20th September, 4pm
Venue: Room G31, LTB, Clayton Campus

[REGISTRATIONS ARE ESSENTIAL - via the QR code] https://t.co/WFs7zMnXH9","1051280157753798656"
"Thu Aug 31 21:49:06 +0000 2023","https://twitter.com/matttttt187/status/1697365923470962930","🚨MILITARY COMMAND DRILL🚨

📍NORTH KOREA 🇰🇵

‼️WW3 UPDATE – North Korea conducts military command drill aimed at occupying South Korean territory — Yonhap 📰

North Korea has launched a military command post drill involving the scenario of occupying South Korean territory, in…","47435143"
"Wed Aug 30 23:46:14 +0000 2023","https://twitter.com/Global_Mil_Info/status/1697033014264349000","North Korean leader, Kim Jong Un, watched over a command post exercise in response to ongoing ROK-US combined command post exercises. This is reportedly the first time that North Korea highlighted this type of military command training. 

The exercise focused on frontline https://t.co/pMu0oZFEQH","905563470707515394"
"Wed Aug 30 08:01:22 +0000 2023","https://twitter.com/IanECox/status/1696795229334966639","At least there's no Russian and North Korean flags.. 

A key difference between this and the other dubious coups like Niger, where agitators have to throw in external power flags to add legitimacy to their narrative. 

This coup was a long time coming.","715095151442599936"
"Thu Aug 31 01:25:41 +0000 2023","https://twitter.com/manickamtagore/status/1697058040825176081","Sahib wants our Parliament also to be North Korean Parliament which only rubber stamps.","74388898"
"Thu Aug 31 04:20:15 +0000 2023","https://twitter.com/Terror_Alarm/status/1697101972401254439","🚨☢️🇰🇵 For the first time, North Korean leader, Kim Jong Un, watched over a command post exercise focused on frontline offensive operations, disruption operations, and tactical and strategic nuclear strike drills simulating annihilating key posts in South Korea. https://t.co/sa1nhghKld","754718787237281792"
"Wed Aug 30 23:10:11 +0000 2023","https://twitter.com/TheInsiderPaper/status/1697023940919537700","NEW 🚨 North Korea has said it fired two short-range ballistic missiles as part of a “tactical nuclear strike drill” prompted by US-South Korean military exercises - state media

READ: https://t.co/kkDBdOmQwo https://t.co/MwNHw8UCU2","1247223374717296647"
"Wed Aug 30 22:13:11 +0000 2023","https://twitter.com/Rebecca21951651/status/1697009596982849916","@vinay_kishore @JeremyFarrar @royalsociety @edwardcholmes @Nature @Magda_Skipper Wow it's like the North Korean Army with medals bestowed from @wellcometrust 's @JeremyFarrar to all the compromised and unethical people behind Proximal Origins!

Thanks for letting yourselves be used @royalsociety 

A disgrace.

cc: @DrTedros @mvankerkhove @SharriMarkson https://t.co/ttAgcEBlTh","1577519413984727040"
"Thu Aug 31 10:10:21 +0000 2023","https://twitter.com/yasminalombaert/status/1697190075837092283","Russia said  it intended to develop ties with North Korea, while not confirming a statement by the White House that Russian President Vladimir Putin had exchanged letters with North Korean leader Kim Jong Un.

The White House said on Wednesday it was concerned that arms… https://t.co/EyJnVaMxyY","907742475468623872"
"Wed Aug 30 15:22:21 +0000 2023","https://twitter.com/AZ_Intel_/status/1696906208123273624","NORTH KOREAN FIRED 2 MISSILES, BOTH LANDED OUTSIDE JAPAN'S EEZ. - FUJI TV","946218357551853569"
"Thu Aug 31 01:54:12 +0000 2023","https://twitter.com/RadioFreeTom/status/1697065216859689389","It was only some 35 years ago that the North Koreans were asking the Soviets for weapons. Putin now has to go with a tin cup to a starving hermit kingdom to get weapons for a war nobody wanted but him. Greatest Russian leader since Peter and all that.","459872442"
"Thu Aug 31 14:08:09 +0000 2023","https://twitter.com/Dinosn/status/1697249921815167057","North Korean Hackers Deploy New Malicious Python Packages in PyPI Repository https://t.co/EoTodVBdYB","128484298"
"Wed Aug 30 17:40:05 +0000 2023","https://twitter.com/FirstSquawk/status/1696940869125799954","US SAYS PUTIN AND KIM TRADED LETTERS AS RUSSIA SEEKS NORTH KOREAN MUNITIONS - SOURCES","3295423333"
"Thu Aug 31 17:39:30 +0000 2023","https://twitter.com/jaysonstreet/status/1697303108278181999","North Korean Hackers Deploy New Malicious Python Packages in PyPI Repository https://t.co/5el30OC6iv","19489212"
"Thu Aug 31 12:54:44 +0000 2023","https://twitter.com/sysadafterdark/status/1697231445507346623","It’s 2007. You boot up your Windows Vista PC, double click on Crysis64.exe and load your game. You sneak down to the beach, pick up a turtle, and proceed to beat the ever living shit out of a North Korean solider with it. The world is good. The world makes sense.","1343373687878266880"
"Thu Aug 31 12:47:36 +0000 2023","https://twitter.com/TheHackersNews/status/1697229652694114604","🚨 New Threat Alert! Researchers uncover 3 more malicious Python packages in PyPI repository under VMConnect campaign. North Korean state-sponsored actors suspected.

Read: https://t.co/YEyZqeHHRP

#infosec #cybersecurity","209811713"
"Wed Aug 30 22:21:26 +0000 2023","https://twitter.com/Aviation_Intel/status/1697011673155121446","Ukraine Situation Report: Russia Advancing North Korean Artillery Deal
https://t.co/RtFiz4dfYr","613212190"
"Wed Aug 30 15:34:28 +0000 2023","https://twitter.com/AP/status/1696909254895059245","The White House said that it has new intelligence that shows Vladimir Putin and North Korean leader Kim Jong Un have swapped letters as Russia looks to North Korea for munitions for the Ukraine war. https://t.co/otUdMrB5rW","51241574"
"Thu Aug 31 18:47:56 +0000 2023","https://twitter.com/BleepinComputer/status/1697320330086203851","North Korean hackers behind malicious VMConnect PyPI campaign - @billtoulas
https://t.co/qMl4TD3Hql","50026664"
"Thu Aug 31 19:08:06 +0000 2023","https://twitter.com/inside_nk/status/1697325406989242557","Russian President Vladimir Putin and North Korean leader Kim Jong-Un have exchanged letters pledging to increase their cooperation.","3435649113"
"Wed Aug 30 21:45:00 +0000 2023","https://twitter.com/CBSNews/status/1697002502871306608","Russian President Vladimir Putin and North Korean leader Kim Jong Un have exchanged letters pledging to increase their cooperation, the White House said. https://t.co/Ne0DtZ2eGX","15012486"
"Wed Aug 30 22:15:28 +0000 2023","https://twitter.com/thewarzonewire/status/1697010171438891447","Ukraine Situation Report: Russia Advancing North Korean Artillery Deal https://t.co/JxPVFVul86","723234222945767424"
"Thu Aug 31 12:48:59 +0000 2023","https://twitter.com/unix_root/status/1697230000179593221","🚨 New Threat Alert! Researchers uncover 3 more malicious Python packages in PyPI repository under VMConnect campaign. North Korean state-sponsored actors suspected.

Read: https://t.co/9rEKN1GNeF

#infosec #cybersecurity","418821190"
"Thu Aug 31 05:06:49 +0000 2023","https://twitter.com/JohnLukeSam1/status/1697113692259655767","Unlike Trump, President Biden doesn't give away political capital just to have showy summits with Kim nor does he salute North Korean generals. 
What Biden does is warn them!
https://t.co/q3MwwS2h24","1138814255854247941"
"Wed Aug 30 16:06:07 +0000 2023","https://twitter.com/InstaNewsAlerts/status/1696917221207883825","The White House said that it has new intelligence that shows Vladimir Putin and North Korean leader Kim Jong Un have swapped letters as Russia looks to North Korea for munitions for the Ukraine war. (AP)","1293453439"
"Thu Aug 31 00:45:01 +0000 2023","https://twitter.com/NewsHour/status/1697047805267767396","The White House on Wednesday said that it has new intelligence that shows Russian President Vladimir Putin and North Korean leader Kim Jong Un have swapped letters as Russia looks to North Korea for munitions for the war in Ukraine. https://t.co/V3dn9Fp0TH","14437914"
"Wed Aug 30 15:24:52 +0000 2023","https://twitter.com/JM_Szuba/status/1696906839181373850","The White House says Kim Jong-Un and Vladimir Putin have corresponded as Russia seeks North Korean artillery shells and raw materials for its war effort in Ukraine. 

Sergei Shoigu recently travelled to Pyongyang, WH NSC coordinator John Kirby says.","908768690455371780"
"Thu Aug 31 06:27:53 +0000 2023","https://twitter.com/ryankakiuchan/status/1697134090619658512","North Korean leader Kim Jong Un reviewed a plan to “counterattack and occupy the entire territory” of South Korea during a visit to a military training command center, according to state media.","385397551"
"Wed Aug 30 05:25:49 +0000 2023","https://twitter.com/JonBergdahl/status/1696756083795087661","South Korea get it.

Twitter reactionaries, once North Korean tanks are on South Korean soil: “We should be aiming for peace! If you ask me they should just let North Korea keep the South Korean territory they’ve annexed. We need peace!”","3244538039"
"Thu Aug 31 17:25:06 +0000 2023","https://twitter.com/ForeignAffairs/status/1697299484961624223","“Ultimately, the North Korean nuclear crisis is a reflection of North Korea’s government. Until that regime either dramatically reforms itself or collapses, the nuclear threat will remain.”
https://t.co/Qs4GjfOipw","21114659"
"Tue Aug 29 17:11:05 +0000 2023","https://twitter.com/AnoNakamigo/status/1696571184018583628","@iamkeegan3 @0xSpot milady owns 30 North Korean nuclear missiles","4917456893"
"Thu Aug 31 05:00:01 +0000 2023","https://twitter.com/ajc/status/1697111979121353104","The White House on Wednesday said that it has new intelligence that shows Russian President Vladimir Putin and North Korean leader Kim Jong Un have swapped letters as Russia looks to North Korea for munitions for the war in Ukraine. https://t.co/7Ie3uui41G","4170491"
"Tue Aug 29 15:36:00 +0000 2023","https://twitter.com/ZaleskiLuke/status/1696547255174488345","This is embarrassing even by North Korean standards of ass-kissing Dotards.","1488026569"
"Tue Aug 29 19:53:00 +0000 2023","https://twitter.com/Marinetimes/status/1696611929987391669","North Korean leader calls for military to be prepared against invasion
https://t.co/nvBzYmpTvo","185340210"
"Wed Aug 30 12:56:03 +0000 2023","https://twitter.com/EuroWynner/status/1696869388522070525","For those wondering I’m selling surplus North Korean rocket technology to support the secret Canadian nuclear program.","501937343"
"Thu Aug 31 01:47:36 +0000 2023","https://twitter.com/VRMurphy/status/1697063557836271842","@myhlee @MaxBoot Good luck with that #Putty.
Your future sunflowers (troops) can’t even operate #Russian equipment effectively and now you want to make them try to operate North Korean junk?
Continuing to show the entire world just how desperate @Russia has become militarily. 🤣
🖕
🇺🇸✊🇺🇦","43419232"
"Thu Aug 31 01:23:22 +0000 2023","https://twitter.com/DemopJ/status/1697057460198981959","""The White House on Wednesday said that it has new intelligence that shows Russian President Vladimir Putin and North Korean leader Kim Jong Un have swapped letters as Russia looks to North Korea for munitions for the war in Ukraine.""

https://t.co/Z7TehJq2GE","897673317838016512"
"Wed Aug 30 15:21:45 +0000 2023","https://twitter.com/AP/status/1696906057048572169","North Korea launched a ballistic missile toward the sea hours after the United States flew bombers to the Korean Peninsula in a show of force against North Korea as part of its annual drills with South Korea. https://t.co/g9WX7CrFjd","51241574"
"Wed Aug 30 23:56:11 +0000 2023","https://twitter.com/John_A_Ridge/status/1697035517546692726","As others have pointed out, there is zero open source evidence indicating this has occurred. All North Korean munitions recovered in Ukraine have been identified as third-party re-exports from pre-existing Iranian inventory.","1323650033623859200"
"Wed Aug 30 20:08:14 +0000 2023","https://twitter.com/RFERL/status/1696978150591484234","The latest finding comes just weeks after the White House said it had determined that Russian Defense Minister Sergei Shoigu during a recent visit to Pyongyang called on North Korean officials to increase the sale of munitions to Moscow.
https://t.co/iFz3IokA2m","42700240"
"Thu Aug 31 19:33:00 +0000 2023","https://twitter.com/RANDCorporation/status/1697331675166830989","The growing Chinese, Russian, and North Korean military threats provided key reasons for convening the historic trilateral summit between the U.S., Japan, and South Korea earlier this month.

RAND's Bruce Bennett explains: https://t.co/yLjNJqq2S4","22545453"
"Wed Aug 30 17:39:26 +0000 2023","https://twitter.com/SCMPNews/status/1696940705959067671","US says Putin and Kim traded letters as Russia seeks North Korean munitions
https://t.co/PFHFJVZLs5","23922797"
"Wed Aug 30 15:08:19 +0000 2023","https://twitter.com/Staffy_97/status/1696902675407770081","@Patryk87837486 I like how they created the satellite photo, yet all of the North Korean myths (that was created by the Western Media) have been completely debunked by a Korean teacher. 

https://t.co/5X4jjfODaf","1352411142484881408"
"Tue Aug 29 17:07:34 +0000 2023","https://twitter.com/Rabid8264/status/1696570297275609572","@Victorshi2020 So, in your mind , the only one who should be allowed to speak is Biden?
 How North Korean of you.","120784755"
"Wed Aug 30 03:47:03 +0000 2023","https://twitter.com/STForeignDesk/status/1696731229465583679","South Korean pastor arrested for sexually harassing young North Korean defectors https://t.co/hFwcgGks4i","1131352537"
"Wed Aug 30 02:01:52 +0000 2023","https://twitter.com/Michael56476752/status/1696704760177713176","@senatorbabet ""North Korean style censorship laws are coming to Australia thanks to Labor and Liberal. ""I've  always thought you must have had a head injury as a kid, thanks for confirming it for me","1345295332314292224"
"Tue Aug 29 23:05:37 +0000 2023","https://twitter.com/NKMESSENGER/status/1696660404615717368","A docu film(Utopia) about a North Korean family's escape will be shown in 600 US theaters in October. Co-producer @SueMiTerry said ""It is not about North Korea's nuclear weapons or missile program, but it's about the suffering and humanity of the ordinary North Korean people,""","258194985"
