"created_at","url","full_text","user_id_str"
"Wed Aug 19 15:41:29 +0000 2020","https://twitter.com/B16Antonella/status/1296110044149436416","The North Korean Government: Ban North Korea from taking away all the pet dogs for meat!! - Firma la petizione! https://t.co/E3ZjcrkxHk via @ChangeItalia","1087434954487795715"
"Wed Aug 19 17:21:21 +0000 2020","https://twitter.com/fendente1/status/1296135174351200259","The North Korean Government: Ban North Korea from taking away all the pet dogs for meat!! - Firma la petizione! https://t.co/MyiGfLTnsQ via @ChangeItalia","1021332450893541376"
"Wed Aug 19 16:50:43 +0000 2020","https://twitter.com/ijanis51/status/1296127465228767234","The North Korean Government: Ban North Korea from taking away all the pet dogs for meat!! - Sign the Petition! https://t.co/p1XmEOvCL5 via @Change","1086614858"
"Wed Aug 26 20:17:15 +0000 2020","https://twitter.com/Bank_Security/status/1298716156249833472","FASTCash 2.0: North Korea's BeagleBoyz Robbing Banks
https://t.co/iNOb9toQM8

US government exposes North Korean government ATM cash-out hacking campaign
https://t.co/eQLaSzORRf

#ATM #Malware #cybersecurity #bank https://t.co/2CiCd2CFLu","1886777581"
"Wed Aug 19 20:28:55 +0000 2020","https://twitter.com/titina_q/status/1296182378650644481","The North Korean Government: Ban North Korea from taking away all the pet dogs for meat!! - ¡Firma la petición! https://t.co/w4lgKltEhI via @ChangeorgLatino","1202383224"
"Thu Aug 27 13:58:16 +0000 2020","https://twitter.com/InfoSecHotSpot/status/1298983172479135745","North Korea-backed 'BeagleBoyz' group is targeting banks around the globe, US agencies warn The primary aim of the campaign is to fund the North Korean government https://t.co/uoXtNQVtZj https://t.co/bRbwAAT3el","977112482"
"Sat Aug 08 07:32:50 +0000 2020","https://twitter.com/Elmo_Oxygen/status/1292000805298601988","My tinder bio says I'm into arts and craft but what that really means is I forge US hundred dollar bills at the behest of the north korean government","1240411022600462336"
"Tue Aug 11 17:48:38 +0000 2020","https://twitter.com/Swagata40554611/status/1293242937577373697","@RichaSrivastavP @patelsoha18 @MeenaDasNarayan MAHARASHTRA'S GOVERNMENT IS TURNING INTO NORTH Korean GOVERNMENT, Kim Jong-Un! People of Maharashtra you must stand against it before it's too late!","1273022330202030080"
"Sat Aug 15 10:30:05 +0000 2020","https://twitter.com/invictus_ltd/status/1294582125275029506","In 2015, the North Korean government decided to return to UTC+ 08:30 from UTC+ 09:00 and was officially named the #Pyongyang Time or #PYT. The time zone change went into effect on the 70th anniversary of the #liberation of #Korea.
#North #Korean #government #anniversary https://t.co/O0S7zXs9uS","1234495999546134528"
"Wed Aug 12 20:48:48 +0000 2020","https://twitter.com/TrustedVideos/status/1293650668297707520","ARTICLE:”Israel Says it Fended off North Korean Hack Attempt Against Defense Industry” - Is. 41:11
-
The Defense Ministry on Wednesday said hackers from a group linked to the North Korean government targeted Israeli defense officials
-
https://t.co/NOKLGbSBst via @HarbingersDaily","915319772002189312"
"Thu Aug 20 02:17:47 +0000 2020","https://twitter.com/unicorndreams99/status/1296270172618133505","The North Korean Government: Ban North Korea from taking away all the pet dogs for meat!! - ¡Firma la petición! https://t.co/cDZSMT4cDF via @Change","28624319"
"Wed Aug 19 20:41:38 +0000 2020","https://twitter.com/sylvie_darmon/status/1296185580297031681","The North Korean Government: Ban North Korea from taking away all the pet dogs for meat!! - Signez la pétition ! https://t.co/xnJLLEzhPh via @ChangeFrance","976441328115601408"
"Fri Aug 28 03:56:36 +0000 2020","https://twitter.com/NeoRealityEnt/status/1299194144099840006","One. Dave Meltzer was the one who compared WWE to the North Korean Government. Not the fans.

Two. Kahn pointed out, The NETWORK made the order for certain profanities not to be said but other than that, AEW NEVER said cheer or boo who THEY wanted, letting fans have that choice. https://t.co/a9nQMBjxSr","2666502843"
"Fri Aug 21 16:21:39 +0000 2020","https://twitter.com/RIVIER59102488/status/1296844926848729092","The North Korean Government: Ban North Korea from taking away all the pet dogs for meat!! - Signez la pétition ! https://t.co/Qxq1w2Wygy via @ChangeFrance","1099692297187459073"
"Thu Aug 20 10:14:16 +0000 2020","https://twitter.com/nasrene41/status/1296390083302625280","The North Korean Government: Ban North Korea from taking away all the pet dogs for meat!! - Sign the Petition! https://t.co/mXaHWGgA3U via @Change","2391589446"
"Wed Aug 19 23:04:31 +0000 2020","https://twitter.com/chengneeesther/status/1296221536437669888","The North Korean Government: Ban North Korea from taking away all the pet dogs for meat!! - Sign the Petition! https://t.co/Dqqe2LWCje via @Change","1073135417443012608"
"Wed Aug 19 08:08:24 +0000 2020","https://twitter.com/PETAUK/status/1295996021944848386","""Dogs are family members, not pieces of meat. The North Korean government could easily address food shortages by facilitating a move away from eating all animal flesh, not adding more to the list.""
https://t.co/wNtqewvInX","357584312"
"Fri Aug 21 07:43:49 +0000 2020","https://twitter.com/cryptorney/status/1296714609945182208","@djclicktrak29 @mmpadellan @realDonaldTrump he gave the North Korean government legitimacy without getting anything in exchange. Worst negotiator ever.  He destroyed our famer's business by going into a trade deal negotiation without a plan B (by the way, still no promised deal with China).  etc etc","943885149275590656"
"Wed Aug 19 22:56:30 +0000 2020","https://twitter.com/annamoor1995/status/1296219520395141120","The #North #Korean Government: Ban North Korea from taking away all the pet dogs for meat!! - Sign the Petition! https://t.co/IKXfS4bv2V via @ChangeAUS","2991516460"
"Thu Aug 27 06:47:49 +0000 2020","https://twitter.com/Bank_Security/status/1298874843253932032","Following the Indicators of compromise used by the North Korean government in the ATM cash-out scheme:
https://t.co/bxYWcxwp95
#ATM #Malware https://t.co/l0JYbf7lGd","1886777581"
"Wed Aug 26 19:48:43 +0000 2020","https://twitter.com/WSJ/status/1298708977866293249","Hackers tied to the North Korean government are trying to rob banks across the globe by draining ATMs and initiating fraudulent transfers to fund its nuclear weapons program, U.S. federal agencies said https://t.co/dRDEiNmpvi","3108351"
"Wed Aug 19 22:32:56 +0000 2020","https://twitter.com/Cshells33Wells/status/1296213588802072576","The North Korean Government: Ban North Korea from taking away all the pet dogs for meat!! - Sign the Petition! https://t.co/iJtPIrOFao via @ChangeAUS","2534585173"
"Wed Aug 26 20:37:09 +0000 2020","https://twitter.com/rr_edmonds/status/1298721165578362883","FASTCash 2.0: North Korea's BeagleBoyz Robbing Banks | CISA

Identified malware and indicators of compromise (IOCs) used by the North Korean government in an automated teller machine (ATM) cash-out scheme—referred to by the U.S. Government as “FASTCash 2.0 https://t.co/EPFsGftCCZ","18725633"
"Wed Aug 19 22:54:18 +0000 2020","https://twitter.com/shishnfips/status/1296218963169480705","The North Korean Government: Ban #NorthKorea from taking away all the pet dogs for meat!! - Sign the Petition! https://t.co/oyDFRwoeOn via @UKChange","216849450"
"Wed Aug 12 14:23:45 +0000 2020","https://twitter.com/polyolbion/status/1293553764687917061","It's like one of those adverts the North Korean government used to put in the Times in the 1980s.","106376450"
"Fri Aug 28 09:02:11 +0000 2020","https://twitter.com/ISMG_APACME/status/1299271045271097345","The @CISAgov and other US agencies warn about the increase in bank heists worldwide, spearheaded by the North Korean government backed ‘BeagleBoyz’. @prajeetspeaks writes: https://t.co/1YPIHDnaNp #Cybercrime #Fraud #NationState #Threat #Risks #ISMGNews https://t.co/llIaJ01cWF","3329017771"
"Wed Aug 19 14:55:04 +0000 2020","https://twitter.com/siamesecatchan/status/1296098362786226179","The North Korean Government: Ban North Korea from taking away all the pet dogs for meat!! - Sign the Petition! https://t.co/la7poYY1Av via @UKChange","1357855087"
"Wed Aug 19 17:19:57 +0000 2020","https://twitter.com/brunamar14/status/1296134821304045570","The North Korean Government: Ban North Korea from taking away all the pet dogs for meat!! - Firma la petizione! https://t.co/ITXjv0fhQV via @ChangeItalia","1062792614272008193"
"Thu Aug 20 00:40:05 +0000 2020","https://twitter.com/Peanutnoir04/status/1296245585562017793","The North Korean Government: Ban North Korea from taking away all the pet dogs for meat!! - Sign the Petition! https://t.co/Wai8CK5S02 via @Change","3292956333"
"Wed Aug 05 14:27:57 +0000 2020","https://twitter.com/epitomestv/status/1291018107037917184","since boomer politicians apparently think kpop stans are dangerous operatives of the north korean government who would win: us army or bts army","2869104639"
"Wed Aug 19 16:15:08 +0000 2020","https://twitter.com/SURINOMO/status/1296118513074089989","FIRMATEEEE X FAVORE The North Korean Government: Ban North Korea from taking away all the pet dogs for meat!! - Firma la petizione! https://t.co/0nSc4NkbSw via @ChangeItalia","106183442"
"Thu Aug 27 03:25:24 +0000 2020","https://twitter.com/InfoSecResource/status/1298823903893127168","https://t.co/NSnWbBl9ke F-Secure: North Korean Group Targeted Employee at Cryptocurrency ExchangeThe Lazarus Group, which has ties to the North Korean government, recently targeted an employee of a cryptocurrency exchange with a fake job offer in ord ... https://t.co/mdZ5xrXul9 https://t.co/XMTInHWlK3","896789085758513152"
"Wed Aug 26 19:11:02 +0000 2020","https://twitter.com/CISACyber/status/1298699493211283458","🚨 @CISAgov, @USTreasury, @FBI, &amp; @US_CYBERCOM have identified malware variants #ECCENTRICBANDWAGON, #VIVACIOUSGIFT, and #FASTcash used by the North Korean government’s #BeagleBoyz for ATM cash outs. 💸 Read more at https://t.co/WtX6meIzf8. #HIDDENCOBRA #Cybersecurity #Malware https://t.co/eK0km8xOvs","18066440"
"Sat Aug 22 17:51:53 +0000 2020","https://twitter.com/ProleBrain/status/1297230021413625856","@isky_UniG33k @BulletpBullet @KevinOC075 @HotTankie Mind telling us what happens when you dissent against the North Korean government?","738308393916465154"
"Thu Aug 20 05:00:34 +0000 2020","https://twitter.com/jrimer2008/status/1296311137672159232","Cyber scoop FBI, DHS expose North Korean government malware used in fake job posting campaign: The FBI and DHS’ cybersecurity agency exposed malware Wednesday that North Korean government hackers have been using this year to target defense… https://t.co/GhCoUn3H8M Check it out! https://t.co/9TZWV54B57","14071719"
"Wed Aug 12 01:18:06 +0000 2020","https://twitter.com/FemmeScarlet/status/1293356049844645896","@SpinningBy @WolvesforKamala @BeninBiloxi @Alysson @ThunderHeadFan @Heather3E8i8 @sktea @GGforthepeople @PeachyInNJ @dire_wolves @michellem @TiredInOR4Now @SethPalooka @saradani @Flora_Lola_NYC @rorivas8 @binksnboo @Grania64156311 @RhinoReally @Rogue4Brat @PrezHillary17 @EvilChefBruce @Kristina_Why @LeifNanna @citizengatsby @Like_H2O @kstraith @FF_fanster @Kacey325 @Ndreajess @ladyasrai @return_carriage @RogueRegulated @1509lucky @caveatofcass @OhChelleYeah @luckydevilgaia @KreepyKimSofia @faecaim @kilonova_gold @trappist_e @Needle_of_Arya @Sinixstar @wickedirishmn @GeneralMcMaul @Lappos @dgstillme @preising @kitsgirl2 @KHiveQueenB Sorry, I should have mentioned that. It’s a parody of a North Korean government account.","856328452143808515"
"Tue Aug 25 20:13:02 +0000 2020","https://twitter.com/john_branyan/status/1298352707179360256","The North Korean government has issued a statement saying, Kim Jong-Un's comatose condition will not prevent him from voting for Joe Biden in November. https://t.co/K0NsTKoIZk","57649687"
"Fri Aug 21 23:22:23 +0000 2020","https://twitter.com/liam_2912/status/1296950809935085568","@colbrooky74 If you're talking about the North Korean government, I'd probably trust them a bit more than ours","26562109"
"Fri Aug 14 01:43:11 +0000 2020","https://twitter.com/ATLBlueJay/status/1294087139408465921","@spectatorindex North Korean Government: Alright. The city is safe now. Move on 

Citizen: So what happen to that sick person?

North Korean Government: Don't think about it.","735236835924934666"
"Mon Aug 17 20:43:06 +0000 2020","https://twitter.com/Pizzaboy609/status/1295461170393026560","@LeraYtz @SkyNews Ah yes. The biggest problem of the North Korean government is the socialist aspect. 

Imagine seeing a story like this and the first thought you have is ""how can i own the left with this?"" - you're sad.","984093490941517829"
"Mon Aug 24 00:06:41 +0000 2020","https://twitter.com/TMagicRaT/status/1297686732046061569","@hugocaesar @nypost Based all the atrocities and human rights violations that her and her family in the North Korean government have committed over the years, I'm pretty sure I can.","16466256"
"Fri Aug 21 05:15:06 +0000 2020","https://twitter.com/The_Daily_NK/status/1296677186334789632","Managers of North Korean laborers at a factory in China are taking some of the money set aside for meals and sending it to the North Korean government’s “loyalty fund."" https://t.co/lHuXPXxsZY https://t.co/46yrCW3rMz","1342068500"
"Tue Aug 25 01:53:41 +0000 2020","https://twitter.com/CFCBarmyArmy/status/1298076047062302720","@FrenchFrog_12 @MagyarSzabadsg1 @HotTankie Did you even read the article?? It says that 78% of people trust Kim in relation to the meeting with Moon, not that they approve of the North Korean Government.  Do you actually think 68% of a population will change their mind over a meeting between world leaders.","1117111662258081797"
"Wed Aug 19 21:37:34 +0000 2020","https://twitter.com/shanvav/status/1296199653399068673","New today: The FBI &amp; DHS’ cybersecurity agency CISA exposed malware North Korean government hackers have been using this year to target defense contractors in the military and energy sectors, with fake job postings as lures. The latest on @CyberScoopNews https://t.co/IVWrAWzHSP","1031612276"
"Wed Aug 19 07:58:01 +0000 2020","https://twitter.com/virusbtn/status/1295993409040154626","US Army report says that at least 6,000 hackers are working for the North Korean government, with many of these operating from other countries https://t.co/5Zz0fUjTWG https://t.co/6pmGqrb4W6","118059149"
"Fri Aug 28 12:53:19 +0000 2020","https://twitter.com/asokan_akshaya/status/1299329215331028995","CISA and other U.S. agencies have issued a warning about increases in bank heists worldwide spearheaded by a hacking group called ""BeagleBoyz,"" which has ties to the North Korean government @prajeetspeaks 

https://t.co/wUnVghWW3A","1149014704859144192"
"Sun Aug 02 02:47:00 +0000 2020","https://twitter.com/ramyeonguksu/status/1289754545472466944","Apparently I'm a communist according to those idiots LMAO

Oh yeah me, a South Korean, who wants the unification of North and South Korea and is against the communist North Korean government, is a communist

The mental gymnastics","951821921339039744"
"Sun Aug 09 06:53:14 +0000 2020","https://twitter.com/artetriste/status/1292353224314322944","All these scary stories about the North Korean government are literally becoming our reality here in the land of the “free”","726500609793257472"
"Sat Aug 01 04:09:11 +0000 2020","https://twitter.com/KenRoth/status/1289412840634355712","Because the North Korean government is upset about leaflets floated across the border, the South Korean government is subjecting to special review and intimidation groups that focus on human rights in North Korea. https://t.co/HTzIAUgDfx https://t.co/fiRAVPKcVh","17839398"
"Wed Aug 26 20:16:16 +0000 2020","https://twitter.com/akintonmide/status/1298715908349681675","What is this?!! || Hackers tied to the North Korean government are trying to rob banks across the globe by draining ATMs and initiating fraudulent money transfers  to fund its nuclear weapons program

https://t.co/5Ito9Cc0Cx","227893756"
"Wed Aug 12 19:36:13 +0000 2020","https://twitter.com/grossm130/status/1293632400002621450","@douglasfunniest @Noahpinion Please re-evaluate where your life went wrong that you’re actually defending the North Korean government.","813865612359438337"
"Thu Aug 27 02:59:03 +0000 2020","https://twitter.com/wretchardthecat/status/1298817273218523141","""Hackers tied to the North Korean government are trying to rob banks across the globe by draining ATMs and initiating fraudulent money transfers, in an effort by the cash-strapped Pyongyang regime to fund its nuclear weapons program""

https://t.co/gFiNzE0fAJ","7595102"
"Wed Aug 26 21:28:18 +0000 2020","https://twitter.com/blmohr/status/1298734035879985156","oh.
""Hackers tied to the North Korean government are trying to rob banks across the globe by draining ATMs and initiating fraudulent money transfers, in an effort by the cash-strapped Pyongyang regime to fund its nuclear weapons program...""
https://t.co/5lFlzscTEb","17291709"
"Sat Aug 01 11:20:50 +0000 2020","https://twitter.com/PaleoPhil/status/1289521467055460352","@nntaleb I wonder how Wesleyan manages to ""ensure"" that the student has ""a feeling of purpose and wellbeing"". Sounds like propaganda from the North Korean government. ""All our citizens are happy.""","86197418"
"Mon Aug 24 00:25:12 +0000 2020","https://twitter.com/AndrewLazarus4/status/1297691392467034112","I am sure Susan Collins was disappointed.

Most of the speakers are Trump family and hangers-on. They are trying to bring the structure of the North Korean government to the USA.","797942807222697988"
"Wed Aug 19 12:56:31 +0000 2020","https://twitter.com/XSovietNews/status/1296068529117167616","Russia's embassy in Pyongyang helps the North Korean government by denying reports that dogs have been confiscated from their owners en masse.","3061311382"
"Fri Aug 28 19:45:11 +0000 2020","https://twitter.com/writerofscratch/status/1299432862052163584","Kyodo on worldwide response to Abe's resignation:

""There was no immediate reaction from the North Korean government via the country's state media.""

What was the expected response?  
https://t.co/L57g4i8vbb","945276571"
"Fri Aug 28 21:28:29 +0000 2020","https://twitter.com/Jj_Theobald/status/1299458857371144195","@Throne_YT This is the equivalent of donating to the North Korean government.","336721926"
"Wed Aug 26 19:47:36 +0000 2020","https://twitter.com/dnvolz/status/1298708697531654145","Hackers tied to the North Korean government are trying to rob banks across the globe by draining ATMs and initiating fraudulent money transfers, in an effort by the cash-strapped regime to fund its nuclear weapons program, multiple agencies warned. https://t.co/B651lt0rrn","23664429"
"Thu Aug 27 13:45:04 +0000 2020","https://twitter.com/WisconsinProj/status/1298979847117602816","Hackers tied to the North Korean government are trying to rob banks across the globe by draining ATMs and initiating fraudulent money transfers, multiple federal government agencies warned Wednesday.
https://t.co/T34g9Ll0KD","1247823998"
"Thu Aug 27 09:44:15 +0000 2020","https://twitter.com/softwarnet/status/1298919245523193856","#infosec 
https://t.co/VqUf1OWefy
CISA, FBI, Treasury Department &amp; CYBERCOM warn of North Korean malware

ongoing automated teller machine (ATM) cash-out scheme by North Korean government cyber actors","4148621113"
"Tue Aug 04 19:24:32 +0000 2020","https://twitter.com/jerseygirlangie/status/1290730357663371266","@Captain54672005 @LoyalArgus @PolitiBunny @washingtonpost The North Korean government has an even higher approval rating from it's people .

The one's hoping not to be shot or incarcerated , at least .","16722642"
"Fri Aug 21 23:06:16 +0000 2020","https://twitter.com/BillingtonCyber/status/1296946751258136581","New today: The FBI &amp; DHS' #cybersecurity agency #CISA exposed #malware North Korean government hackers have been using this year to target defense contractors in the military and energy sectors, The latest on @CyberScoopNews https://t.co/ZEZm3DGvXk https://t.co/7zG7K3LlfV","1130167399"
"Thu Aug 27 22:34:29 +0000 2020","https://twitter.com/ACAMS_ml_com/status/1299113082069942272","North Korean government-sponsored hackers are still draining millions of dollars from banks and ATMs across the world in a cybertheft campaign that benefits the country’s leadership, a U.S. interagency group has found.

Find out more subscription-free: https://t.co/MdhRS1dbZj","546217576"
"Wed Aug 26 21:15:28 +0000 2020","https://twitter.com/Gurgling_MrD/status/1298730807272583175","F-Secure: North Korean Group Targeted Employee at Cryptocurrency ExchangeThe Lazarus Group, which has ties to the North Korean government, recently targeted an employee of a cryptocurrency... via @BnkInfoSecurity #infosec #tech #WednesdayWisdom https://t.co/UCLpesBdsN","993154328"
"Mon Aug 17 18:54:06 +0000 2020","https://twitter.com/NYDailyNews/status/1295433739967791109","The North Korean government is reportedly ordering more “decadent” citizens to hand over their dogs so that other people can eat.
https://t.co/AZa2Gc01cG","9763482"
