"created_at","url","full_text","user_id_str"
"Sun Sep 29 08:49:58 +0000 2019","https://twitter.com/Daniel_Soff/status/1178230426386812929","This guy really likes to punish North Koreans #TouchlineFracas https://t.co/y6iAoxtt7G","29988817"
"Thu Sep 26 12:47:46 +0000 2019","https://twitter.com/miles_commodore/status/1177203107702460417","Every Vegan I have ever met looks like they just got released after two years from a North Korean prison.","824472044913983488"
"Fri Sep 27 20:45:38 +0000 2019","https://twitter.com/imOMNOM/status/1177685754979291136","brothers and sisters, soon we will gather to celebrate the 1-year anniversary of 'The Great SpaceX North Korean Alien Missile Launch Invasion of Dirtybird Campout 2018' and the 2nd most terrified i have ever been on prescription sedatives 

never forget. we still believe. 🛸🏕 https://t.co/zN1WE9OTof","2822840527"
"Sat Sep 28 23:34:08 +0000 2019","https://twitter.com/MsAvaArmstrong/status/1178090545819914240","Trump’s America:
Lowest black unemployment in history.
Lowest female unemployment since 1953.
Possible North Korean denuclearization .
The return of manufacturing jobs.
Tax cuts for 83% of Americans.
Why would anyone resist? https://t.co/ykqbfY9J8x","2449913803"
"Fri Sep 27 16:35:46 +0000 2019","https://twitter.com/llLadyLikell/status/1177622873906782209","Female protesters in Hong Kong have been sexually assaulted by police officers.

North Korean women have been forced into sex trafficking there, and they receive no help.

Uyghur women have been imprisoned in “re-education programs” and forcibly sterilized.

Shut up tankie scum.","4105205369"
"Mon Sep 30 17:12:55 +0000 2019","https://twitter.com/jjsmokkieBOY57/status/1178719385399242753","ARE NORTH KOREAN DIPLOMATS STILL SMUGGLING RHINO HORN FROM SOUTH AFRICA? https://t.co/mQJHdMD3lw via @Change","989218016255709186"
"Fri Sep 27 14:56:00 +0000 2019","https://twitter.com/BBCLBicker/status/1177597766605754368","When a Scottish mammy learns to cook North Korean food with Jessie Kim... https://t.co/yPJ0bTyO1Q","240756474"
"Mon Sep 30 13:23:25 +0000 2019","https://twitter.com/zerohedge/status/1178661628096724992","BOLTON SAYS NORTH KOREAN TESTING FREEZE IS NOT AN ENCOURAGING SIGN BUT SOMETHING TO BE WORRIED ABOUT

So whatever NKorea does, one should be nervous","18856867"
"Sat Sep 28 23:36:34 +0000 2019","https://twitter.com/RosaChaTV/status/1178091156535562240","Catch the first North Korean Kpop star at TC!!! ✌️ https://t.co/DORFO4nKME","2864213706"
"Sun Sep 29 10:00:34 +0000 2019","https://twitter.com/RLitwiller/status/1178248194058272768","#OTD 29/9/1952 #RememberRCN -Cdr Landymore, RCN as SO Task Unit 95.22 orders 4 USN destroyers to bombard a North Korean gun emplaced in a cave on a  cliff, without success. He then moves HMCS IROQUOIS close inshore &amp; with a single broadside, destroys the deeply embedded gun. https://t.co/fCs6Hnk5MY","1264772724"
"Mon Sep 30 13:38:34 +0000 2019","https://twitter.com/Korean_DMZ_Vets/status/1178665443537686529","1980s - Up on the Z - Typical North Korean propaganda, you can see Reagan being portrayed in this one.  Very common for the North to dump these in the South. We have several more pieces on our website:  https://t.co/DMgzG8IHVe
#upontheZ #koreandmzvets #dmzvets #dmz #propaganda https://t.co/WAqKGtxqf2","938885502610141186"
"Sat Sep 28 09:09:05 +0000 2019","https://twitter.com/ConflictsW/status/1177872849245261825","Nicolas Maduro has announced the signing of ""important agreements"" between Venezuela and North Korea during Diosdado Cabellos trip to North Korea where he met with Choe Ryong Hae who is a senior North Korean official 
#Venezuela #NorthKorea https://t.co/mSScsx1fG3","941287588056518656"
"Sat Sep 28 03:49:03 +0000 2019","https://twitter.com/DrTaraO/status/1177792308407865344","#SouthKorean people are aghast at Seoul, Busan city govts celebrating the PR #China's founding day. 3 million Chinese entered the Korean War, supporting the aggressor, North Korea. In essence, then, China fought against the founding of #SouthKorea.
https://t.co/1jkoKbyQVK","761359637031583744"
"Sun Sep 29 10:35:29 +0000 2019","https://twitter.com/FutbollHeritage/status/1178256981112623105","If you can't see this guy is a puppet you're more brainwashed than yer North Korean son.","1087809255510626305"
"Sun Sep 29 23:32:49 +0000 2019","https://twitter.com/Yeonseok411_IFC/status/1178452603304206336","Webtoon 'The Summit: Steel Rain 3' which #YooYeonSeok's new movie 'Summit : Steel Rain' is based on, is released~ YYS will be playing the role of The Chairman of the State Affairs Commission of the Democratic People's Republic of Korea a.k.a. North Korean supreme leader https://t.co/VFCfITlEMg","2269092512"
"Fri Sep 27 08:30:22 +0000 2019","https://twitter.com/reach2ratan/status/1177500717323472898","New North Korean Malware Targeting ATMs Spotted In India https://t.co/4qmPRx2xbu

#CyberSecurity #Databreach #Ransomware #Hackers  #infosec @reach2ratan #AI #bots #malware #DDoS #CyberResilience #Fintech #Blockchain #Chatbots #Bigdata #datascience #digital https://t.co/DnhdeQoLlN","262641807"
"Fri Sep 27 07:45:53 +0000 2019","https://twitter.com/KSAfricaHack/status/1177489524328239106","More North Korean Diplomats Caught Smuggling Animal Parts From Africa https://t.co/Q2d9rjLLiN https://t.co/F3F2BzngTO","83359373"
"Mon Sep 30 03:16:26 +0000 2019","https://twitter.com/adamjohnsonCHI/status/1178508875374436352","For years twitter has had a specific carve out for both state actors and calls for violence by states by non state actors which is why the WaPo/NYT can publish op-eds calling for mass killing of Iranians or North Koreans via bombing and it’s not a violation of their TOS","756331316"
"Sat Sep 28 07:47:42 +0000 2019","https://twitter.com/BazHughes111/status/1177852366659424257","Have to point out that these tags are #MicrowaveTelemetry 2g satellite tags @WWTworldwide. They have already led us to only the second known moulting site in - North Korean DMZ and to unknown wintering sites with illegal mistnets that Chinese police have removed #SaveSpoonie","2831840230"
"Mon Sep 30 13:51:48 +0000 2019","https://twitter.com/jeongminnkim/status/1178668773085073408","Bolton: ""I don't think North Koreans will ever give up voluntarily enough... I don't want fake inspections... we need real verifications of any agreement given untrustworthiness of the North Korean regime since its inception."" @CSISKoreaChair https://t.co/Iax8Vb1xwd","904841004305575936"
"Fri Sep 27 19:09:36 +0000 2019","https://twitter.com/Merchandise7X/status/1177661584501592065","A community service announcement from “The World’s Greatest North Korean Cocktail Bar” @hopsinglaundry so no hate mail and have a great weekend, b*tches pleaseee!!! https://t.co/IDi4iI0rEL","382728060"
"Mon Sep 30 21:39:37 +0000 2019","https://twitter.com/LindseyMiller87/status/1178786503813713920","North Korean rural areas on the train to #China during #winter #NorthKorea #Pyongyang #DPRK #Korea #Korean #Asia #snow #dprk #northkorea #korea #people #travelphoto https://t.co/5lH2bPOmcp","1043801553939968000"
"Thu Sep 26 04:09:16 +0000 2019","https://twitter.com/cjwerleman/status/1177072621852086272","Yeah, I'm sure the 12 million Syrians who've been displaced and the 1 million who've been killed by the regime are totes ""satisfied"" with Assad.

Funny, every North Korean I met in North Korea is also totes satisfied with Kim Jong. So happy, at least when they think he's looking.","33519870"
"Sat Sep 28 10:21:15 +0000 2019","https://twitter.com/enr56/status/1177891009381965824","The Irish Establishment did the same with Irish Water protesters,   called them Nazis, ISIS  North Korean Stalinist Sinister Fringe. Gardai got tooled up for peaceful protests with dogs &amp; horses ,  threw a young woman against a pillar for standing in front of Enda's car. #marian","2190541011"
"Mon Sep 30 22:26:10 +0000 2019","https://twitter.com/ifsmagazine/status/1178798217347121152","Ugh! Sorry to see that the North Korean pairs team has been replaced at Internationaux de France. Boo!!! #JGPFigure https://t.co/VLxgussPVX","258815133"
"Mon Sep 30 11:45:31 +0000 2019","https://twitter.com/mashant/status/1178636989752643584","A scientist told me he counted 3,100 North Korean boats fishing simultaneously in Russian waters last September during squid season. Then he found winter images of these boats frozen in ice at North Korean ports ""like seeds on a sunflower"" https://t.co/Jyt9zhhKIb","15472044"
"Mon Sep 30 16:05:00 +0000 2019","https://twitter.com/Paralelni_polis/status/1178702292717113347","Park Jung Oh, a highly respected member of the North Korean defector community(Soul), is another speaker at #hcpp19!⚡
He is the ONLY #defector who sends in/outside banned information to the North Korean people directly.

More about this year's #hcpp19 -&gt; https://t.co/W2TXKSx1t6. https://t.co/9SHlJaNKtQ","2784252152"
"Fri Sep 27 03:24:57 +0000 2019","https://twitter.com/francessmith/status/1177423857692684288","@timfarron What are you after a sort of North Korean relationship with the people you govern? If you want a good relationship with the voters you've got to do a little work to get it. Like respecting referendum results.","20246748"
"Fri Sep 27 18:46:55 +0000 2019","https://twitter.com/Reuters/status/1177655877253373958","Russia seizes North Korean vessels in poaching clampdown https://t.co/sD0PlYFOhC https://t.co/q1dnfQpqSb","1652541"
"Mon Sep 30 13:22:35 +0000 2019","https://twitter.com/vmsalama/status/1178661418754887680","John Bolton,in a speech in Washington, jokes that the North Koreans are happy that he's standing here today (and not in the administration), and adds that he can now address the issue of North Korea in ""unvarnished terms."" Insists that Kim Jong Un will never agree to denuclearize","276445663"
"Fri Sep 27 09:25:46 +0000 2019","https://twitter.com/dagyumji/status/1177514659097632773","Russia detains 262 North Korean sailors for illegal fishing in its waters https://t.co/AqafHYWZq9","3169370088"
"Sat Sep 28 10:51:24 +0000 2019","https://twitter.com/anteater_32/status/1177898597708439554","@motomatters @ZaraDaniella Happy Birthday!  This is Minnie, she doesn’t really do cute but she does a great North Korean Dictator impression 😀 https://t.co/whH7heZJXM","439093765"
"Thu Sep 26 22:28:51 +0000 2019","https://twitter.com/NYCommenter/status/1177349342279229440","@stevesilberman Ah the North Korean route.","885287866628177920"
"Sat Sep 28 14:00:03 +0000 2019","https://twitter.com/AmerMilNews/status/1177946071751938050","Russia detains large group of North Korean fishermen, alleges massive poaching 
https://t.co/SvU1k5bGEP https://t.co/v79bKTbN8a","978561402"
"Fri Sep 27 15:16:16 +0000 2019","https://twitter.com/Reuters/status/1177602866342764545","Russia seizes North Korean vessels in poaching clampdown https://t.co/ACqXrcGEUM https://t.co/4TcgLgaSIt","1652541"
"Mon Sep 30 20:21:33 +0000 2019","https://twitter.com/mashant/status/1178766855760203778","This is last night's image analyzed by oceanographer Vyacheslav Dubina. All the tiny dots are the wooden North Korean vessels. Half of them are in Russian and Japanese zones. (the big light blobs are large squid ships used by Japan and South Korea) https://t.co/FnaB8U7EWn","15472044"
"Mon Sep 30 02:09:16 +0000 2019","https://twitter.com/Yeonseok411_IFC/status/1178491975311351808","Webtoon 'The Summit : Steel Rain 3' poster. #YooYeonSeok will be playing the role of North Korean supreme leader in the movie version. https://t.co/9vI8CvgiqS","2269092512"
"Mon Sep 30 11:29:27 +0000 2019","https://twitter.com/Tim_Easton/status/1178632946959433729","I don’t care how convenient they are I will never walk around with those little white dipsticks coming out of my ears like an Android dreaming of electric sheep.  PS Greetings from Vladivostok, Russia , just 85 miles from the North Korean border.","43291270"
"Sat Sep 28 22:52:50 +0000 2019","https://twitter.com/Totalrecoverys1/status/1178080153810784256","Russia Detains Large Group Of North Korean Fishermen, Alleges Massive Poaching https://t.co/LutZOYDRl7 #SmartNews","3070651257"
"Mon Sep 30 12:23:19 +0000 2019","https://twitter.com/ludraman_/status/1178646502677401602","Northern Irish-North Korean empire","1194476892"
"Sun Sep 29 11:35:29 +0000 2019","https://twitter.com/ItCorbyn/status/1178272079973699584","@BorisJohnson @MattHancock In 4 pictures the same 2 female nurses appear 3 times, Johnson's PR people are evidently having trouble finding suckers to be pictured with him, this is North Korean style propaganda, and about as transparent. 😃","1006589734548799489"
"Mon Sep 30 07:08:39 +0000 2019","https://twitter.com/dagyumji/status/1178567317447249931","North Korean party daily slams South Korean drills, U.S. plans to expand UNC https://t.co/IjvcGzX8nS","3169370088"
"Mon Sep 30 00:18:02 +0000 2019","https://twitter.com/dbrown13/status/1178463979389276161","@realDonaldTrump Sounds like the North Korean rhetoric lol. https://t.co/eY4cx5qugQ","7453982"
"Sat Sep 28 22:57:37 +0000 2019","https://twitter.com/Megawatts55/status/1178081354631667712","Russia Detains Large Group Of North Korean Fishermen, Alleges Massive Poaching https://t.co/K1DwE6Sbrf #SmartNews","2633179534"
"Thu Sep 26 12:29:31 +0000 2019","https://twitter.com/TransNewsDaily/status/1177198511407947776","North Korean YouTuber says he didn’t know trans people existed till he fled the country https://t.co/i9nRMCS68M #trans #transgender","105541906"
"Fri Sep 27 20:21:45 +0000 2019","https://twitter.com/Paulbre24988621/status/1177679740964151301","@KeithCameron5 @irisstylosa After spaffer Johnson's last hospital debacle this will have been planned and stage managed with military precision.Why do you think the idiotic nurses were smiling and clapping like North Korean cheerleaders.They are a disgrace to the NHS.","1011714536158777345"
"Fri Sep 27 13:17:08 +0000 2019","https://twitter.com/attomeybharti/status/1177572883708563456","@AmitShah @JPNadda “resounding welcome on his return to motherland” sounds straight out of some Soviet or North Korean propaganda newspaper. 🤦🏻‍♂️","2333630101"
"Mon Sep 30 12:13:10 +0000 2019","https://twitter.com/onEscapee/status/1178643948534939648","@anttsan @7_ans_de_MMA Most North Korean would tell you it's the best.","2714517152"
"Fri Sep 27 10:18:03 +0000 2019","https://twitter.com/FirstSquawk/status/1177527815735898113","RUSSIAN FORMIN SAYS MOSCOW HAS DRAFTED A NEW PLAN TO SETTLE NORTH KOREAN NUCLEAR CRISIS - RIA","3295423333"
"Sun Sep 29 17:46:58 +0000 2019","https://twitter.com/BuckTurgidson79/status/1178365564055621635","2 North Korean diplomats in Beijing possibly on way to New York https://t.co/IfPOPbhcWF","1055808434"
"Mon Sep 30 13:34:20 +0000 2019","https://twitter.com/cjf39/status/1178664376187965440","John Bolton slams Trump’s dismissal of North Korean short range ballistic missile tests: “When you ask for consistent behavior from others, you have to demonstrate it yourself, and when we fail to do that we open ourselves and our policy to fail.”","606626730"
"Sun Sep 29 17:42:03 +0000 2019","https://twitter.com/TurntableKittah/status/1178364329726529536","@JayVanorman @politicalwilli @Perryalt1 @semperKAG @hollylandes @caldwell_laina @zattack2016 @BS2KZ @RoxieCorleone @KellySunshineT1 @BluesBrother91 @TexasKelGirl @Cara_TXZEAL @NHMommy1 @HankMullaney @RMachArts @travlnjak @SpicyNoodles2 @PrimalScream6 @birockin @coco_bean88 @markjohnt2 @time1_tea @patryn94 @Solmemes1 @mizdonna @RickCrainium @MissyHa64858589 @salty_dawg69 @PlimouthOutWest @DrPainsInfo @olystubbies44 @ScottTBrower1 @JKHomestead @wisenanashouse @weebutmightiest @ModBond1 @wmahoney5 @BenKTallmadge @blc3428 @ivycedarlane @sportsmom9433 @AllanKirkhart @starlady24 @UrUnpaidPundit @VVnospam @ljcljf @BeardsleeSherri @Stephan59491778 @jellen805 Need to point out these are the actual Ukrainian talking points. The struggles of the Ukraine to get IMF issues solved. The issue of the Crimea. Power struggles between Russia, China, the US. North Korean missles. It's a funny presentation of serious Ukrainian issues.","35860455"
"Mon Sep 30 15:58:07 +0000 2019","https://twitter.com/TimothyS/status/1178700559253217280","Unbridled arrogance: it's their country, Obama guy. Daniel Russel (Asia Society, former assistant secretary of state for East Asia) warns Voice of America ""of the dangers of the South Korean government viewing the North through 'rose-colored glasses.'"" https://t.co/bl2HnVhBzs","15818978"
"Fri Sep 27 18:00:01 +0000 2019","https://twitter.com/telesurenglish/status/1177644072896479232","#Russia's naval forces detained three North Korean vessels and more than 200 of their crewmen for poaching. #NorthKorea
https://t.co/XB48Dnhho4","296005306"
"Sun Sep 29 03:12:44 +0000 2019","https://twitter.com/benjaminaengel/status/1178145556402565120","North Korean beer is oddly decent and quite drinkable. If sanctions were ever dropped and it was exported to the South I’m guessing it would do quite well; at first for the novelty and then later on because it’s better than mass produced beers in SK.","123958852"
"Thu Sep 26 21:34:25 +0000 2019","https://twitter.com/joshjonsmith/status/1177335642474205185","KCNA this morning: North Korean foreign ministry official says US has done nothing to implement deals and prospects of new summits is doubtful, but “Trump is different from his predecessors” and he “would like to place my hope on President Trump's wise option and bold decision.”","104608458"
"Fri Sep 27 11:28:40 +0000 2019","https://twitter.com/alistaircoleman/status/1177545588667310080","Who says they never have comedy on North Korean TV? #BuriedIt https://t.co/RmPXzos3GJ","57233"
"Fri Sep 27 12:16:10 +0000 2019","https://twitter.com/AJENews/status/1177557540969877508","Russia detains more than 260 North Korean fishermen https://t.co/blgGxvtJ4f https://t.co/5aPeDmBc9q","18424289"
"Mon Sep 30 12:39:13 +0000 2019","https://twitter.com/Rout_PoliticsIR/status/1178650507843444737","Just Published! “In a lucid and readable style, Dr. Pacheco Pardo frames North Korean behavior in an original theoretical context of small power bargaining and learning theory."" – Victor Cha, Georgetown University, USA.
https://t.co/Wl3TEH7lHZ  @rpachecopardo https://t.co/4a57pxjQkf","250053977"
"Fri Sep 27 09:16:01 +0000 2019","https://twitter.com/AP/status/1177512206239330305","South Korea's military says it fired warning shots toward a North Korean boat crossing their sea border, then it sent a navy mechanic to repair the drifting boat's engine so it could go home, @kimtonghyung reports. https://t.co/PaNtTM35aa","51241574"
"Fri Sep 27 10:11:35 +0000 2019","https://twitter.com/VOANews/status/1177526187687469056","Russia Detains Hundreds of North Korean Fishermen https://t.co/flALU36ipc https://t.co/wskbSRuX2r","16273831"
"Mon Sep 30 15:31:59 +0000 2019","https://twitter.com/libertarianism/status/1178693984153145344","""The North Korean conceit is that everyone on earth is obsessed with North Korea, the Great Leader Kim Il Sung, and the Juche idea, so their books are translated into English, Russian, Chinese, Japanese, Arabic, German, French, and maybe a few others."" https://t.co/SHsmkDDQ3W","354990034"
"Fri Sep 27 17:03:02 +0000 2019","https://twitter.com/BuckTurgidson79/status/1177629732185214976","South Korea military fires 10 warning shots on trespassing North Korean boat https://t.co/ftWQxonYo5 via @upi","1055808434"
"Sun Sep 29 02:06:47 +0000 2019","https://twitter.com/jeff_kaye/status/1178128960221171712","“Former U.S. Marine in North Korean embassy raid is released ahead of extradition trial”

Christopher Ahn charged with violent attack on foreign embassy: released on bail, tho partners are fugitives.

Julian Assange, charged with journalism, refused bail.  https://t.co/KWEocf0XWf","47035436"
"Mon Sep 30 21:31:01 +0000 2019","https://twitter.com/CatoInstitute/status/1178784337443086341","The deployment of the Terminal High Altitude Area Defense (THAAD) system to South Korea may improve the United States’ deterrent against North Korean attack, but it also increases the likelihood of nuclear escalation with China. https://t.co/LAQ2XIQZUM #CatoFP https://t.co/V44e2qRJFq","15450996"
"Fri Sep 27 19:30:00 +0000 2019","https://twitter.com/EconomicTimes/status/1177666718367399936","China's growing military might has replaced North Korean belligerence as the main security threat to Japan, Tokyo's annual defence review indicated https://t.co/2GcJCjqPkS","39743812"
"Mon Sep 30 03:23:50 +0000 2019","https://twitter.com/smh/status/1178510739943936000","Bags of heroin, drug lords, spooks, sailors, Australian cops and a web of lies: The Last Voyage of the Pong Su is a new investigative podcast launching soon which reveals the true story of the North Korean drug ship https://t.co/hj6cXPl8RX https://t.co/J186gUYNx8","16675569"
"Thu Sep 26 16:41:29 +0000 2019","https://twitter.com/johncarlbaker/status/1177261924402245632","Cool AP article about North Korean refugee YouTubers https://t.co/4H5DwoGEzY","372300949"
"Mon Sep 30 11:50:15 +0000 2019","https://twitter.com/mashant/status/1178638182142939138","Because of poaching, Russia this year handed out no licenses to North Korea for fishing in its economic zone. And yet, locals see North Korean boats even in territorial waters. During storms, the border guard runs a hotline for sightings of ""foreigners on shore""","15472044"
"Fri Sep 27 07:06:03 +0000 2019","https://twitter.com/BBCMonitoring/status/1177479496980500481","Russia's Federal Security Service (FSB) has arrested 262 North Korean fishermen charged with poaching in Russia's exclusive economic zone. 30,000 squid and ""banned fishing tools"" seized. (RIA Novosti) https://t.co/cGLfsyoNjp","569238628"
"Sat Sep 28 05:57:00 +0000 2019","https://twitter.com/PinkNews/status/1177824507660251136","North Korean YouTuber says he didn’t know trans people existed till he fled the country https://t.co/YDnzcqhjyT","27987687"
"Mon Sep 30 06:00:56 +0000 2019","https://twitter.com/tassagency_en/status/1178550275688271872","Court arrests ten North Korean poachers over attack on Russian border guards
https://t.co/IUvQ9d6RzE https://t.co/9XgZJSg5I7","1903712426"
"Mon Sep 30 22:00:11 +0000 2019","https://twitter.com/nknewsorg/status/1178791678771109889","Timeline: From North Korean missile testing to a “new method” in diplomacy

NK Pro timeline charts the key events from August 1 - September 24.

FULL TIMELINE: https://t.co/RieITsUYZJ https://t.co/5oJU6Waz5C","147017457"
"Sun Sep 29 11:02:50 +0000 2019","https://twitter.com/rlydoe/status/1178263860215717889","@NoChorus Went there afew months ago it felt like one of the fake north korean places. the bus stop was either hidden or non existent, when i asked where it was i got a “just over there” n a sweep of the arm that took in the whole horizon","258042212"
"Fri Sep 27 07:52:08 +0000 2019","https://twitter.com/IndiaToday/status/1177491094092701696","The statement by Foreign Ministry adviser Kim Kye Gwan came days after Trump said another meeting with North Korean leader Kim Jong Un ""could happen soon"" without elaborating.
https://t.co/inKe0OyAsJ","19897138"
"Fri Sep 27 19:51:23 +0000 2019","https://twitter.com/CRobertsonUK/status/1177672101391667200","@LouiseRawAuthor @steveellwood you should try watching BBCScotland for a week, only thing missing now is a North Korean newsreader, but to be fair Jakey Burd did a cracking impersonation of one before she retired - but hey our loss, Van Helsings gain.","783676030078836736"
"Sun Sep 29 00:40:03 +0000 2019","https://twitter.com/Sino_NK/status/1178107131641438208","In South Korea, Anguish Over Deaths Of North Korean Defectors Who May Have Starved (Sep. 17, 2019) by @akuhnNPRnews https://t.co/StDCJaNIeJ via @NPR","316074898"
"Fri Sep 27 11:43:01 +0000 2019","https://twitter.com/RFERL/status/1177549198000087040","Russia's Coast Guard has detained 262 North Korean fishermen. https://t.co/9CBCSqiRz6","42700240"
"Sat Sep 28 19:49:32 +0000 2019","https://twitter.com/nktpnd/status/1178034023559565319","@HurstPublishers @OUPAcademic I’ve spent the past year working on this, mostly nights and weekends. The book is an extensive look at the development of North Korean nuclear forces under Kim Jong Un, the role of nuclear weapons in Kim’s national defense strategy, &amp; more.","153503737"
"Mon Sep 30 20:00:30 +0000 2019","https://twitter.com/nknewsorg/status/1178761556835876864","Russia’s border security agency last week detained North Korean fishing vessels and motorboats carrying 262 crew members on charges of poaching in the country’s Exclusive Economic Zone (EEZ), multiple outlets reported.

https://t.co/Uhi1xDXY2T","147017457"
"Sat Sep 28 01:06:41 +0000 2019","https://twitter.com/accidentalflyer/status/1177751446332141569","@Noahpinion China. Without backing from China today's North Korean regime would have been long collapsed.","15818403"
"Fri Sep 27 13:21:02 +0000 2019","https://twitter.com/UPI/status/1177573866245222402","South Korea military fires 10 warning shots on trespassing North Korean boat https://t.co/YvBAfSiJka","16666806"
"Mon Sep 30 14:55:20 +0000 2019","https://twitter.com/TheKoreaHerald/status/1178684761780322304","The lawyers accused South Korea’s National Intelligence Service of conspiring with the North Korean manager to bring the women here by deceit and staging the case as defection to rally conservative votes. 
https://t.co/PRYGJCXAGT","56254987"
"Sat Sep 28 13:00:00 +0000 2019","https://twitter.com/MoscowTimes/status/1177930959360057346","#OpEd Moscow’s sharp reaction to the armed conflict with North Korean fishermen reflects its deeper frustration with a wide range of Pyongyang’s policies, writes Pavel Aptekar 
https://t.co/OAIx005DfE","19527964"
