"created_at","url","full_text","user_id_str"
"Mon Aug 31 21:48:21 +0000 2020","https://twitter.com/betdaqsports/status/1300551022151168000","@ddale8 Makes North Korean TV  coverage of Kim look fair and balanced","366360605"
"Fri Aug 28 11:04:36 +0000 2020","https://twitter.com/thepomento/status/1299301855466528769","Kim Jong Un | North Korean leader Kim Jong Un Today Visit typhoon-damaged area in South Hwanghae Province | नॉर्थ कोरिया के शासक किम जोंग ने तूफान प्रभावित इलाकों का दौरा https://t.co/u1f9s2W6eK","141878775"
"Mon Aug 31 21:45:37 +0000 2020","https://twitter.com/IlanYLevine/status/1300550334474051585","@danieltobin Will be as reliable as the North Korean Wons it is written on.","1246368186"
"Fri Aug 28 09:17:22 +0000 2020","https://twitter.com/imax111/status/1299274867007795201","North Korea's Kim says Typhoon Bavi caused little damage: KCNA - Reuters https://t.co/dfBw2Xv3VC

North Korean leader Kim Jong Un inspects the typhoon-damaged area in South Hwanghae Province, North Korea, in this image released by North Korea's Korean Central News Agency (KCNA)… https://t.co/nselvmRKu9","29106490"
"Mon Aug 31 21:44:34 +0000 2020","https://twitter.com/healthrevorg/status/1300550070501212160","U.S. seeks 280 cryptocurrency accounts linked to North Korean hacking scheme https://t.co/6GCQsaVDe1 https://t.co/tMLSAy5uBb","822545909963694080"
"Mon Aug 31 21:44:33 +0000 2020","https://twitter.com/healthrevorg/status/1300550066860515328","Justice Dept. moves to seize 280 cryptocurrency accounts tied to North Korean hacks https://t.co/PYqXmjKztR https://t.co/d8esHkYIN8","822545909963694080"
"Fri Aug 28 09:09:54 +0000 2020","https://twitter.com/LirMihn/status/1299272990572441601","The Trump Party —deserted by many prominent long-time Republicans — is no longer a party of principles, but of a personality cult. 

It is closer to the Communist Party of Trump's good buddy North Korean President Kim Jong Un than to the party of Lincoln. https://t.co/looYeycrnA","156183005"
"Mon Aug 31 21:44:01 +0000 2020","https://twitter.com/mulcs85/status/1300549933838348288","@ThatTimWalker He has a point tho doesn't he? We clearly need more North Korean TV style comedy - maybe some public floggings of non true believers too","2254263485"
"Fri Aug 28 08:59:33 +0000 2020","https://twitter.com/GeeksNewscom1/status/1299270382843617282","What is Kim Jong Un’s sister’s role in North Korean politics? Top South Korean officials appear divided https://t.co/76jxJsPA09","1257279611865530369"
"Mon Aug 31 21:40:02 +0000 2020","https://twitter.com/PoliticiansPost/status/1300548929600344065","Company Pleads Guilty to Money Laundering Violation as Part of Scheme to Circumvent North Korean Sanctions and Deceive Banks, Agrees to Pay Forfeiture and Fine https://t.co/YFKVzXrD2y","1163217820475412482"
"Fri Aug 28 08:35:51 +0000 2020","https://twitter.com/Katherine101364/status/1299264418166067201","Watch ""North Korean Defector Exposes Kim Jong Un &amp; China"" on YouTube https://t.co/IAA9KTkrlH","924529768229371904"
"Mon Aug 31 21:37:41 +0000 2020","https://twitter.com/CharGrandma/status/1300548340178989063","what a stupid hashtag, #BidenCalm. 

It's like they're too dumb to realize that the reason people voted for Trump was because he's loud and promised to get shit done. What's Calm Biden gonna do, give ice cream to the North Koreans if they fire a nuke our way?","1281727639451992064"
"Mon Aug 31 21:35:50 +0000 2020","https://twitter.com/JustTheObvious1/status/1300547872010764290","@starlady24 @FDRLST What also says North Korean is someone claiming to be an army trying to squash dissidents.","742473672368214016"
"Fri Aug 28 08:02:02 +0000 2020","https://twitter.com/StigmabaseU/status/1299255911370825728","UTC -7 | KR —   North Korea Doesn't Trust China to Protect It: When North Korean leader Kim Jong Un and Chinese President Xi Jinping met for the first time in March 2018, the official topics of discussion were ... View article... https://t.co/a2uVndPPqV","208056970"
"Mon Aug 31 21:30:05 +0000 2020","https://twitter.com/Slash2009/status/1300546426993364993","@MikeHolyfuk @LyndaPole @SeanFlan45 When crazy @TuckerCarlson makes excuses for an armed trump  youth loyalist ... this is North Korean propaganda ....","23891094"
"Fri Aug 28 08:01:15 +0000 2020","https://twitter.com/StigmabaseO/status/1299255710828593155","When North Korean leader Kim Jong Un and Chinese President Xi Jinping met for the first time in March 2018, the… https://t.co/yzRCVKx2DY","138418838"
"Mon Aug 31 21:28:10 +0000 2020","https://twitter.com/JohnPaluskaPR/status/1300545943943684102","Company Pleads Guilty to Money Laundering Violation as Part of Scheme to Circumvent North Korean Sanctions and Deceive Banks, Agrees to Pay Forfeiture and Fine - https://t.co/naOrhfRxkD","347311827"
"Fri Aug 28 05:51:59 +0000 2020","https://twitter.com/The_Daily_NK/status/1299223182138920960","Residents of flood-ravaged Unpa County, North Hwanghae Province are still experiencing hardship even after grain and other relief goods were distributed to them at the order of North Korean leader Kim Jong Un. https://t.co/vYCJ7MNnx7 #DPRK #NorthKorea https://t.co/HpQTaPdHu1","1342068500"
"Mon Aug 31 21:27:47 +0000 2020","https://twitter.com/DongleGrump/status/1300545848313614337","North Korean Representatives, not get better week ICE","4214498952"
"Mon Aug 31 21:27:34 +0000 2020","https://twitter.com/Ginger4Trump/status/1300545790667100160","Company Pleads Guilty to Money Laundering Violation as Part of Scheme to Circumvent North Korean Sanctions and Deceive Banks, Agrees to Pay Forfeiture and Fine | OPA | Department of Justice https://t.co/lmkPOlhftL","3520370125"
"Mon Aug 31 21:26:15 +0000 2020","https://twitter.com/John_le_Cheval/status/1300545460063485953","@Aqua_Fag @cranstonl1972 Strict arms controls can help reduce the risk of accidental nuclear war. The Iran nuclear deal encouraged Iran's integration into the global economy and did the same. North Koreans would be better off were they not isolated. I feel like Paris Accord and UNHRC are self-explanatory","821149656092704769"
"Fri Aug 28 04:30:17 +0000 2020","https://twitter.com/bpolitics/status/1299202621228625920","North Korean leader Kim Jong Un says a typhoon that struck this week did less damage than expected https://t.co/b9hCw4plDo","564111558"
"Mon Aug 31 21:25:18 +0000 2020","https://twitter.com/PJBradley4/status/1300545220078174212","Company Pleads Guilty to Money Laundering Violation as Part of Scheme to Circumvent North Korean Sanctions and Deceive Banks, Agrees to Pay Forfeiture and Fine https://t.co/gz9VSOYVjY","1075156620626280449"
"Mon Aug 31 21:24:15 +0000 2020","https://twitter.com/jelleenie03/status/1300544956638081031","@FionnaGlenanne @realDonaldTrump Yes! Yes! Yes! He belongs in jail for treason, not in the White House destroying our nation! He should be spending time with his Russian and North Korean buddies. Hopefully one of them will take him soon. I’m sure he’d be very happy in Russia.  Lots of women in Hotel rooms🤪","1172367965192409088"
"Mon Aug 31 21:22:01 +0000 2020","https://twitter.com/minyoungleeis/status/1300544393640726528","While I'm on the topic of old Korean literature, let's talk about Arirang, the Korean folk song that is considered the ""anthem"" that delivers the soul of the country, listed in the UNESCO Intangible Cultural Heritage list twice by both North and South Korea.","971586323772403712"
"Fri Aug 28 04:29:32 +0000 2020","https://twitter.com/GalacticGamingq/status/1299202433281929216","North Korean leader Kim Jong Un says scale of damage from Typhoon Bavi lower than expected https://t.co/gBdQ71gx3U","1263744193815433216"
"Mon Aug 31 21:20:23 +0000 2020","https://twitter.com/GoldnemovesGold/status/1300543983446261761","Sorry, Democrats: Obama Is More Responsible For ISIS Than Trump - I never felt safe under the Obama Biden administration. Isis aggression, Iranian aggression, North Korean missile testing, etc. https://t.co/DWrzqv93CC","3122123479"
"Fri Aug 28 04:15:04 +0000 2020","https://twitter.com/business/status/1299198790927364098","North Korean leader Kim Jong Un says a typhoon that struck this week did less damage than expected https://t.co/0IW8D7SymK","34713362"
"Mon Aug 31 21:15:33 +0000 2020","https://twitter.com/MeloniaSherban/status/1300542769115660288","Company Pleads Guilty to Money Laundering Violation as Part of Scheme to Circumvent North Korean Sanctions and Deceive Banks, Agrees to Pay Forfeiture and Fine | USAO-DC | Department of Justice https://t.co/c2L6hxecAv","2324917394"
"Fri Aug 28 04:12:33 +0000 2020","https://twitter.com/BloombergAsia/status/1299198160036941824","North Korean leader Kim Jong Un says a typhoon that struck this week did less damage than expected https://t.co/70M4Mc7BCA","588261604"
"Mon Aug 31 21:15:03 +0000 2020","https://twitter.com/nukes_of_hazard/status/1300542642464399367","North Korean leader Kim Jong Un said Typhoon Bavi had caused only minimal damage to the country after making landfall early on Thursday. 
https://t.co/3HPrGFDgMh","113724622"
"Fri Aug 28 03:40:04 +0000 2020","https://twitter.com/LeeJeongHoPulse/status/1299189982460915714","North Korean leader Kim Jong Un says a typhoon that struck this week did less damage than expected https://t.co/FQukgoQjMJ via @bpolitics","1020671139272540160"
"Mon Aug 31 21:08:24 +0000 2020","https://twitter.com/ianbodgerbrown/status/1300540969566244865","More from Melania pal's book: Trump wanted inauguration to be like North Korean military parade https://t.co/rigzc2WwOA","516645637"
"Fri Aug 28 01:43:06 +0000 2020","https://twitter.com/lastbubblerises/status/1299160548764823553","You don't legitimize an illigitimate leader. Trump legitimized North Korean dictator Kim Jong Un and look where that got us. Donald Trump is a pathological liar. Why give him oxygen to lie more? Makes sense.","13525132"
"Mon Aug 31 20:57:27 +0000 2020","https://twitter.com/DidiM47/status/1300538211786260484","@haaohaoo Makes it clear the LAST thing the US is under GOP terror rule is a democracy no? WTF's wrong with you, you dare allow uneducated, ignorant traitor criminal ghouls to FORCE your children into a plague infested  DEATH trap? You make North Koreans look freer than you are!","25571455"
"Mon Aug 31 20:56:21 +0000 2020","https://twitter.com/jfmayer/status/1300537934454681602","If you speak Korean, you might be interested to know that Web Archive makes available a library of 3697 karaoke North Korean videos! You can listen to the music and sing along (provided you are able to read Korean, obviously...).
https://t.co/D7bjxGw2mx #NorthKorea #karaoke https://t.co/myzzN0xBPZ","20771998"
"Fri Aug 28 00:55:07 +0000 2020","https://twitter.com/TubingCave/status/1299148473774866432","North Korean Defector Exposes Kim Jong Un &amp; China https://t.co/7b8WsL1JzJ via @YouTube","1294471926291795968"
"Mon Aug 31 20:55:54 +0000 2020","https://twitter.com/4spinsel/status/1300537822345035777","@2tweetaboutit @BreitbartNews Has a nice North Korean feel to it.","1879695085"
"Fri Aug 28 00:07:01 +0000 2020","https://twitter.com/sk8rgrlcrazi/status/1299136368145293313","@ArmoredProtocol @Becky_Lee_81 @shaycarl @KamalaHarris Is that your best response? Better some creepy uncle than a certified rapist wannabe dictator. I definitely won't forget him saying how he wants Americans to ""respect him the way north Koreans respect Kim Jong Un"" 🙄 oh and don't forget...proven rapist https://t.co/mdLagFl1HN","31271614"
"Mon Aug 31 20:54:44 +0000 2020","https://twitter.com/MissMaga2016/status/1300537528383164422","Yang Ban Corporation, which operated in South Asia, pled guilty to money laundering conspiracy in a scheme to get around North Korean sanctions.","780451584207491072"
"Thu Aug 27 23:39:14 +0000 2020","https://twitter.com/Thelandofark/status/1299129377620283392","@abcnews Not even Kim Jong Un has this many family members speaking at a North Korean propaganda event!","57643837"
"Thu Aug 27 22:36:23 +0000 2020","https://twitter.com/DKalabus/status/1299113557670465536","@prageru There isn't a single elected Communist politician in America. Donald Trump saluted North Korean Generals, called Kim Jong Un a friend and said they were ""in love"". Why does TrumpU, sorry, I mean PragerU support Trump when Trump actually supports/loves genocidal Communist leaders?","1114630584192634881"
"Mon Aug 31 20:42:49 +0000 2020","https://twitter.com/olivia_gaya/status/1300534528650481672","no one thinks my sarcasm is funny, like if i say “oh yeah no i’m definitely north korean” how come no one laughs?? like bitch... do you ACTUALLY believe me?","1089694210121453568"
"Thu Aug 27 22:15:28 +0000 2020","https://twitter.com/SophiaH95252348/status/1299108296826204160","North Korean Defector Exposes Kim Jong Un &amp; China https://t.co/SXKBEsqXUG 来自 @YouTube, this is a warning to Americans, when you do business with Regime government looking for cheap price goods, mean well you are killing the slaves lives! No trade deal with regime government!","1257736617697193986"
"Mon Aug 31 20:41:13 +0000 2020","https://twitter.com/DdgrBluLakr2/status/1300534125816762368","@PoetryPatriot @ThaFamiliaInc Now picture Biden in  a room with Russian, North Korean or Chinese leaders trying to negotiate anything. They will chew him up  and spit him out.","1018168850"
"Thu Aug 27 22:10:18 +0000 2020","https://twitter.com/jesus82637816/status/1299106996566863872","North Korean Defector Exposes Kim Jong Un &amp; China https://t.co/lzwYFPqoWh via @YouTube","1218981094407753734"
"Thu Aug 27 21:52:29 +0000 2020","https://twitter.com/ENigripes/status/1299102510096035840","North Korean Defector Exposes Kim Jong Un &amp; China https://t.co/niHpeuWt2E 来自 @YouTube","1040002596612780037"
"Mon Aug 31 20:39:17 +0000 2020","https://twitter.com/Earnest_One/status/1300533639789162496","More from Melania pal's book: Trump wanted inauguration to be like North Korean military parade https://t.co/XTQ9CmpIZL","329159493"
"Mon Aug 31 20:38:27 +0000 2020","https://twitter.com/LJT_is_me/status/1300533433593147392","— Yang Ban Corporation, a company established in the British Virgin Islands in 2014 

Company Pleads Guilty to Money Laundering Violation as Part of Scheme to Circumvent North Korean Sanctions and Deceive Banks, Agrees to Pay Forfeiture and Fine https://t.co/WFTTHAAIYK","787736606195277824"
"Mon Aug 31 20:38:19 +0000 2020","https://twitter.com/Lunarmoonar1/status/1300533397312270336","Here’s a fun fact as Australian citizens we have as much freedom to travel internationally as North Korean citizens","175368081"
"Mon Aug 31 20:34:19 +0000 2020","https://twitter.com/TheJusticeDept/status/1300532393384828928","Company Pleads Guilty to Money Laundering Violation as Part of Scheme to Circumvent North Korean Sanctions and Deceive Banks, Agrees to Pay Forfeiture and Fine https://t.co/n4QKSD3GF0","73181712"
"Thu Aug 27 21:21:56 +0000 2020","https://twitter.com/inside_nk/status/1299094822419136515","North Korean leader Kim Jong Un inspects damage by the typhoon (State media). https://t.co/uRVI7obINk","3435649113"
"Mon Aug 31 20:32:40 +0000 2020","https://twitter.com/mickilove/status/1300531975963336704","More from Melania pal's book: Trump wanted inauguration to be like North Korean military parade https://t.co/yYadv3IZL0","31226948"
"Mon Aug 31 20:26:16 +0000 2020","https://twitter.com/USAO_DC/status/1300530365967282181","Company Pleads Guilty to Money Laundering Violation as Part of Scheme to Circumvent North Korean Sanctions and Deceive Banks, Agrees to Pay Forfeiture and Fine https://t.co/WMQAsHG7Tn","718112006"
"Thu Aug 27 18:03:21 +0000 2020","https://twitter.com/Matt10165280/status/1299044848402665472","North Korean Defector Exposes Kim Jong Un &amp; China https://t.co/8rgt6gcTTP via @YouTube","1024408560929792000"
"Mon Aug 31 20:23:10 +0000 2020","https://twitter.com/fdjordanjr/status/1300529586883584001","More from Melania pal's book: Trump wanted inauguration to be like North Korean military parade https://t.co/6V8U4ImxuW","44537636"
"Thu Aug 27 17:40:09 +0000 2020","https://twitter.com/edmontonjournal/status/1299039008060780545","North Korean news agency releases photos of Kim Jong Un to debunk claims he's in a coma https://t.co/pCvM3CbEjl","15769858"
"Thu Aug 27 17:24:18 +0000 2020","https://twitter.com/Anilkumarkarun4/status/1299035019172810753","Kim Jong Un news: What’s going on with North Korean leader Kim Jong Un? | World News - Times of India https://t.co/nfVlKlZ2lV","1293822931584323584"
"Mon Aug 31 20:21:53 +0000 2020","https://twitter.com/penfoldsfiv/status/1300529261971996672","@bocxtop we really aren’t that different from North Koreans when it comes to the whole patriotism thing.","1046109939381530624"
"Thu Aug 27 16:19:03 +0000 2020","https://twitter.com/LynnRees11/status/1299018601249218560","Reason #41 for why reps should vote Biden. In contrast to reason #40, Trump seems to bend over backwards to appease our geopolitical enemies. He “fell in love” with North Korean dictator Kim Jong Un and panders to Putin.","1203383199792939010"
"Mon Aug 31 20:21:00 +0000 2020","https://twitter.com/DataBreachToday/status/1300529039027838976","DOJ seeks to recover stolen #cryptocurrency — Justice Department says North Korean hackers laundered millions through Chinese traders
https://t.co/sPxfTiAORy by @prajeetspeaks","386744032"
"Thu Aug 27 15:39:46 +0000 2020","https://twitter.com/Michael28749799/status/1299008716105117696","Kim Jong Un News: Speculation rife over health of North Korean leader Kim | World News - Times of India https://t.co/KapRbUTssS 

He's lucky he's in s.Korea but still ought to sleep with 1 eye opened.","1069975103201468416"
"Mon Aug 31 20:17:33 +0000 2020","https://twitter.com/seodonaldtrump/status/1300528170614099969","Why would I accuse China of black hat SEO when they are working with us on the North Korean Problem? It is always important to WIN! Use @Bing!","855955874665332737"
"Thu Aug 27 15:29:11 +0000 2020","https://twitter.com/atndaily/status/1299006049186443265","North Korean state media on Wednesday showed leader Kim Jong Un at a meeting of a top committee issuing warnings about the coronavirus and a looming typhoon, following international speculation over his state of health.
Read More: https://t.co/NxtwF7LVDl","1079445455824654336"
"Thu Aug 27 15:20:31 +0000 2020","https://twitter.com/HollyBin/status/1299003869557657602","Amazing young woman. At 26, she SHOULD get a Nobel prize!
North Korean Defector Exposes Kim Jong Un &amp; China https://t.co/KoabonEa3O via @YouTube","507958800"
"Mon Aug 31 20:09:51 +0000 2020","https://twitter.com/Xene1042/status/1300526232480755712","@Sr_GomasII @neigeblanca Eso suena a “communism with North Korean characteristics” 😂

USA está demasiado centralizado ya, es un solo país. Yo no quiero unos Estados Unidos de Europa.","3305659696"
"Thu Aug 27 15:20:19 +0000 2020","https://twitter.com/KScibelli/status/1299003819574034432","North Korean Defector Exposes Kim Jong Un &amp; China https://t.co/9BMXJfQ64c via @YouTube","177615639"
"Thu Aug 27 14:37:51 +0000 2020","https://twitter.com/nurul8175/status/1298993133124952074","Kim Jong Un News: Speculation rife over health of North Korean leader Kim | World News https://t.co/aGtfsaauKm","2440343863"
"Mon Aug 31 20:07:52 +0000 2020","https://twitter.com/shelbyholliday/status/1300525733828268032","North Korean propaganda isn't what you think, and the country is trying to reach audiences that speak English, French and Chinese with these kinds of videos: https://t.co/DpOCJtAlQc","17394696"
"Thu Aug 27 13:25:45 +0000 2020","https://twitter.com/PolicialCrazies/status/1298974988301676544","@DLoesch Except. His boss is good fiends with North Korean dictator Kim Jong Un.","822519679772217344"
"Mon Aug 31 20:02:02 +0000 2020","https://twitter.com/S_Edalati/status/1300524268422393856","North Korean hackers stole $250m from two cryptocurrency exchanges - TEISS https://t.co/jeBDdakbl9 #crypto #fintech","934217789492957184"
"Mon Aug 31 20:01:20 +0000 2020","https://twitter.com/FaithTwenty20/status/1300524090034475008","More from Melania pal's book: Trump wanted inauguration to be like North Korean military parade https://t.co/0TXpZWNDO6","1963097234"
"Thu Aug 27 13:13:25 +0000 2020","https://twitter.com/_mechanicalturk/status/1298971883962920962","@BarackObama those dumb North Koreans have played right into my hand. If I just keep claiming Kim Jong Un is in a coma they'll keep releasing new pics just like I planned it, soon I will have more Kim Jong Un pics than they could possibly imagine.","15916583"
"Thu Aug 27 13:11:03 +0000 2020","https://twitter.com/HapkidoSherry/status/1298971287965097986","@DLoesch My favorite North Korean moment is when Kim Jong Un wrote a love letter to DOTARD.","810560915951284224"
"Mon Aug 31 20:01:19 +0000 2020","https://twitter.com/Crstl_M_Romero/status/1300524087802904576","More from Melania pal's book: Trump wanted inauguration to be like North Korean military parade https://t.co/cbKiPHcz2P","17943624"
"Mon Aug 31 20:00:27 +0000 2020","https://twitter.com/RyanMaue/status/1300523870521356292","Next door to Typhoon Maysak is another developing storm (Haishen) that is forecast to become quite intense over the next few days -- and then zoom north across Japan into Korean Peninsula.  

Now, this is a legitimate ""double barrel"" Typhoon situation (25°N latitude) https://t.co/HRlBUbMIFH","16117029"
"Thu Aug 27 12:36:26 +0000 2020","https://twitter.com/smz9317/status/1298962575565127680","North Korean Defector Exposes Kim Jong Un &amp; China https://t.co/B04RaK8UbL via @YouTube","3157628991"
"Mon Aug 31 19:59:23 +0000 2020","https://twitter.com/RKGrammy/status/1300523599191711744","More from Melania pal's book: Trump wanted inauguration to be like North Korean military parade https://t.co/CXkOsbQlQq","2614144291"
"Thu Aug 27 10:10:27 +0000 2020","https://twitter.com/QtvNewsChannel/status/1298925837962670080","What’s going on with North Korean leader Kim Jong Un? – Times of India https://t.co/SF2cHceaD3","1105554027301879808"
"Mon Aug 31 19:56:15 +0000 2020","https://twitter.com/KDVAVets/status/1300522813405777922","South Korea, Aug. 31 (Yonhap) -- Four South Koreans died after their car crashed into a U.S. armored vehicle on Sunday night in Pocheon, north of Seoul, police said.
The two couples were heading home when their sport utility vehicle rear-ended the U.S.… https://t.co/Ad1GIfYaKH","1193607493651447808"
"Thu Aug 27 09:56:21 +0000 2020","https://twitter.com/lukepost/status/1298922292370530304","North Korean Defector Exposes Kim Jong Un &amp; China https://t.co/p9ZjALUX32 via @YouTube","17961253"
"Mon Aug 31 19:55:04 +0000 2020","https://twitter.com/brent_BWD/status/1300522511805939712","Cryptocurrency News: USA DoJ seeking to grab cryptocurrency funds stolen by North Korean hackers. https://t.co/8JXEZebEwc #hackers #cryptocurrency  #blockchain #chainhopping #bitcoin #NorthKorea https://t.co/MaCSOFKhho","83268766"
"Thu Aug 27 09:10:23 +0000 2020","https://twitter.com/gopalr641/status/1298910720860532736","Kim Jong Un news: What’s going on with North Korean leader Kim Jong Un? | World News – Times of India https://t.co/VaV5wvwpfP","3250626349"
"Mon Aug 31 19:52:19 +0000 2020","https://twitter.com/BradfordChaplin/status/1300521821012451328","@PresWallace @POTUS “Our great POTUS” you sound like a North Korean state news pundit.","1219959276145463296"
"Thu Aug 27 09:01:59 +0000 2020","https://twitter.com/in_dinx/status/1298908609406029824","What’s going on with North Korean leader Kim Jong Un? https://t.co/dXJJhYLIDU","1061298730391891968"
"Mon Aug 31 19:49:51 +0000 2020","https://twitter.com/PetruKarel/status/1300521202679721985","@0ffrecord @real_defender @realDonaldTrump Trump is launching stock for a world. Russian and Chinnese politicians love him, he is so easily manipulated.same is with North Koreans. Trump said to them that if they dont stop testing nuclear weapons he will stop them ( they are still testing )","1130036532302241792"
"Thu Aug 27 08:15:16 +0000 2020","https://twitter.com/sarvotion/status/1298896850716700672","What’s going on with North Korean leader Kim Jong Un? https://t.co/X9oGxEKetr","1188901797072556038"
"Mon Aug 31 19:49:03 +0000 2020","https://twitter.com/DaviMarvelous/status/1300521000824647680","More from Melania pal's book: Trump wanted inauguration to be like North Korean military parade 
MALIGNANT NARCISSISTIC FASCIST AUTHORITARIAN WANNABE!
https://t.co/yIDGoHzLqv","1330207086"
"Thu Aug 27 08:04:30 +0000 2020","https://twitter.com/techami31/status/1298894142609784832","What’s going on with North Korean leader Kim Jong Un? https://t.co/tLiwrDc5xt","1070906712926969856"
"Mon Aug 31 19:46:14 +0000 2020","https://twitter.com/GrantSwanson88/status/1300520291769212929","More from Melania pal's book: Trump wanted inauguration to be like North Korean military parade https://t.co/2kcqZzKYHg","242641381"
"Thu Aug 27 07:20:00 +0000 2020","https://twitter.com/wibw/status/1298882942823956480","With unusual candor, North Korean leader Kim Jong Un acknowledged his plans to improve the country’s dismal economy aren’t succeeding as his ruling party scheduled a rare congress in January to set development goals for the next five years. https://t.co/o6crPcR68l","13111552"
"Mon Aug 31 19:45:40 +0000 2020","https://twitter.com/JustTheObvious1/status/1300520148118495236","@FDRLST Nothing says North Korean like writing songs for your dear leader.","742473672368214016"
