"created_at","url","full_text","user_id_str"
"Wed Aug 26 14:02:02 +0000 2020","https://twitter.com/Homeline_Secure/status/1298621732648103943","What is Kim Yo Jong’s exact role in North Korean politics? Top South Korean officials appear divided via OODA Loop - Kim Yo Jong, Kim Jong Un's younger sister, allegedly became the second most powerful North Korean figure ... https://t.co/ajgd7lUg34","19657114"
"Mon Aug 31 17:31:46 +0000 2020","https://twitter.com/MaholmKinard/status/1300486451587674113","North Korean Defector Exposes Kim Jong Un &amp; China https://t.co/iYK4YY5lrE via @YouTube #Sold #ChildTrafficking #EndChina","1285962454451789826"
"Wed Aug 26 13:53:16 +0000 2020","https://twitter.com/CometsComentary/status/1298619525735297024","@marklevinshow That really was the first lady speaking at the RNC last night?  It looked like she was wearing a female North Korean military uniform. Maybe her husband got it when he visited his buddy Kim-Jong-Un.","1213947081955536896"
"Mon Aug 31 17:30:19 +0000 2020","https://twitter.com/taz_daughtrey/status/1300486086343512065","US sues to recover cryptocurrency funds stolen by North Korean hackers https://t.co/A0WF6acz10 via @ZDNet &amp; @campuscodi","732908760423931904"
"Mon Aug 31 17:29:53 +0000 2020","https://twitter.com/KatherineWeesn3/status/1300485975974576128","More from Melania pal's book: Trump wanted inauguration to be like North Korean military parade https://t.co/8pppfiXjJc","1212158285412880384"
"Wed Aug 26 13:46:01 +0000 2020","https://twitter.com/RajendraVelhe/status/1298617701250682886","Claims that Kim Jong Un's sister, Kim Yo Jong, is now the second-most powerful figure in North Korea and a potential successor to her brother are ""exaggerated,"" a South Korean minister said -- contradicting assessments by other top officials in Seoul. https://t.co/4h8A8bYh9R","704998435"
"Mon Aug 31 17:28:02 +0000 2020","https://twitter.com/pureumkim1/status/1300485512352788481","Pray for North Korean churches-","814456556"
"Wed Aug 26 13:43:00 +0000 2020","https://twitter.com/hM2wkpZOw40WNnA/status/1298616940198412288","믕은이가 갈수록 정상적인 행동을 한다🤭
비정상에서 정상 상태로 돌아 왔다는건 정리가 끝났다는 이야기🙄
North Korean leader Kim Jong Un sounds alarm about coronavirus, typhoon https://t.co/WZgxHr7BYU","4647120162"
"Wed Aug 26 13:40:06 +0000 2020","https://twitter.com/cnni/status/1298616209223512066","Claims that Kim Jong Un's sister, Kim Yo Jong, is now the second-most powerful figure in North Korea and a potential successor to her brother are ""exaggerated,"" a South Korean minister said -- contradicting assessments by other top officials in Seoul. https://t.co/L6JrTGpnlb","2097571"
"Mon Aug 31 17:27:47 +0000 2020","https://twitter.com/dulaman65/status/1300485448410816514","Trump Says Americans Should Obey Him Like North Koreans Obey Kim Jong-un. 

The man is a nut.","2342875914"
"Wed Aug 26 13:30:21 +0000 2020","https://twitter.com/TlotIo/status/1298613759473311745","North Korean, Kim Jong Un when I spray the machine 
https://t.co/3QeIG35050","735145063181889540"
"Mon Aug 31 17:27:33 +0000 2020","https://twitter.com/SpiritofJD/status/1300485389321465857","North Korean polling!","15403525"
"Wed Aug 26 13:11:23 +0000 2020","https://twitter.com/RishuPa63956115/status/1298608983176024066","New post: North Korean leader Kim Jong Un reappears days after health speculations| कोमा में होने के कयासों के बीच किम जोंग-उन ने दुनिया को किया फिर हैरान https://t.co/lGLmY3tcOn","1034500675634323456"
"Mon Aug 31 17:26:20 +0000 2020","https://twitter.com/ResisterDot/status/1300485082894028802","More from Melania pal's book: Trump wanted inauguration to be like North Korean military parade https://t.co/Abl78rHL8X","542947234"
"Wed Aug 26 12:55:40 +0000 2020","https://twitter.com/AcemanSmooth/status/1298605027477590018","North Korean Defector Exposes Kim Jong Un &amp; China https://t.co/xGlHoLVsy1 prostredníctvom @YouTube","299830020"
"Mon Aug 31 17:25:30 +0000 2020","https://twitter.com/otep1212/status/1300484872587411457","@politvidchannel Again Jared, you mean the Russians and North Koreans, right?","4242294136"
"Wed Aug 26 12:28:50 +0000 2020","https://twitter.com/Posicho/status/1298598274472071169","Top South Korean officials appear divided over role of Kim Jong Un's sister in North Korea
https://t.co/8oFsKIrP30","2894304536"
"Mon Aug 31 17:25:16 +0000 2020","https://twitter.com/StyxMaker/status/1300484817356636161","More from Melania pal's book: Trump wanted inauguration to be like North Korean military parade https://t.co/oRNruNRYLK","12332052"
"Mon Aug 31 17:22:57 +0000 2020","https://twitter.com/Alan62672966/status/1300484230560980992","@snowycats @Vic_Rollison @rooze_henri KIM JONG DAN HAS BECOME A WRECKER, CONTROL FREAK, TREATING US AS FOOLS, LIKE SURFS FROM THE MIDDLE AGES, HAD ENOUGH OF THIS WANNA BE NORTH  KOREAN DICTATOR, PUT THIS GUY IN A CENTRE LINK LINE. FOR A DAY COP UNEMPLOYMENT FOR A TIME, RESIGN ANDREWS","1277557062629613569"
"Wed Aug 26 12:28:48 +0000 2020","https://twitter.com/tonykchoi/status/1298598268864204800","We're so broken that the only frame we can see the potential plight for millions of North Koreans is the question ""hOW iS tHiS gOing To aFfeCT KiM jOnG uN?""","273829582"
"Mon Aug 31 17:20:39 +0000 2020","https://twitter.com/MadaganSharon/status/1300483652430835712","More from Melania pal's book: Trump wanted inauguration to be like North Korean military parade https://t.co/o15AnpRuTj","996139967310114816"
"Wed Aug 26 12:25:20 +0000 2020","https://twitter.com/GeeksNewscom1/status/1298597394033057792","What is Kim Jong Un’s sister’s role in North Korean politics? Top South Korean officials appear divided https://t.co/fSGxabN75t","1257279611865530369"
"Mon Aug 31 17:20:09 +0000 2020","https://twitter.com/Grrmace/status/1300483529231364096","@MollyJongFast Wanting to put on North Korean military parades can't help either.","2792977926"
"Mon Aug 31 17:14:32 +0000 2020","https://twitter.com/NoNonsence8/status/1300482112437530624","@maDube_ @PhoenixRise03 North koreans and russians","1240958788913582080"
"Wed Aug 26 12:23:53 +0000 2020","https://twitter.com/LetsobeyGodsLaw/status/1298597030617657344","""It takes courage to expose the truth to wickedness!""
North Korean Defector Exposes Kim Jong Un &amp; China https://t.co/uGNXqnMpo7 via @YouTube","1248458520728440836"
"Mon Aug 31 17:10:51 +0000 2020","https://twitter.com/SydneyBerner1/status/1300481185424879616","More from Melania pal's book: Trump wanted inauguration to be like North Korean military parade https://t.co/CmT7cPXih2","806949205843460096"
"Wed Aug 26 12:20:17 +0000 2020","https://twitter.com/SkyNews/status/1298596126120194048","North Korean leader Kim Jong Un has chaired a meeting in Pyongyang, warning authorities of an incoming typhoon and the impact of the #COVID19 pandemic.

Latest world news here: https://t.co/JIwqxHqcaH https://t.co/T7g4AJCSD3","7587032"
"Mon Aug 31 17:08:02 +0000 2020","https://twitter.com/benedictrogers/status/1300480479058169856","UN official sounds the alarm on North Korean human rights amid COVID-19 https://t.co/gmzk8KtYs6","49035671"
"Wed Aug 26 12:12:53 +0000 2020","https://twitter.com/dbjdpb/status/1298594260476760064","Sounds like the way North Koreans talk about Kim Jong Un.

The Republican convention just proved this scary fact about the GOP https://t.co/o38Klt9hbe #SmartNews","32387787"
"Mon Aug 31 17:05:22 +0000 2020","https://twitter.com/Carol11946ford/status/1300479808565055489","More from Melania pal's book: Trump wanted inauguration to be like North Korean military parade https://t.co/kpaqsjG83T","888424374054866944"
"Wed Aug 26 12:11:08 +0000 2020","https://twitter.com/NewsofthedayNet/status/1298593821681426436","What is Kim Jong Un's sister's role in North Korean politics? Top South Korean officials appear divided #coronavirusstats #coronavirusnews #coronavirusupdate #coronavirusus https://t.co/nv6H4CXrUb","1124023417655779328"
"Mon Aug 31 17:01:46 +0000 2020","https://twitter.com/TrumpTheCrimin1/status/1300478901412659203","More from Melania pal's book: Trump wanted inauguration to be like North Korean military parade https://t.co/o3DgKGY0P0","1184528231636111360"
"Wed Aug 26 12:08:26 +0000 2020","https://twitter.com/BMNews4/status/1298593141717598208","What is Kim Jong Un’s sister’s role in North Korean politics? Top South Korean officials appear divided https://t.co/Yy3WbiXDHt","1272565774385889285"
"Mon Aug 31 17:01:19 +0000 2020","https://twitter.com/Hughjeffort/status/1300478786501214210","@Activision Absolutely shocked at the totalitarian way you handle yourselves. Banning people from a game they just spent £60 buying without giving any reason? Without allowing people to answer an accuser? No better than the North Korean dictator.","25027392"
"Mon Aug 31 17:00:24 +0000 2020","https://twitter.com/nknewsorg/status/1300478556867358722","U.N. special rapporteur on North Korean human rights Tomás Ojea Quintana raised concerns over the ""drastic reduction"" of North Korean defectors entering the South this year. https://t.co/4xKsNOblEw","147017457"
"Wed Aug 26 11:50:04 +0000 2020","https://twitter.com/ultrascanhumint/status/1298588519028240384","Pompeo Address to Republican Convention Draws Scrutiny | Voice of America - English: ... with North Korean leader Kim Jong Un, efforts to defeat the Islamic State group and opposing what Pompeo called China's “predatory… https://t.co/kYcbwCG8sb #islamicstate #islamicterrorism","1898083759"
"Mon Aug 31 16:56:15 +0000 2020","https://twitter.com/novasgirl46/status/1300477514884800515","More from Melania pal's book: Trump wanted inauguration to be like North Korean military parade https://t.co/XpVkc8pxGG","1155359584250413056"
"Wed Aug 26 11:47:52 +0000 2020","https://twitter.com/SankarModak11/status/1298587967703920641","What is Kim Jong Un’s sister’s role in North Korean politics? Top South Korean officials appear divided https://t.co/BjTLfAPlPI","1179005260590809088"
"Mon Aug 31 16:54:39 +0000 2020","https://twitter.com/realJammur/status/1300477112411922437","@Peggysuz2017 If we don't vote our butts off, these people will choose our president again. Along with the Russians,  Chinese, North Koreans, Somalis, ....","782363971265425409"
"Wed Aug 26 11:43:16 +0000 2020","https://twitter.com/AgitatedMan/status/1298586807005786115","Kim Jong Un appears at government meeting following rumor that the North Korean leader was seriously ill and in a coma.
https://t.co/B8wjatiUMl","941094576797945856"
"Mon Aug 31 16:53:35 +0000 2020","https://twitter.com/book_tribe/status/1300476841686429698","• At the Sharpe End: Kenneth Sharpe is running for his life in 2008 #Tokyo. Who's chasing him? Everybody, it seems: CIA, Japanese police, #yakuza, North Koreans, and even the British. Why? It's something to do with the Hello Kitty box he's been given. https://t.co/QGwwOgU9mt https://t.co/b8oWtEVHWg","250309546"
"Wed Aug 26 11:35:51 +0000 2020","https://twitter.com/coffeeownsme/status/1298584944428699650","1) What’s the status of Kim Yo Jong, Kim Jong Un’s powerful sister? Officials in Seoul say the North Korean leader’s younger sibling is effectively running one of the most important political bodies in the country -- the Organization and Guidance Department of North Korea's","2827770165"
"Mon Aug 31 16:47:43 +0000 2020","https://twitter.com/lgomezperu/status/1300475364997820417","United States Issues #Alert on North Korean Threat Actors Finding Better Ways to #Rob Banks https://t.co/DlQiQBcBHl","20853968"
"Wed Aug 26 11:33:46 +0000 2020","https://twitter.com/NorthKoreaFirst/status/1298584419285049344","Kim Braces North Korea for Typhoon That Could Wipe Out Crops
North Korean leader Kim Jong Un told his ruling party to get ready for a typhoon that could deal another blow to the country’s already damaged agricultural sector
https://t.co/I09eaRwZ2O","831910801451659265"
"Mon Aug 31 16:47:35 +0000 2020","https://twitter.com/sankarsworld/status/1300475333133529088","@sumanthraman I was wondering why you go for such debates so far. Good that you made your point doc. But, I sincerely wish you do not go for any debates henceforth with these North Korean channels.","2362649744"
"Wed Aug 26 11:30:06 +0000 2020","https://twitter.com/edmecka/status/1298583496152186882","NEW: Kim Jong Un appears at government meeting after rumor claimed the North Korean leader was seriously ill and in a coma (twitter) - https://t.co/1PfW08XTpH","44357949"
"Mon Aug 31 16:47:01 +0000 2020","https://twitter.com/AmherstMADems/status/1300475188048429056","Check your precinct polling location; some moved this year:

1: North Zion Korean Church
2: Amherst High School
3: Immanuel Lutheran Church
4: Amherst High School
5: Bangs Center
6: Fort River
7: Crocker Farm
8: Munson Memorial Library
9: Wildwood 
10: Amherst High School","1255967860729565184"
"Wed Aug 26 11:25:18 +0000 2020","https://twitter.com/Lord_SC_/status/1298582286926057473","Breaking News: 🔰 Some news outlets have claimed that North Korean dictator Kim Jong Un is dead.
Source:","464643036"
"Wed Aug 26 11:16:08 +0000 2020","https://twitter.com/GuardianNigeria/status/1298579981942104064","North Korean state media on Wednesday showed leader Kim Jong Un at a meeting of a top committee issuing warnings about the coronavirus and a looming typhoon, following international speculation over his state of health. https://t.co/HuagVKG8Ki","57320024"
"Mon Aug 31 16:45:09 +0000 2020","https://twitter.com/sandylargo/status/1300474721176350722","@mamar9635 @SenRonJohnson @WI_Guard @KenoshaPolice Passed right to try for terminally ill

US now number one producer of oil and natural gas in the world 

US now a net exporter of energy 

Rebuilt our military

North Korean hostages home","830084587"
"Mon Aug 31 16:44:30 +0000 2020","https://twitter.com/AnaAntu31576427/status/1300474557107707910","More from Melania pal's book: Trump wanted inauguration to be like North Korean military parade https://t.co/THRhj142Lf","1266429569856409606"
"Wed Aug 26 11:09:37 +0000 2020","https://twitter.com/republic/status/1298578341700698113","North Korean state media shows Kim Jong Un at meeting after 'comatose' claims https://t.co/QU2e11tsPq","811972460560019456"
"Wed Aug 26 11:05:06 +0000 2020","https://twitter.com/Alex_Albert/status/1298577202401837057","What is Kim Jong Un’s sister’s role in North Korean politics? Top South Korean officials appear divided https://t.co/TYgRx1YTAx","15561794"
"Mon Aug 31 16:42:34 +0000 2020","https://twitter.com/BThurstonCPTECH/status/1300474070228709379","SentinelOne : 🇰🇵 North Korean-backed threat groups continue to adapt and evolve; their latest campaign aims to gather intel from key defense and government contractors. By Jim Walter

https://t.co/SS7bfA1JdH

#cybersecurity #ai #security #infosec #dprk #informationsecurity #cyb…","2765450729"
"Wed Aug 26 11:04:09 +0000 2020","https://twitter.com/Dis_Naija/status/1298576963389419521","North Korea's Kim issues warning on virus as health speculation swirls North Korean state media on Wednesday showed leader Kim Jong Un at a meeting of a top committee issuing warnin https://t.co/qFU2YmDu4L","893133403"
"Mon Aug 31 16:42:26 +0000 2020","https://twitter.com/arthur_price/status/1300474038125563905","North Korean hackers are actively robbing banks around the world, US government warns https://t.co/K9sXNs01bI via @ooda","373385754"
"Wed Aug 26 11:00:42 +0000 2020","https://twitter.com/DailysFlash1/status/1298576098167578625","📷 What is Kim Jong Un’s sister’s role in North Korean politics? Top South Korean officials appear divided https://t.co/8MFL8N8c5p","1271500957805879296"
"Mon Aug 31 16:42:06 +0000 2020","https://twitter.com/fakenewsSKY/status/1300473950418345984","North Korean Defector Exposes Kim Jong Un &amp; China https://t.co/Ikn8CyDMVb via @YouTube 

Well worth a watch","1106271"
"Wed Aug 26 11:00:32 +0000 2020","https://twitter.com/DailysFlash1/status/1298576056379637760","What is Kim Jong Un's sister's role in North Korean politics? Top South Korean officials appear dividedDONATE TOW...
https://t.co/Vj4ar74w2c","1271500957805879296"
"Wed Aug 26 10:59:05 +0000 2020","https://twitter.com/digitaltariq/status/1298575689180905472","What is Kim Jong Un’s sister’s role in North Korean politics? Top South Korean officials appear divided https://t.co/2EmYn3fVxf","1246403239886520320"
"Mon Aug 31 16:38:19 +0000 2020","https://twitter.com/pigram86/status/1300472998416265221","The BLINDINGCAN RAT and Malicious North Korean Activity https://t.co/t6wFQKrwcA","34908943"
"Wed Aug 26 10:57:13 +0000 2020","https://twitter.com/DZXL_News/status/1298575219502780417","Kasunod ng mga ispekulasyong may problema sa kalusugan, North Korean Leader Kim Jong Un, lumabas na sa publiko https://t.co/x8y25QVU3p via @RMNNetworks","776622292025606145"
"Mon Aug 31 16:31:30 +0000 2020","https://twitter.com/PavelNosok/status/1300471286381117442","$140,000 of North Korean Bitcoin Targeted by DoJ Starts Moving https://t.co/uvIWoEzp81","93278931"
"Mon Aug 31 16:28:45 +0000 2020","https://twitter.com/BudGothmog44/status/1300470590709661700","More from Melania pal's book: Trump wanted inauguration to be like North Korean military parade https://t.co/O7qSagHnGG","414221776"
"Wed Aug 26 10:54:03 +0000 2020","https://twitter.com/queenstrendy/status/1298574425139208194","North Korean leader, Kim Jong Un, calls for readiness against coronavirus https://t.co/RthOtPH0uH https://t.co/LIttnFhtDi","2896032904"
"Mon Aug 31 16:23:02 +0000 2020","https://twitter.com/NKOutlook/status/1300469155397853184","NK Tech: We Interrupt this Propaganda…A Dynamic 24 Hours on North Korean TV | https://t.co/WyJxpp8Pwc | #NorthKorea","1110042661"
"Mon Aug 31 16:22:17 +0000 2020","https://twitter.com/mikewhiteyellow/status/1300468966738067458","@ECHR_CEDH the president should get another degree from a North Korean university, fully democratic","798228706800103424"
"Wed Aug 26 10:52:31 +0000 2020","https://twitter.com/hnkimma/status/1298574035299704833","What’s going on with Kim Jong Un? Is he sick? Worried about Covid-19? Consumed by an economic crisis? Battling internal threats?
-------??

Some media-
Even wrong than wrong.

North Korean Chairman Kim Jong-un is normal
be in a state of coma?? No -Worng Media 

AUG  24 Photo https://t.co/uIjyEyh51h","3008029160"
"Mon Aug 31 16:21:04 +0000 2020","https://twitter.com/gang_chen_china/status/1300468657336721413","402:說西方國家是文明的國家是這些人，在朝鮮戰爭說美軍只有死亡几千，中國人朝鮮死幾萬十幾萬近于屠殺也是這些人，文明就是等於近于屠殺麼？
North Korean war the US milit only for death thousands of people, the Chinese people died of tens of thousands civilization is nearly slaughtering?","1127839116878647297"
"Wed Aug 26 10:43:09 +0000 2020","https://twitter.com/AdamZaccaria/status/1298571679636099072","What is role of Kim Jong Un's sister in North Korean politics? Top South Korean officials appear divided

https://t.co/Rb3gcdm8Ak","2778274199"
"Mon Aug 31 16:20:17 +0000 2020","https://twitter.com/FacelessManTwit/status/1300468463954255879","@Son_Of_NIPPON Right now is a perfect time for Japan to claim a strategic necessity for nuclear submarines if Japan chooses to so, that Japan needs nuclear subs to chase North Korean nuclear SLBM submarines heading toward US mainland. The window is narrow so it's now or never.","2335972670"
"Wed Aug 26 10:39:50 +0000 2020","https://twitter.com/hardynwa/status/1298570846706044928","North Korean leader, Kim Jong Un, calls for readiness against coronavirus https://t.co/7FEa3ISwSi","43851649"
"Mon Aug 31 16:19:25 +0000 2020","https://twitter.com/PaulESamson/status/1300468242004180992","Bitcoin Lump Moved by North Korean Hackers While FBI Is After Funds They Stole - - https://t.co/Gv8Ug6BXAn","126159663"
"Wed Aug 26 10:39:47 +0000 2020","https://twitter.com/Otowngist/status/1298570831614939137","North Korean leader, Kim Jong Un, calls for readiness against coronavirus https://t.co/Mh9A4A1vgc","574934425"
"Mon Aug 31 16:14:07 +0000 2020","https://twitter.com/NoMrBot/status/1300466910690246667","""You expect me to just Oppa North Korean style?"" ""No, Mr. Bond, I expect you to Psy.""","822312059031302144"
"Wed Aug 26 10:35:34 +0000 2020","https://twitter.com/vanguardngrnews/status/1298569770795638786","North Korean leader, Kim Jong Un, calls for readiness against coronavirus https://t.co/0Q3cl6vba9 #vanguardnews https://t.co/xB0OEtnlR0","39975533"
"Wed Aug 26 10:25:03 +0000 2020","https://twitter.com/OnwardNG/status/1298567124743413766","North Korean leader, Kim Jong Un, calls for readiness against coronavirus https://t.co/xLnDfV2x6T https://t.co/RzljXjSAij","163594070"
"Mon Aug 31 16:10:55 +0000 2020","https://twitter.com/GMarasciullo/status/1300466104515526662","@marwilliamson Thank you for sharing and all you do to help save democracy Twitter destroyed my account because I tweeted a plea for peace to North Korean leaders three years ago also fb still try to build my network back up","1047879085014147072"
"Wed Aug 26 10:22:33 +0000 2020","https://twitter.com/Naijawhatsup/status/1298566497611034625","North Korean leader, Kim Jong Un, calls for readiness against coronavirus https://t.co/8ORgeo13nX https://t.co/IopqyvHqbu","2939497901"
"Mon Aug 31 16:07:14 +0000 2020","https://twitter.com/FacelessManTwit/status/1300465176181956613","@Son_Of_NIPPON At the same time, the US won't oppose ROK's self sourcing of nuclear submarines anymore due to strategic necessity of such submarines following the unveiling of North Korean SLBM sub. https://t.co/XTuC4RBzcI","2335972670"
"Wed Aug 26 10:19:27 +0000 2020","https://twitter.com/vanguardngrnews/status/1298565715482611714","North Korean leader, Kim Jong Un, calls for readiness against coronavirus https://t.co/A04YiCcEJT","39975533"
"Mon Aug 31 16:05:15 +0000 2020","https://twitter.com/rebootednoahx/status/1300464678712336388","Americans hate North Koreans for worshipping their leader and treating him as a deity as they pledge their allegiance to a flag every morning","1038631755610238976"
"Wed Aug 26 10:10:05 +0000 2020","https://twitter.com/CollectedTimes/status/1298563358677925888","North Korean leader Kim Jong Un calls for readiness against virus and typhoon

Stories from 6 sources | Photo via Evening Standard

https://t.co/ex9qt1BnCC

 #coronavirus #typhoon https://t.co/To8hhJ8DOQ","1209133111956688896"
"Mon Aug 31 15:59:38 +0000 2020","https://twitter.com/SentinelOne/status/1300463265873502208","🇰🇵 North Korean-backed threat groups continue to adapt and evolve; their latest campaign aims to gather intel from key defense and government contractors. By Jim Walter

https://t.co/JwNs3rPUyY

#cybersecurity #ai #security #infosec #dprk #informationsecurity #cyberattack #ciso","1078221296"
"Wed Aug 26 09:48:52 +0000 2020","https://twitter.com/CharlieZtuker/status/1298558017231900672","Kim Jong Un appears at government meeting after rumor claimed the North Korean leader was seriously ill and in a coma https://t.co/DKHX7K6lAN","991742338270670849"
"Mon Aug 31 15:58:24 +0000 2020","https://twitter.com/WisconsinProj/status/1300462953179865089","North Korean authorities publicly rejected U.S. government claims that the country is connected to a financial cybercrime campaign targeting international ATMs, the DPRK’s foreign ministry stated on Aug. 29.
https://t.co/J29TGZyFAB","1247823998"
"Wed Aug 26 09:47:54 +0000 2020","https://twitter.com/nonifinon/status/1298557777002995717","@TimSmithMP BREAKING

Daniel Andrews:

""I will be resigning as Premier at 5pm and taking up an overseas post.

""Kim Jong Un has died and I will be taking over as leader.

""This will mean some changes for North Koreans, with fewer freedoms than before, but it's for their own good.""

(Parody)","1115778445"
"Wed Aug 26 09:45:03 +0000 2020","https://twitter.com/Cletus1942/status/1298557060163014656","North Korean Defector Exposes Kim Jong Un &amp; China - YouTube https://t.co/eJErEYYPJB","2841377931"
"Mon Aug 31 15:55:46 +0000 2020","https://twitter.com/CT_Intelligence/status/1300462291138293760","#DoJ aims to seize 280 #cryptocurrency accounts used by #hackers to funnel $250m in stolen funds as part of #NorthKorean attacks to hack cryptocurrency exchanges &amp; funnel funds through #Chinese money-laundering network
https://t.co/wRTtKXTqot
#CyberThreatIntel #CTI #CyberSecurity","1141638127271813121"
"Wed Aug 26 09:43:38 +0000 2020","https://twitter.com/99_cgn/status/1298556702539886593","What is the role of Kim Jong Un’s sister in North Korean politics? South Korea’s top officials seem divided https://t.co/HxkPKS4qES","1295430650028204032"
"Wed Aug 26 09:38:57 +0000 2020","https://twitter.com/mikewsherer/status/1298555522984157186","the primary point of Trump sitting down with North Korean leader Kim Jong Un was to get the rogue state to denuclearize, which it has not yet done as it continues to engage in aggressive activities that have made US allies in the region uneasy.","3292515541"
"Mon Aug 31 15:51:26 +0000 2020","https://twitter.com/pete_yhwhrulz/status/1300461200208257024","North Korean hackers are actively robbing banks around the world, US government warns https://t.co/CWLUYnheak via @ooda","380985630"
"Mon Aug 31 15:47:10 +0000 2020","https://twitter.com/CT_Intelligence/status/1300460128878104576","#BeagleBoyz, part of #NorthKorean #government's #hacking apparatus, are actively #robbing #banks globally
Group uses #spearphishing, #wateringholes, #socialengineering, #maliciousfiles &amp; contracted 3rd party hackers
https://t.co/oP3ErOwcln
#CyberThreatIntel #CTI #CyberSecurity","1141638127271813121"
