"created_at","url","full_text","user_id_str"
"Thu Apr 30 10:54:54 +0000 2020","https://twitter.com/rickykasozi/status/1255812867426783232","Nearly three weeks since North Korea's Kim Jong Un was last seen in public, Pres. Trump and senior South Korean leaders are downplaying or even outright dismissing reports about his condition. https://t.co/tV9yKum9kH","3362797065"
"Thu Apr 30 22:40:40 +0000 2020","https://twitter.com/Sylvaners/status/1255990483010060288","Again?
KIM JONG-UN ‘DEAD’- North Korean Leader Has Reportedly Died, Says Hong Kong TV https://t.co/FkffKjS6Jg via @Politicalite","125632328"
"Thu Apr 30 10:54:43 +0000 2020","https://twitter.com/LISTEN_NEW_YORK/status/1255812821822124033","BREAKING: LAST WORLD NEWS Taiwan NSB director Says that the North Korean dictator Kim Jong Un is '... : Taiwanese security director says Kim Jong Un is sick, contingency plans in place for power vacuum  https://t.co/rwUdhdxQM9","1197226526045065218"
"Thu Apr 30 22:39:19 +0000 2020","https://twitter.com/VictorishB123/status/1255990141157433344","@VRValicento @yashar I don't believe they were North Korean.  They thought they had been selected to be part of a prank show, like Candid Camera or something, they claimed.","1247606632009195520"
"Thu Apr 30 10:38:39 +0000 2020","https://twitter.com/tomotachitomo/status/1255808778991292420","With speculation lingering that North Korean leader Kim Jong Un is in grave danger after surgery, many foreign affairs experts have started to ruminate about who would take over should anything happen to him.
https://t.co/exmVehjQFG","2837768377"
"Thu Apr 30 22:38:59 +0000 2020","https://twitter.com/COINSinHAND/status/1255990056327634944","Bahahahahahah. What? North Korea to have north Korean leader? Well... yeah....","751133272889921536"
"Thu Apr 30 10:26:25 +0000 2020","https://twitter.com/DrAbdirahmanA/status/1255805701558960129","BREAKING: North Korean leader KIM JONG UN has been found WELL and HEALTHY living in a luxury resort in an Island. He has been isolated him self from Coronavirus, as per sources. https://t.co/QcmvfRlLcD","848436272578174976"
"Thu Apr 30 22:35:00 +0000 2020","https://twitter.com/WeeklyHumorist/status/1255989054895726592","Wine Pairings With Household Chores ~ by @KiraJaneWrites 
According to people who make science, housecleaning affords the precise level of pleasure as time spent in a North Korean prison. #TBT #wine 
https://t.co/SWA3FwkVrm","828279594843308034"
"Thu Apr 30 10:24:45 +0000 2020","https://twitter.com/a_ara1/status/1255805282900496384","North Korean leader Kim Jong Un is an protege of the USA? How arrangements between Trump and Kim Jong Un a geopolitical situation will be reflected in Armenia?: https://t.co/Gfw1blguLT","1668032568"
"Thu Apr 30 22:34:45 +0000 2020","https://twitter.com/Korean_Steam/status/1255988991649820673","RIP to the Bachelor Farmer and Marvel Bar. The north loop won't be the same without you guys.","82928221"
"Thu Apr 30 10:20:21 +0000 2020","https://twitter.com/NATSEC09/status/1255804175386062849","Is North Korean leader Kim Jong Un dead or very ill? 10 tracking tactics. Amb. Joe Detrani, @SandiaLabs one of the world's preeminent experts on North Korea says Kim has long planned for this day. LISTEN https://t.co/7jTJ2ixOB7  SUBSCRIBE &amp; FOLLOW @TUSAPodcast @PodcastOne @WTOP https://t.co/tXbaDAtn1X","50409062"
"Thu Apr 30 22:33:33 +0000 2020","https://twitter.com/jimyoung2817/status/1255988688003248129","@vbislands @JamesABurgin @paulkrugman That’s the most unamerican thing I’ve ever heard. You sure you’re not North Korean?  Support our “Dear Leader”?  Our job is to hold our elected officials accountable, not to blindly support them!","529508857"
"Thu Apr 30 10:10:40 +0000 2020","https://twitter.com/nicolatheron/status/1255801738218680326","Looks like Kim Jong Un is having the last laugh with the US, who all thought (and US media helped spread rumors) he had fatal heart surgery. Turns out he’s on a luxury boat at his fav North Korean coastal resort 😂","256219641"
"Thu Apr 30 22:22:07 +0000 2020","https://twitter.com/MichaelPascoe01/status/1255985812694433793","""Operation Warp Speed is clearly another extension of the President Trump’s bold leadership"" - the USA becomes a little more North Korean every day  https://t.co/DkKz09v2yD","2235731509"
"Thu Apr 30 10:02:55 +0000 2020","https://twitter.com/kyodo_english/status/1255799786592014337","With speculation lingering that North Korean leader Kim Jong Un is in grave danger after surgery, many foreign affairs experts have started to ruminate about who would take over should anything happen to him, writes our reporter @tomotachitomo 

https://t.co/Sa1NM5DaaR","193042922"
"Thu Apr 30 22:20:00 +0000 2020","https://twitter.com/TPE_connect/status/1255985278830821376","North Korean media publish Kim Jong-un's letter to prove he's well.. || #KimJongUn #KimYoJong #NorthKorea #Pyongyang || https://t.co/mlb3zJM0cC","1057148786189824000"
"Thu Apr 30 09:28:43 +0000 2020","https://twitter.com/autogistz/status/1255791180727685120","Kim Jong Un ‘Cannot Stand Up By Himself Or Walk Properly’, North Korean Defector Claims https://t.co/PdTKy21caK https://t.co/HqIKjscvjT","978997525"
"Thu Apr 30 22:17:34 +0000 2020","https://twitter.com/JimmyTVu1/status/1255984668899520512","@CJ_Black0 I should also let you know that defected North Koreans are discriminated against by South Koreans. It's still happening in places like Koreatown in L.A.","1019634486684811270"
"Thu Apr 30 09:08:00 +0000 2020","https://twitter.com/Theamericanpos3/status/1255785967270715392","Satellite images of luxury boats ‘suggest Kim Jong Un is in North Korean coastal resort’ https://t.co/y0wJN9NkcD","1253922621353103360"
"Thu Apr 30 22:15:13 +0000 2020","https://twitter.com/LarayDives/status/1255984075237621760","My sources say that Coronavirus was accidentally released from a North Korean lab, not a Chinese one. #TrumpIsALiar #BadKarma #KimJongUnDying","17643984"
"Thu Apr 30 08:40:00 +0000 2020","https://twitter.com/timesofindia/status/1255778919137062913","Kim Jong Un — What do we really know about the man who leads North Korea?

New rumors about Kim pour in daily. The North Korean leader is dead. Or he's ill. Or maybe he's just recuperating in his luxury compound, or isolating himself from coronavirus.

https://t.co/aKbEuyOe9L https://t.co/m8l8cBLOsk","134758540"
"Thu Apr 30 22:13:07 +0000 2020","https://twitter.com/Paul_Cousins20/status/1255983546910507012","@RAZ0RFIST The North Korean government is not really a dictatorship, it is a monarchy (he only has the job as ""leader"" due to his bloodties to the previous leader) that is backed by a military junta.","1146151458"
"Thu Apr 30 08:28:35 +0000 2020","https://twitter.com/RaghavS49394362/status/1255776045149626368","Kim Jong Un Health Update: अब फैसले नहीं ले रहे हैं उत्‍तर कोरियाई तानाशाह किम जोंग उन, बीमारी की अटकलें और तेज – north korean dictator kim jong un no longer taking decisions speculation of critical illness intensified https://t.co/p2jcLRgl2f https://t.co/GW4uZRrISH","1229413026371031041"
"Thu Apr 30 22:12:57 +0000 2020","https://twitter.com/Cryptik4Prez/status/1255983503906230272","I vote Dennis Rodman as the next North Korean dictator.","4443335476"
"Thu Apr 30 08:16:54 +0000 2020","https://twitter.com/JobsVacancyIN/status/1255773108075708416","No longer taking decisions North Korean dictator Kim Jong Un, speculation of disease and… https://t.co/qunbTw93qQ","1013556546"
"Thu Apr 30 22:05:34 +0000 2020","https://twitter.com/DictionaryBot_/status/1255981645863227392","Word: korean
Part of Speech: Adjective
Definition: Relating to North or South Korea or its people or language","1242276747610972164"
"Thu Apr 30 08:05:59 +0000 2020","https://twitter.com/inside_nk/status/1255770359116300288","Talk of Kim Jong Un health, including critical condition &amp; death is spreading in North Korea,with a DailyNK source in North Hamgyong Province explaining that North Korean authorities are now making no such move to silence any rumours. Earlier they were trying to quash rumours","3435649113"
"Thu Apr 30 22:04:32 +0000 2020","https://twitter.com/genieuntamed/status/1255981386340675589","@U2Brutus_off 
Is North Korean Dictator Kim Jong-Un is dead or is he well and eating Uppuma at Apollo Hospital branch at Korea","1253077740821131267"
"Thu Apr 30 07:39:06 +0000 2020","https://twitter.com/The_Daily_NK/status/1255763595310305280","Rumors of North Korean leader Kim Jong Un's illness or even demise in the Sino-North Korean border region are spreading, but local authorities - strangely - are making little effort to squash them. https://t.co/ywjOVDa3Sf #DPRK #NorthKorea https://t.co/YKncJ7WvTa","1342068500"
"Thu Apr 30 22:01:28 +0000 2020","https://twitter.com/ChunxOfEarth/status/1255980614085480448","@GOP @SeemaCMS I notice she failed to mention American lives. So whose lives did he save? North Koreans? Russians? Who?","317979614"
"Thu Apr 30 22:01:26 +0000 2020","https://twitter.com/kirito_off1cial/status/1255980606875471872","North Korean teems when they log into their computer and acces to the internet for the first time: https://t.co/vql5XowLVY","1241146361875181571"
"Thu Apr 30 07:14:26 +0000 2020","https://twitter.com/teluguztv/status/1255757385899089921","Where is Kim Jong un? Why the whereabouts of North Korean leader remain a mystery https://t.co/BC3KDF2XMq","797867881799163905"
"Thu Apr 30 22:01:05 +0000 2020","https://twitter.com/CherokeeBaron/status/1255980517809414144","@Snack8671 @sheila06942158 YOU CAN'T! IT'S PRIVATE PARK OF NORTH KOREAN DIC KIM! THAT'S REALLY WHAT HAPPENED/WHY GONE! CHINA BIRD DRONE GRABBED HIM MID AIR! NOW CHINA CAN PUT KIM'S SISTER ON THRONE. KIM'S GONE BYE BYE! ""I'll fly away ol' Glory! I'll fly away!""","4799082093"
"Thu Apr 30 07:06:12 +0000 2020","https://twitter.com/manatelugu/status/1255755316257570818","Please Checkout this news - Where is Kim Jong un? Why the whereabouts of North Korean leader remain a mystery https://t.co/S41dMy0PJh https://t.co/3SAfda35PD","309353206"
"Thu Apr 30 22:00:59 +0000 2020","https://twitter.com/vomaustralia/status/1255980495126568960","Deacon Jang Moon Seok, who ministered to North Koreans in Changbai, China spent his 2,000th day in a prison inside of North Korea while co-workers mobilised a global letter writing campaign urging his release https://t.co/5vyHWXnWDF
#NorthKorea #DeaconJang #VOMAus https://t.co/CavWFjhENq","920007822"
"Thu Apr 30 07:05:46 +0000 2020","https://twitter.com/stand_4_america/status/1255755206379409408","South Korean officials caution against reports North Korean leader Kim ill North Korean leader Kim Jong Un visits a https://t.co/JlORhUW1x7","918188324426194944"
"Thu Apr 30 21:55:34 +0000 2020","https://twitter.com/oldwhat/status/1255979129641373696","North Korean doctors don’t dare tell Kim Jong-un he’s dead: Medical staff at North Korea's only hospital are avoiding telling the Beloved Dictator that he has been dead for almost three days, according to reports this morning. https://t.co/kL9oU5hQ7h https://t.co/z77SNjJzoW","236450129"
"Thu Apr 30 07:02:22 +0000 2020","https://twitter.com/cyoungIII/status/1255754351932473346","wvstatejournal: SPECULATION OF KIM JONG UN'S health continues as the North Korean leader has not made a public appearance in over two weeks. Read more here: https://t.co/ZxriMmzk4o https://t.co/pnDPR0xsdW","338767521"
"Thu Apr 30 21:53:52 +0000 2020","https://twitter.com/CherokeeBaron/status/1255978701696708610","@humpleupagus @jolovescandles ACTUALLY:  NORTH KOREAN DIC......TOOK A PRIVATE VACATION..... CHINA BIRD DRONE GRABBED HIM MID AIR &amp; 'EXTRICATED THE BLOB'. SO NOW, CHINA CAN PUT DIC'S LITTLE SISTER ON 'THRONE' OVER NTH K!  JUST ALL IN THE FAMILY FUN! lolololo story now completed tweet @POTUS","4799082093"
"Thu Apr 30 07:00:11 +0000 2020","https://twitter.com/newslabpk/status/1255753799005847553","The United States has caught no sight of North Korean leader Kim Jong Un and is watching reports about his health, U.S. Secretary of...","978688893448085504"
"Thu Apr 30 21:53:12 +0000 2020","https://twitter.com/MoeMaestasNM/status/1255978536621404160","Our President is more loyal to an authoritarian regime than he is to the USA. Keeping Kim’s death a secret from North Korean people so dictator family can get better organized.  #Resist #KimJungUnDead","96215615"
"Thu Apr 30 06:23:42 +0000 2020","https://twitter.com/letangcult/status/1255744619196940288","@kingling43 Google news had piece on Kim Jong Un's health
Directed me to North Korean watch site, 38 North
38 North tweeted out a video by NY Times on how they know what's going on there
I figured ""why not check out their news sites to see if it's as crazy as they're said to be""","114116547"
"Thu Apr 30 21:50:44 +0000 2020","https://twitter.com/TioMadden/status/1255977916602683392","@EASPORTS All American when receiving government welfare. All North Korean when left to their own devices.","699923629828653056"
"Thu Apr 30 06:17:11 +0000 2020","https://twitter.com/IBTimesSG/status/1255742978653470720","Kim Jong Un paralysed? Source claims North Korean leader is physically impaired

#KimJong #KimJongUnAlive 

https://t.co/WPL0fy2PMY","711844276569681920"
"Thu Apr 30 21:50:36 +0000 2020","https://twitter.com/bigphilyniners/status/1255977880288403456","@Acyn His North Korean friends are more important to him than the American people","1238065679120699394"
"Thu Apr 30 06:15:58 +0000 2020","https://twitter.com/manatelugumovie/status/1255742671794159616","Where is Kim Jong un? Why the whereabouts of North Korean leader remain a mystery: Watch… https://t.co/mK1t6ZYJQS","107131431"
"Thu Apr 30 21:50:04 +0000 2020","https://twitter.com/lklinks/status/1255977747156877312","Online lecture: North Korean Ghost Ships https://t.co/URPF4RGqvZ https://t.co/8qTg5n9V52","43688850"
"Thu Apr 30 06:14:46 +0000 2020","https://twitter.com/punjabi_tech/status/1255742371440009218","Is Kim Jong Un alive or dead? North Korean defector made such a claim | किम जोंग जिंदा है या मर गया? उत्तर कोरियाई डिफेक्टर ने किया ये ऐसा दावा https://t.co/qmmK4Y5Krv","707539472376659968"
"Thu Apr 30 21:48:12 +0000 2020","https://twitter.com/IHadANightmare/status/1255977276497367044","I  have  a  dream  that  North Koreans will be  acceptable for their  criminal record not their liver function","3905492750"
"Thu Apr 30 06:00:00 +0000 2020","https://twitter.com/KTULNews/status/1255738656704401408","New rumors about Kim Jong Un pour in daily. The North Korean leader is dead. Or he’s very ill. Or maybe he’s just recuperating in his luxury compound, or isolating himself from the coronavirus. https://t.co/Pae9WKOlNH","15145111"
"Thu Apr 30 21:48:05 +0000 2020","https://twitter.com/RabidBadger/status/1255977246600421378","Remember that dramatic video of the North Korean soldier who got shot 5 times while he raced across the border and was rescued by South Koreans and was found to have 11 inch worms in him because Un feeds his troops vile crap?","14426487"
"Thu Apr 30 21:44:22 +0000 2020","https://twitter.com/Rhiesooyoung/status/1255976312461647873","@Baddiel The Jin-mi's family was also put in by the authorities and I don't think they were punished because they acted as they were told. The officials who were monitoring the filming site must have been punished. What North Koreans need most now is freedom, human rights and truth.","266985281"
"Thu Apr 30 05:50:30 +0000 2020","https://twitter.com/NewsBFM/status/1255736263774101504","Satellite images have indicated activity near Wonsan involving luxury boats frequently used by Kim Jong Un, adding legs to suggestions that the North Korean leader is at a coastal villa in the area, amid speculations about his health and absence from the public eye. https://t.co/TKxvL1H7hq","296694466"
"Thu Apr 30 21:39:50 +0000 2020","https://twitter.com/sahilkapur/status/1255975169832685568","Trump suggests he knows what’s going on with the North Korean strongman but “I just can’t talk about Kim Jong-un right now.”

“I do understand the situation very well,” Trump says when asked if Kim is dead or alive.","19847765"
"Thu Apr 30 21:39:04 +0000 2020","https://twitter.com/SashaIngber/status/1255974978635411458","New from me: As speculation persists over the health of Kim Jong Un (dead? injured? sick? recovering from surgery?), I spoke with a few North Koreans who defected. ""Everyone wishes, hopes, that he's really dead,"" one defector told me. Watch it at @Newsy https://t.co/2oxpzV72tb https://t.co/mQTlghNocv","1028436924"
"Thu Apr 30 05:32:44 +0000 2020","https://twitter.com/GraviolaDOTfi/status/1255731794915340289","North Korean leader Kim Jong Un's train spotted while he remains out of sight | 1 HOUR AGO
- Kim hasn't appeared in North Korean state media since April 12
 https://t.co/pN6Y2TmPCp","2737343664"
"Thu Apr 30 21:38:35 +0000 2020","https://twitter.com/RadioFreeTom/status/1255974855830384644","Update on the North Korean leader? “I understand the situation, but I can’t talk about it.“","459872442"
"Thu Apr 30 21:36:50 +0000 2020","https://twitter.com/GoneAnon0/status/1255974414887391233","@ThomasEWoods North Korean level propaganda, here!","38801229"
"Thu Apr 30 05:24:39 +0000 2020","https://twitter.com/JayHyukChang1/status/1255729759255883776","Dead or alive? North Korean leader Kim Jong Un captivates the world amid a pandemic https://t.co/E25eAQRtBh #CPOL120 @hollisemetko","1217509949867163649"
"Thu Apr 30 21:34:14 +0000 2020","https://twitter.com/WtAw1/status/1255973764283727872","The US and South Korea launched six North Korean spy planes https://t.co/fbo4jqMjdZ https://t.co/t4qa5H5Xew","2260627878"
"Thu Apr 30 05:03:12 +0000 2020","https://twitter.com/STForeignDesk/status/1255724359353851906","North Korean leader Kim Jong Un's train spotted while he remains out of sight https://t.co/oioeINIXtf","1131352537"
"Thu Apr 30 21:32:28 +0000 2020","https://twitter.com/AeromaticTV/status/1255973316583665667","I’ll admit there’s a lot of bad Anti- North Korean propaganda, but let’s not pretend that they’re some innocent workers paradise","728689892373499905"
"Thu Apr 30 04:59:15 +0000 2020","https://twitter.com/straits_times/status/1255723364821368834","North Korean leader Kim Jong Un's train spotted while he remains out of sight https://t.co/n2qneYvWb8","37874853"
"Thu Apr 30 21:31:29 +0000 2020","https://twitter.com/snakhooda/status/1255973069082025987","@AhmedTheArab And his fans are already on the verge of tears (of happiness). If he were no more they will shed tears (of sadness) for two generations. North Koreans can outcry anyone.","255917806"
"Thu Apr 30 04:40:25 +0000 2020","https://twitter.com/khpintl/status/1255718627879186432","Kim Jong Un ‘cannot stand up by himself or walk properly’ – North Korean defector claims amid rumours the dictator is dead or seriously ill https://t.co/g7prsAOos0 https://t.co/ZbYaDsnRaF","810850107713290243"
"Thu Apr 30 21:30:13 +0000 2020","https://twitter.com/Timepas29159619/status/1255972752256913414","@zoo_bear @WhiteHouse looks like north korean tv...","1154094293872545792"
"Thu Apr 30 04:32:51 +0000 2020","https://twitter.com/bpolitics/status/1255716724135133184","Kim Jong Un's train spotted while North Korean leader remains out of sight https://t.co/HTi3iImOLO","564111558"
"Thu Apr 30 21:29:53 +0000 2020","https://twitter.com/DrRadchenko/status/1255972666927955976","An interesting British document on how the North Koreans handled the succession crisis in 1994, when Kim Il Sung died. Thought I'd post it here. Not because I believe that #KIMJONGUNDEAD - I don't have a clue. But if he did die,  we'd face a similar set of issues. https://t.co/eRDpFbFkja","2313633876"
"Thu Apr 30 04:17:31 +0000 2020","https://twitter.com/ShimonCoen/status/1255712865706635264","""Unconfirmed reports about Kim Jong Un’s health have been shrouded in even more than the customary North Korean murkiness. But out of the fog of questions, one name keeps cropping up as policymakers and analysts contemplate who else might lead the reclusive nuclear-armed nation:","1213913347373928448"
"Thu Apr 30 21:24:23 +0000 2020","https://twitter.com/inside_nk/status/1255971282031726592","It’s a new month, but North Korean leader Kim Jong Un is still not pictured in state newspapers this morning. Not seen publicly since April 11.","3435649113"
"Thu Apr 30 04:08:13 +0000 2020","https://twitter.com/anfranchise/status/1255710524626460672","Kim jong un executes infected people but doesnt kill himself when he got sick! Its tike to wake up the north koreans. They are brainwashed by a self-centered mentally unabled person.","1016319236333899776"
"Thu Apr 30 21:20:51 +0000 2020","https://twitter.com/gouldina/status/1255970395745923075","Take a little trip through @bbclaurak's timeline and tell me that this isn't like Russian/Chinese/North Korean state broadcasting.

No mention of the Panorama prog. No mention that the UK are going to have the highest numbers of Covid deaths shortly. No criticism. Baby! Shh!","394648240"
"Thu Apr 30 04:08:09 +0000 2020","https://twitter.com/dcexaminer/status/1255710508537335808","The US has yet to spot Kim Jong Un, said @SecPompeo, as rumors that the North Korean leader's health is deteriorating swirl. 

""There is a real risk that there will be a famine, a food shortage, inside of North Korea.""

https://t.co/2aNBDAjbrz","18956073"
"Thu Apr 30 21:18:06 +0000 2020","https://twitter.com/AlbeGianNG/status/1255969703614447616","@belencarlino84 @infobae *laughs in north korean dictator*","890406139900383232"
"Thu Apr 30 04:02:20 +0000 2020","https://twitter.com/BloombergAsia/status/1255709044704186374","Kim Jong Un's train spotted while North Korean leader remains out of sight https://t.co/RW1eTtdI3i","588261604"
"Thu Apr 30 03:54:42 +0000 2020","https://twitter.com/CanBizJournal/status/1255707121552891907","Kim Jong Un's personal train was seen in transit by satellite reconnaissance on Wednesday. However the North Korean leader was not seen entering or exiting the train.","41932899"
"Thu Apr 30 21:17:06 +0000 2020","https://twitter.com/NKoreanInsight/status/1255969449686990850","UN Has No Information on North Korean Leader Kim Jong-un's Health, Guterres Says https://t.co/NRwx3hWQn5","926820199080247297"
"Thu Apr 30 03:41:57 +0000 2020","https://twitter.com/business/status/1255703913526935554","Kim Jong Un's train spotted while North Korean leader remains out of sight https://t.co/X21Lmp6ppl","34713362"
"Thu Apr 30 21:15:24 +0000 2020","https://twitter.com/NaoChoccy/status/1255969023403143168","@macejrm @peta Yeah, this is probably as credible as the north korean government making an article about how great north korea is compared to the world. Peta is a sorry excuse of a animals rights group, and anyone working for them, and caring about animals, should search for other means.","2955446915"
"Thu Apr 30 02:51:11 +0000 2020","https://twitter.com/LandesOne/status/1255691139576971269","Kim Jong Un 'cannot stand up by himself or walk properly', North Korean defector claims https://t.co/h0gf4bchyS","444878297"
"Thu Apr 30 21:15:17 +0000 2020","https://twitter.com/CyberBolshie/status/1255968991836647426","@Jake_Hanrahan Isee this more of an some alternative to see the nort korean government. North Korea for me is still a totalitarian regime, but this kind of dictatorship wouldn't apear if isn't because of the imperialist embargo too an anti-imperialist country that force them to be isolated.","1068738449455276032"
"Thu Apr 30 21:13:16 +0000 2020","https://twitter.com/mingilesbian/status/1255968487891140608","north koreans are literally getting smaller generation by generation because of the severe lack of healthcare and nutrition, people get killed for the dumbest shit just because the government doesn’t like it but yeah hot lady villain amiright","1216774502685855746"
"Thu Apr 30 02:50:26 +0000 2020","https://twitter.com/JasTaylor15/status/1255690947301715968","Satellite images of luxury boats 'suggest Kim Jong Un is in North Korean coastal resort' https://t.co/KTR6LDeu4R","1225476898458873856"
"Thu Apr 30 02:41:46 +0000 2020","https://twitter.com/_xs/status/1255688767324684296","South Korea North Korean leader Kim Jong Un https://t.co/v3GNAnKBYJ","450187541"
"Thu Apr 30 21:12:00 +0000 2020","https://twitter.com/hrrgorman/status/1255968166305357824","#TheMerryWriter D30 - Teleported randomly to anywhere in the world or be in 6 hours of traffic 1/year? 

6 hour traffic, because I won't end up in the middle of the ocean or a North Korean gulag.","3002584598"
"Thu Apr 30 02:38:07 +0000 2020","https://twitter.com/ABCWorldNews/status/1255687851255173120","Nearly three weeks since North Korea's Kim Jong Un was last seen in public, Pres. Trump and senior South Korean leaders are downplaying or even outright dismissing reports about his condition. https://t.co/xRGHf0cH4P","86141342"
"Thu Apr 30 21:09:00 +0000 2020","https://twitter.com/masspeaceaction/status/1255967413973155847","Instead of speculating on North Korean palace intrigue, we would all be better off finding ways to improve U.S.-North Korea relations.

North Korea and America Need Reconciliation—Not Endless Kim Jong-Un Death Rumors

@christineahn and Catherine Killough
 https://t.co/GHosLAPnAD","153537041"
"Thu Apr 30 02:30:32 +0000 2020","https://twitter.com/AnalyticaGlobal/status/1255685941798359040","Kim Jong Un 'cannot stand up by himself or walk properly', North Korean defector claims https://t.co/Li3qivvIoB","3059457425"
