"created_at","url","full_text","user_id_str"
"Mon Aug 31 19:42:58 +0000 2020","https://twitter.com/BitcoinNYSC/status/1300519470469914625","A #Bitcoin wallet allegedly used by #North #Korean hackers to launder #money just transferred 12 #BTC, apparently from #crypto #exchange #Huobi.

https://t.co/3SmGStSOj7","1259485431206416392"
"Thu Aug 27 06:50:56 +0000 2020","https://twitter.com/AjayStfc/status/1298875628167376898","Kim Jong Un news: What’s going on with North Korean leader Kim Jong Un? | World News – Times of India https://t.co/arA4ABUka8","544115226"
"Thu Aug 27 06:47:40 +0000 2020","https://twitter.com/TimeNagpur/status/1298874805219995649","What’s going on with North Korean leader Kim Jong Un? https://t.co/NeIy5TKCg5","1297433628851359745"
"Mon Aug 31 19:32:12 +0000 2020","https://twitter.com/BitcoinNYSC/status/1300516760291020803","A #cryptocurrency wallet that the #United #States Department of Justice (#DoJ) believes is linked to the #North #Korean hackers has released nearly $140,000 in #Bitcoin.

https://t.co/JJCfUkPAFx","1259485431206416392"
"Thu Aug 27 05:51:23 +0000 2020","https://twitter.com/Priyabr75089184/status/1298860643014062080","What’s going on with North Korean leader Kim Jong Un? World News Headlines, Latest International News, World Breaking News - Times of India https://t.co/SU9gpFOimG","1177739390325424128"
"Mon Aug 31 19:30:29 +0000 2020","https://twitter.com/W1redVanilla/status/1300516326969049089","I don’t really buy that the North Korean clowns including the Garfield looking one that got into the commandeered kicks are really the North Korean geological survey anymore.
It’s true that what they did was they looked for natural gas using ground penetrating radar.","3008024567"
"Thu Aug 27 05:36:32 +0000 2020","https://twitter.com/InvestorsDiurn1/status/1298856906505613312","#WorldNews What’s going on with North Korean leader Kim Jong Un? https://t.co/yLMSxaIvXv","1289978480646672384"
"Mon Aug 31 19:25:56 +0000 2020","https://twitter.com/CedricChetaille/status/1300515180728778758","In an uncertain world where Chinese, Russian and North-Korean nuclear arsenals are growing or upgrading, do you think the US nuclear supremacy is a factor of stability and security?","1170791722126905344"
"Mon Aug 31 19:24:53 +0000 2020","https://twitter.com/klkolz/status/1300514917544587272","More from Melania pal's book: Trump wanted inauguration to be like North Korean military parade https://t.co/8HFiwHevHp","322354051"
"Thu Aug 27 05:27:01 +0000 2020","https://twitter.com/timesofindia/status/1298854509725093888","What’s going on with North Korean leader Kim Jong Un?

What’s going on with Kim Jong Un? Is he sick? Worried about Covid-19? Consumed by an economic crisis? Battling internal threats?

Read--https://t.co/9EKZDuOPyQ https://t.co/7wXlzPRGdq","134758540"
"Mon Aug 31 19:24:13 +0000 2020","https://twitter.com/MatthewRavenhil/status/1300514748631580672","@nathanjoseph198 @Zokko18 @Narla5221 Like thoses nice Picturs books showing Great Leader leading little children out on dangour that are in North Korean schools","1724850223"
"Thu Aug 27 05:22:36 +0000 2020","https://twitter.com/ZyiteGadgets/status/1298853397236289537","What’s going on with North Korean leader Kim Jong Un? https://t.co/ejJUvHlvDn https://t.co/jHZCee7apx","1596829382"
"Mon Aug 31 19:23:29 +0000 2020","https://twitter.com/CedricChetaille/status/1300514565839609856","@mattkorda Possible question: in an uncertain world where Chinese, Russian and North-Korean nuclear arsenals are growing, do you think the US nuclear supremacy is a factor of stability and security?","1170791722126905344"
"Mon Aug 31 19:21:30 +0000 2020","https://twitter.com/ThatsFare/status/1300514064695779335","@cmarinucci @DevinCow @DevinNunes @KMJNOW Nunes's buddy seems to like that ""sick demonic place"". Maybe Trump could just ask his North Korean pen pal what they are up to. https://t.co/9KhoJd5gTQ","1221937025579921409"
"Thu Aug 27 05:20:32 +0000 2020","https://twitter.com/TOITopStories/status/1298852878900027392","What’s going on with North Korean leader Kim Jong Un? https://t.co/7YRMTXPKrq","29955899"
"Mon Aug 31 19:16:31 +0000 2020","https://twitter.com/donaldc9559/status/1300512812138213378","More from Melania pal's book: Trump wanted inauguration to be like North Korean military parade https://t.co/Zt3Q7EAV3b","3342360381"
"Thu Aug 27 05:19:32 +0000 2020","https://twitter.com/GroundNews_/status/1298852627619262464","North Korean leader Kim Jong un  क्या मर गया ? आपातकालीन बैठक  bulwayi gayi😱

Do watch the video and do like, share and subscribe our YouTube Channel💯

https://t.co/keYbUg2jG9","1269166129047433216"
"Mon Aug 31 19:15:34 +0000 2020","https://twitter.com/cydereal/status/1300512572207063040","I hadn't heard the audio from Kimberly Guilfoyle freaking out at the RNC. Truly North Korean shit.","19828543"
"Thu Aug 27 05:19:22 +0000 2020","https://twitter.com/VMediaNetwork1/status/1298852586188156930","Kim Jong Un news: What’s going on with North Korean leader Kim Jong Un? | World News – Times of India https://t.co/gPoVOmii4H","1287409392095072256"
"Mon Aug 31 19:10:41 +0000 2020","https://twitter.com/diamondlilron/status/1300511345310420997","More from Melania pal's book: Trump wanted inauguration to be like North Korean military parade...tRUMP’s a narcissistic. DUMB NUMPTY https://t.co/K8uCZQPVGy","584007100"
"Thu Aug 27 05:06:39 +0000 2020","https://twitter.com/ltravel395/status/1298849383707029504","Kim Jong Un news: What’s going on with North Korean leader Kim Jong Un? | World News – Times of India https://t.co/qhqXFLC5BS","995883804257480704"
"Mon Aug 31 19:06:16 +0000 2020","https://twitter.com/hudsonsuzanne2/status/1300510234373480448","North Korean Defector Exposes Kim Jong Un &amp; China https://t.co/W3nLV1DKfF via @YouTube","727283264285761538"
"Mon Aug 31 19:05:02 +0000 2020","https://twitter.com/Askcyber01/status/1300509921549725701","LinkedIn Used in North Korean Phishing Attack https://t.co/JdXufop7Ll https://t.co/kge7fyfNCg","846422166652534784"
"Thu Aug 27 04:53:37 +0000 2020","https://twitter.com/AndyVermaut/status/1298846103035498497","What’s going on with North Korean leader Kim Jong Un? https://t.co/znE3IZTFBC https://t.co/c5S26nZVKP","283604227"
"Mon Aug 31 19:01:25 +0000 2020","https://twitter.com/WilliamJRapp1/status/1300509010664345603","More from Melania pal's book: Trump wanted inauguration to be like North Korean military parade https://t.co/8XOoYgvNGW TWITTERELLA IS IN LOVE WITH NORTH KOREAN LEADER  . RUMOR HAS IT THAT HE IS LEAVING HIS WIFE FOR KIM .........","954360164269903872"
"Thu Aug 27 04:45:15 +0000 2020","https://twitter.com/TOIWorld/status/1298844000619655168","What’s going on with North Korean leader Kim Jong Un? https://t.co/JlWlpUmbIz","29959618"
"Mon Aug 31 19:00:38 +0000 2020","https://twitter.com/AriPakarinen/status/1300508814639337474","@Atrumphater @sdr_medco @realDonaldTrump He wan’t to people in USA have same behavior as North Koreans to they leader...what you think? Voting time in 8 weeks #BidenHarris2020","209682332"
"Thu Aug 27 03:06:37 +0000 2020","https://twitter.com/GeneFarland/status/1298819179374473216","North Korean Defector Exposes Kim Jong Un &amp; China https://t.co/HLvSEhn04h via @YouTube","938270571120418816"
"Mon Aug 31 19:00:09 +0000 2020","https://twitter.com/Gate_15_Analyst/status/1300508694774513665","The BLINDINGCAN RAT and Malicious North Korean Activity https://t.co/DypeE6aL7J #cybersecurity","2478688363"
"Thu Aug 27 02:29:25 +0000 2020","https://twitter.com/vajapeyam/status/1298809817931247616","#KimYooJung 
What is Kim Jong Un's sister's role in North Korean politics? Top South Korean officials appear divided - CNN
https://t.co/33yBoAd0qR","1343382872"
"Mon Aug 31 18:59:35 +0000 2020","https://twitter.com/bigmanufacturer/status/1300508552562434048","@Rogpod13 @Bone_Vampire42 @existentialcoms The comparison that should be made here is between life as a korean under Japanese colonialism and life as a North Korean once they managed to rebuild after the war.","1464194598"
"Mon Aug 31 18:53:56 +0000 2020","https://twitter.com/ayu_chang_tw/status/1300507127186825216","Japanese has a cruel experience from the anti-Japanese South Korean and North Korean who lives in Japan. 拡散希望　#拡散希望","131422893"
"Thu Aug 27 02:12:02 +0000 2020","https://twitter.com/joshuaw89596673/status/1298805440684290050","North Korean Defector Exposes Kim Jong Un &amp; China https://t.co/ADoGQrGjUx via @YouTube","1161919417774510080"
"Mon Aug 31 18:53:32 +0000 2020","https://twitter.com/blueteamsec1/status/1300507028025044992","United States Files Complaint to Forfeit 280 Cryptocurrency Accounts Tied to Hacks of Two Exchanges by North Korean Actors | USAO-DC https://t.co/Z2zsm4rzFk #cyber #threathunting #infosec","1106654670246871047"
"Thu Aug 27 01:45:16 +0000 2020","https://twitter.com/flagboy140654/status/1298798703701090304","North Korean leader Kim Jong Un sounds alarm about coronavirus, typhoon https://t.co/HsV8AT7jc6","285305829"
"Thu Aug 27 01:45:10 +0000 2020","https://twitter.com/politicalb1/status/1298798681177460737","Here's your Nth Korea SPANKY
North Korean Defector Exposes Kim Jong Un &amp; China https://t.co/6VCTIMtmnW via @YouTube","1264695118201622528"
"Mon Aug 31 18:52:02 +0000 2020","https://twitter.com/TsurkanKate/status/1300506651624169473","all I can manage to read lately is non-fiction—memoir of a North Korean defector, Habsburg love tragedy, lives of the Curzon sisters... feels like my brain is filled with static","1235226931244797952"
"Mon Aug 31 18:51:36 +0000 2020","https://twitter.com/NealSinghStar/status/1300506541125038080","interesting AI Helped Uncover Chinese Boats Hiding in North Korean Waters https://t.co/3LcZGI64Qc https://t.co/jjM2JdmbuB","252232955"
"Thu Aug 27 01:02:46 +0000 2020","https://twitter.com/politicalb1/status/1298788010289328128","North Korean Defector Exposes Kim Jong Un &amp; China https://t.co/6VCTIMtmnW via @YouTube","1264695118201622528"
"Mon Aug 31 18:48:40 +0000 2020","https://twitter.com/Whitetiger7901/status/1300505805020631044","To the fire by praising these terrorist organizations. Trump is a racist. Trump wanted a North Korean style parade! Mr. Biden, I’m begging you to get down n dirty with these games he’s playing! Please. I know you probably will never see this tweet, but I’m trying to help. 🙏🏻🇺🇸","1254871853396623361"
"Thu Aug 27 00:27:40 +0000 2020","https://twitter.com/An3ita5/status/1298779176535764993","North Korea 

What’s the status of Kim Yo Jong, Kim Jong Un’s powerful sister? Officials in Seoul say the North Korean leader’s younger sibling is effectively running one of the most important political bodies in the country -- the Organization and Guidance Department of Nort","792723840405233672"
"Wed Aug 26 23:36:04 +0000 2020","https://twitter.com/StigmabaseU/status/1298766192258121728","KR | NRoom — North Korea Doesn't Trust China to Protect It: When North Korean leader Kim Jong Un and Chinese President Xi Jinping met for the first time in March 2018, the official topics of discussion were ... View article... https://t.co/2qufhswdyd","208056970"
"Mon Aug 31 18:35:50 +0000 2020","https://twitter.com/light913589209/status/1300502572701290496","Has the North Korean leader really died or is he in a coma ... his sister is ready to take power !!
https://t.co/PuaoICBL8q","1285322749985148937"
"Mon Aug 31 18:28:44 +0000 2020","https://twitter.com/willapercy/status/1300500786548543488","More from Melania pal's book: Trump wanted inauguration to be like North Korean military parade https://t.co/4OXiUvk23l","2429612832"
"Wed Aug 26 21:52:28 +0000 2020","https://twitter.com/Gael_1916/status/1298740120347123712","@LinaArabii How many alleged comas has the Swiss educated North Korean Kim Jong Un been in now? 6?","1093330075"
"Mon Aug 31 18:28:14 +0000 2020","https://twitter.com/NKMESSENGER/status/1300500663516921856","International Conference on North Korean Women-Society by The Center for Korean Women &amp; Politics. Hope there will be more events like these by women's groups in South Korea. 여성정치연구소 ‘북한여성사회연구 온라인 국제학술회의 https://t.co/pLU8F1JnRN via 
@YouTube","258194985"
"Wed Aug 26 21:51:35 +0000 2020","https://twitter.com/gregsandiego/status/1298739898514468864","You know that CNN is struggling to make this a Trump story... 

Kim Jong Un's sister may have taken over a key North Korean post, South Korean officials say - CNN https://t.co/4DUDvot2Cw via @GoogleNews","15308621"
"Wed Aug 26 21:38:04 +0000 2020","https://twitter.com/iowa_ames/status/1298736494387933184","North Korea releases new Kim Jong Un photos amid reports he's in a coma - New York Post: * North Korea releases new Kim Jong Un photos amid reports he's in a coma  New York Post * What is Kim Yo Jong's exact role in North Korean politics? Top South… https://t.co/Quobe5kpOM","1029128888"
"Mon Aug 31 18:28:03 +0000 2020","https://twitter.com/TeriRadichel/status/1300500615555031040","The attacks followed the same pattern, with North Korean hackers posing as recruiters at big corporations in order to approach employees at the desired companies. Followed by Office or PDF documents. https://t.co/KvRtKMZTQY","25560338"
"Wed Aug 26 21:34:52 +0000 2020","https://twitter.com/stigmabase/status/1298735691518693377","한국말 | #Stigmabase — When North Korean leader Kim Jong Un and Chinese President Xi Jinping met for the first time… https://t.co/C6b55r1zgM","185789961"
"Mon Aug 31 18:27:06 +0000 2020","https://twitter.com/imnicetoday/status/1300500374638350337","More from Melania pal's book: Trump wanted inauguration to be like North Korean military parade https://t.co/bPimw4tK6H","4453044802"
"Wed Aug 26 21:10:03 +0000 2020","https://twitter.com/stigmabase/status/1298729445285662721","A | #교육 :  When North Korean leader Kim Jong Un and Chinese President Xi Jinping met for the first time in March… https://t.co/AlEt6jtwuv","185789961"
"Mon Aug 31 18:19:04 +0000 2020","https://twitter.com/sant_aud/status/1300498352589725697","WEIRD WEIRD WEIRD:  More from Melania pal's book: Trump wanted inauguration to be like North Korean military parade https://t.co/843rzwptqc","993830434151845888"
"Wed Aug 26 21:10:01 +0000 2020","https://twitter.com/StigmabaseA/status/1298729437853364224","Newsroom | 한국말 :  When North Korean leader Kim Jong Un and Chinese President Xi Jinping met for the first time in… https://t.co/8akrl1h2MC","149585330"
"Mon Aug 31 18:16:21 +0000 2020","https://twitter.com/homelandprep/status/1300497670063230978","“North Korean cyber actors have demonstrated an imaginative knack for adjusting their tactics to exploit the financial sector as well as any other sector through illicit cyber operations,” @CISAgov's Bryan Ware said. 
https://t.co/FvZWBxNUV3","4745397989"
"Wed Aug 26 21:10:01 +0000 2020","https://twitter.com/StigmabaseA/status/1298729434556649474","Newsroom | 한국말 :  When North Korean leader Kim Jong Un and Chinese President Xi Jinping met for the first time in… https://t.co/oVhiUV7BUi","149585330"
"Mon Aug 31 18:15:40 +0000 2020","https://twitter.com/homelandprep/status/1300497498168061952",".@CISAgov, @FBI warns about North Korean cyberthreat on ATMs https://t.co/FvZWBxNUV3","4745397989"
"Wed Aug 26 20:56:57 +0000 2020","https://twitter.com/AgnesFitz08/status/1298726149686583296","North Korean Defector Exposes Kim Jong Un &amp; China https://t.co/5q8VtMtDlH via @YouTube please listen to this one of best speaker I have ever heard","857592879732207617"
"Wed Aug 26 20:32:26 +0000 2020","https://twitter.com/shirley42842516/status/1298719977441120259","North Korean Defector Exposes Kim Jong Un &amp; China https://t.co/X4wsU2iIB0 via @YouTube","1019742955102441473"
"Mon Aug 31 18:11:06 +0000 2020","https://twitter.com/tracette761/status/1300496350484848640","More from Melania pal's book: Trump wanted inauguration to be like North Korean military parade https://t.co/mzbIi8y806","44171614"
"Wed Aug 26 20:07:58 +0000 2020","https://twitter.com/inside_nk/status/1298713820295127041","State TV giving North Koreans update of the typhoon that will hit the country. Kim Jong Un &amp; officials had meetings preparing the nation.","3435649113"
"Mon Aug 31 18:09:21 +0000 2020","https://twitter.com/seyraud/status/1300495908434518023","US sues to recover #cryptocurrency funds stolen by North Korean hackers | ZDNet https://t.co/qUysiyGCWC","351945246"
"Wed Aug 26 19:52:02 +0000 2020","https://twitter.com/VictoriaSerbia/status/1298709810431459329","North Korean Defector Exposes Kim Jong Un &amp; China https://t.co/mvxaCOxXni via @YouTube","4877253495"
"Mon Aug 31 18:08:07 +0000 2020","https://twitter.com/moochie81/status/1300495600350265344","More from Melania pal's book: Trump wanted inauguration to be like North Korean military parade https://t.co/ArktuLp1jt","129655414"
"Wed Aug 26 19:42:25 +0000 2020","https://twitter.com/Dailyonline6/status/1298707389034700801","What is Kim Jong Un’s sister’s role in North Korean politics? Top South Korean officials appear divided https://t.co/OpHQWK3j5H","1282922425714266112"
"Mon Aug 31 18:07:12 +0000 2020","https://twitter.com/AbbaShet/status/1300495366652035073","A new book claims Donald Trump wanted his inauguration to resemble a North Korean military parade as he continue telling his supporters Joe Biden will make America Socialist Country https://t.co/LAVPNpeHcD","41656445"
"Mon Aug 31 18:02:44 +0000 2020","https://twitter.com/deNutrients/status/1300494244700975104","@OldSoulLegend @Power79646739 @btcBiff @YellowCube7 The belly button, stem cell part is a new/old discovery that is still not accepted by Western medicine. 
North Korean's work in the 60's was suppressed there. 
Primo vascular system - preceded lymph &amp; blood vessel development in the embryo. History  https://t.co/cGgRBR8JZ1","400469021"
"Wed Aug 26 19:18:03 +0000 2020","https://twitter.com/gordonkphil/status/1298701257796980737","Kim Jong Un's sister Kim Yo Jong may have taken over a key North Korean post, SK officials say - CNN
https://t.co/KvqGwF18d3","581827043"
"Mon Aug 31 18:01:08 +0000 2020","https://twitter.com/1stKiersten/status/1300493841800269826","More from Melania pal's book: Trump wanted inauguration to be like North Korean military parade https://t.co/EZVobihMDx","819928765480497153"
"Mon Aug 31 17:58:43 +0000 2020","https://twitter.com/SambaLambaDing/status/1300493232845987841","@DiapedUpPipedUp @lilithxrmx @Daoapin2 @KyleTrainEmoji I don't and I am sympathetic to the plight of North Koreans dying under brutal U.S. sanctions. Just don't see why that has to translate into full-throated support for the regime","790345184307326977"
"Wed Aug 26 19:00:47 +0000 2020","https://twitter.com/nknewsorg/status/1298696911965294598","North Korean leader Kim Jong Un and the country’s top officials convened another series of meetings on Aug. 25, reportedly discussing preparations for a typhoon set to make landfall this week. https://t.co/j36oQpZ25k","147017457"
"Wed Aug 26 17:19:26 +0000 2020","https://twitter.com/DovesChild/status/1298671409414250499","North Korean Defector Exposes Kim Jong Un &amp; China https://t.co/l0MCfGozZz via @YouTube","124444346"
"Mon Aug 31 17:58:17 +0000 2020","https://twitter.com/evilvillain1231/status/1300493124654034945","leaked next generation North Korean People's Army uniform designs for 2021. this is real. @USArmy @realDonaldTrump you seen this? https://t.co/Mj3vaZDJK4","1148984025253498880"
"Wed Aug 26 17:15:05 +0000 2020","https://twitter.com/StyleUpNow2017/status/1298670314436558850","What is Kim Jong Un's sister's role in North Korean politics? Top South Korean officials appear divided - https://t.co/3BpQkSicFp -","865884431076044801"
"Mon Aug 31 17:58:06 +0000 2020","https://twitter.com/KOBITV/status/1300493079514722304","In a rare move, North Korean leader Kim Jong-un's regime raised alarm about threats facing the country. https://t.co/lXlvrJH5TY","109641671"
"Wed Aug 26 17:00:01 +0000 2020","https://twitter.com/nknewsorg/status/1298666520902602760","NEW: North Korean leader Kim Jong Un and the country’s top officials convened another series of meetings on Aug. 25, reportedly discussing preparations for a typhoon set to make landfall this week. https://t.co/j36oQpZ25k","147017457"
"Wed Aug 26 16:23:51 +0000 2020","https://twitter.com/dbennett_ks/status/1298657418969337856","I thought this MF was in a coma. “North Korea’s official Korean Central News Agency said that during a ruling party meeting on Tuesday, the country’s leader, Kim Jong Un...”","496256531"
"Mon Aug 31 17:49:44 +0000 2020","https://twitter.com/415holgate/status/1300490973223383041","More from Melania pal's book: Trump wanted inauguration to be like North Korean military parade https://t.co/CskoV47blF","3139235347"
"Wed Aug 26 15:34:05 +0000 2020","https://twitter.com/TmarianG/status/1298644894525857792","(AP) North Korea’s official Korean Central News Agency said that during a ruling party meeting on Tuesday, the country’s leader, Kim Jong Un, called for thorough preparations to minimize casualties and damage from the typhoon. The storm comes weeks","1182966777711595521"
"Mon Aug 31 17:48:12 +0000 2020","https://twitter.com/indigojackal/status/1300490587053977602","I have been hired by the North Korean government to adapt the lyrics to ""Take Me Home, Country Roads."" This, this is what I've been working toward the last several years. 

""Yes it's heaven, North Korea / Changbai Mountains, Ryesong River."" It works!","2911430123"
"Wed Aug 26 15:24:04 +0000 2020","https://twitter.com/NEWSWORLD555/status/1298642375967989765","N. Korea's Kim issues warning on virus as health speculation swirls

North Korean state media on Wednesday showed leader Kim Jong Un at a meeting of a top committee issuing warnings about the coronavirus and a looming…

https://t.co/SSLas0RU02

#News

#BreakingNews

#VietNamNews","1104382519481327616"
"Mon Aug 31 17:42:52 +0000 2020","https://twitter.com/EtherDesk/status/1300489244918521856","Bitcoin Associated To North Korean Hackers Group – EtherDesk Exclusive.
Read More: https://t.co/pJD7HDtZrx
#Bitcoin , #BTC , #NorthKorea , #hacksreview , #hack , #scam , #Frauds , #cryptocurrencies","934296569293213697"
"Wed Aug 26 15:00:01 +0000 2020","https://twitter.com/KTVOTV/status/1298636321443872768","In a rare display of urgency, North Korean leader Kim Jong Un held his third high-level political conference in as many weeks, where he raised alarm about the nation’s coronavirus response and a typhoon forecast to hit the country early Thursday. https://t.co/Yaphk4XcBw","20605323"
"Mon Aug 31 17:42:29 +0000 2020","https://twitter.com/JBruhling/status/1300489148315230213","North Korean karaoke
Just remember if a N. Korean person publicly shared something equivalent to this (patriotic American karoke) they would probably them on site 

""God Bless America"" but know why

https://t.co/NUvwKqSkKl","1000194333637672960"
"Mon Aug 31 17:41:09 +0000 2020","https://twitter.com/RosanesJoseph/status/1300488810732703747","@KutsiErsan @b0nasera @g_efthimiadis @lenaargiri Turkish people are not willing to live as the North Koreans do (starving and undernoursihed). Not even as the Iranians do. As for South Africa, the sanctions worked.","1291449534900469763"
"Wed Aug 26 14:39:00 +0000 2020","https://twitter.com/itsTK07/status/1298631034288795649","BREAKING NEWS!!
North Korean dictator KIM JONG UN has died and eventually he is reborn in India as democracy has died after a 10 day long battle with corrupt leaders nd corrupt government. Military rule to be announced by tomorrow 8 PM.
Stay tuned!
#AntiStudentModiGovt 
#NEET_JEE","775236147706331136"
"Mon Aug 31 17:38:18 +0000 2020","https://twitter.com/BShackalacka/status/1300488094504943619","@ReesusP All these years I would sit back and think , what is wrong with the people of North Korean? Not so much anymore now it’s , what the fuck is  wrong with these people in the USA.","963843249642332162"
"Wed Aug 26 14:32:00 +0000 2020","https://twitter.com/Homeline_Secure/status/1298629272337293312","What is Kim Yo Jong’s exact role in North Korean politics? Top South Korean officials appear divided via OODA Loop - Kim Yo Jong, Kim Jong Un's younger sister, allegedly became the second most powerful North Korean figure ... https://t.co/VHzv5svwPl","19657114"
"Wed Aug 26 14:30:20 +0000 2020","https://twitter.com/sachwlang09/status/1298628854211280897","What is Kim Jong Un’s sister’s role in North Korean politics? Top South Korean officials appear divided https://t.co/iKv6JDtc2I","984729578902929408"
"Mon Aug 31 17:36:22 +0000 2020","https://twitter.com/SharonDomier/status/1300487609580490753","Don’t know who needs to see this but the Internet Archive has a huge collection of North Korean karaoke videos. https://t.co/wINESBCCH0","1416856332"
"Mon Aug 31 17:33:48 +0000 2020","https://twitter.com/hinatadoris/status/1300486963770863621","that girl is KOREAN why are you bringing up north and south east asia??????????????????","1188488303932268555"
"Wed Aug 26 14:26:07 +0000 2020","https://twitter.com/CLNewsOfficial/status/1298627789478858752","What is Kim Jong Un's sister's role in North Korean politics? Top South Korean officials appear divided #clnews #divided #jong #kim...
https://t.co/tFS29GHu3c","1262487549928517635"
"Mon Aug 31 17:32:46 +0000 2020","https://twitter.com/Victor52567750/status/1300486701924724736","@ibecheefin @DanCrenshawTX North Korea invaded South Korea. That's what sparked the Korean War. It's clear you have a utopian world view where everything is all roses and goodwill. That's naive beyond measure","1198974612975112192"
